"links_link","links_reviews_name","links_reviews_title","links_reviews_text","links_reviews_date","links_reviews_purpose"
"https://www.renttherunway.com/pdp/items/JWG100","Jessica","beautiful print! love the tie details at the shoulders.","Beautiful top, but SO big! I normally wear an 8, but rented a 6 after the reviews. It is still huge on me. I really love it, so I'm thinking about renting a 4 to see how it fits. I would order two sizes down!","March 13, 2020","Large"
"https://www.renttherunway.com/pdp/items/ADAMC6","Julie","Print is beautiful in person, but why is this polyester?","I received a lot of compliments on this top. The print is really fun and pretty plus it looks very true to the stock photo. However, there is zero stretch because it's 100% polyester and it doesn't feel as high end as most everything else I've worn from RTR. I believe it's true to size but be careful because of no stretch. The two slits at the sides are much more prominent than expected so be careful when tucking this in.","February 29, 2020","Work"
"https://www.renttherunway.com/pdp/items/ADAMC6","Elizabeth","Prettier than in the pic","This as sort of a random selection but it was beautiful. Nicer than the photo.","April 3, 2020","Other"
"https://www.renttherunway.com/pdp/items/ADAMC6","Cindy","did not wear it","fit OK, kinda boring","March 14, 2020","True to Size"
"https://www.renttherunway.com/pdp/items/ADAMC6","Carly","Not for big chested girls","Loved the print and style of the shirt but definitely tight in the chest/armpits/shoulders area. Made it a little uncomfortable.","March 11, 2020","Work"
"https://www.renttherunway.com/pdp/items/ADAMC6","Julia","Beautiful print, great feel.","Arms are fitted, rest of shirt is baggy. Back is longer than the front. Beautiful print and feel. Great with a black suit for something more interesting. Got tons of compliments in the office and in court.","March 11, 2020","True to Size"
"https://www.renttherunway.com/pdp/items/ADAMC6","Heather","just ok","The material and print were both nice. It just ran a little small in the chest and wasn't as comfortable as expected.","March 3, 2020","Small"
"https://www.renttherunway.com/pdp/items/MNR52","Mandy","Pulls tight at crotch","I didn't wear much because I felt self conscious that it pulled to much up in the crotch. I liked the softness, but just didn't feel comfortable in these.","February 21, 2020","Everyday"
"https://www.renttherunway.com/pdp/items/MNR52","Hayley","Size up one","I usually wear an xs but a small would have fit much better. I could have made them work but rented them to lounge in and were a little right around the legs","April 21, 2020","Everyday"
"https://www.renttherunway.com/pdp/items/ADAMC11","Candice","Leopard on leopard!","Leopard is one of my favorite prints, so I was so excited when I saw this set displayed at the Santa Monica store. It's super cute and comfy. Runs kind of big.","April 28, 2020","Party"
"https://www.renttherunway.com/pdp/items/ADAMC11","Allison","Leopard Love!","This jacket was one of my favorites! Wore it three times at home during this quarantine. It is roomy and comfy - you can cinch the waist or wear it more open for a sporty look. It was perfect WFH gear!","April 5, 2020","Work"
"https://www.renttherunway.com/pdp/items/ADAMC11","Iona","Wild Style","Great light weight jacket to keep the chill away. Easy to pack and fold for travel.","March 24, 2020","Vacation"
"https://www.renttherunway.com/pdp/items/ADAMC11","Emily","Super cute neutral jacket","Loved wearing this jacket while working from home going to family luncheons and just generally hanging out. Light but warm enough for california spring. Fit was generous and it looks great opened or cinched in the front.","March 15, 2020","Everyday"
"https://www.renttherunway.com/pdp/items/ADAMC11","Alexandra","L-O-V-E!","This is a drop dead must have. Cute lightweight bit actually a little warm. Flounce in back is dramatic so not for the shy","March 4, 2020","Everyday"
"https://www.renttherunway.com/pdp/items/ADAMC11","Annie","Animal Print Fashionista","My co-worker rented this, and it looked fabulous on her so I decided to rent it too! It is better in person with skinny jeans or black pants. I also cinched the waist. Thank you Melissa! #globalbrandsgroup","February 28, 2020","Work"
"https://www.renttherunway.com/pdp/items/ADAMC11","Heather","Great print and cut.","Think you could go up or down a size and it would still work.","March 13, 2020","True to Size"
"https://www.renttherunway.com/pdp/items/BDK124","Kris","Soft and elegant","Perfect work blazer for people who don't like blazers. The material is super soft and non-restrictive. Just the right amount of stretch, and breathable. Tailored crop. Loved it!","March 3, 2020","Work"
"https://www.renttherunway.com/pdp/items/BDK124","Abigail","Small fits like an XS","This piece was just ok. I rented the small and it fit more like an extra small where there wasn't a lot of room and the sleeves just hit my wrists. I found it to be sort of blah, but it was fine for a normal day in the office.","March 2, 2020","Work"
"https://www.renttherunway.com/pdp/items/BDK124","Raleigh","Shorter than anticipated but flattering and comfortable","A little shorter than I was hoping for, but I have a long torso and it still hits like a typical blazer. Arms are a little snug but overall fit is spot on. Super comfortable and warm for the office!","March 5, 2020","Work"
"https://www.renttherunway.com/pdp/items/BDK124","Nancy","Comfy and Stylish","Very comfortable, soft, and warm. Went well with black pants and shell. Liked it so much I bought it.","February 21, 2020","Work"
"https://www.renttherunway.com/pdp/items/BDK124","Danielle","Love","Completely love this blazer. Paired with RTR cropped pants for a great business casual outfit.","February 3, 2020","Work"
"https://www.renttherunway.com/pdp/items/BDK124","Kristen","Stylish!","I love it. I have had it for several days and have been considering purchasing it. It looks great and I've worn it to work and for special occasions.","January 31, 2020","True to Size"
"https://www.renttherunway.com/pdp/items/BDK124","RTR Customer","Comfortable, but structured blazer for work or dinner out.","I'm normally a Small but ordered a Medium since I figured I would wear it over shirts. Unfortunately it was too wide but I wore it anyway just because it was so comfortable and easy to throw over a plain white or black shirt and look dressed up.","January 26, 2020","True to Size"
"https://www.renttherunway.com/pdp/items/BDK124","Tracey","wore to work with jeans and mules.","great item to jazz up an otherwise basic outfit! Got lots of compliments on the piece!","January 9, 2020","True to Size"
"https://www.renttherunway.com/pdp/items/NLS151","Kristie","How does the belt work?","Love the 90s inspired look but unfortunately the belt has no holes and therefore no way to hold it in place. Am I just doing it wrong? I ended up wearing it without and it's meh ¯\_(ツ)_/¯","January 18, 2020","Work"
"https://www.renttherunway.com/pdp/items/NLS151","Joyce","Na","Na","February 29, 2020","Large"
"https://www.renttherunway.com/pdp/items/NLS151","Tammy","Had the potential to be perfect","Everything about this top is perfect.....except the belt (which is crucial to overall fit). It's a gorgeous, rich color. A great deep v, perfect for a night out. However, the belt has no traction to it so it doesn't stay cinched. If you want a flowy, lingerie-like top than this is great for that. But if you want a cinched waist, don't bother renting","February 21, 2020","Other"
"https://www.renttherunway.com/pdp/items/NLS151","Hayley","Gorgeous top but belt needs work","This top is gorgeous. Runs a little big and is obviously very low cut. I read the reviews about the belt before renting so I knew what to expect. If you get a command sticky strip it holds the belt in place and comes right off.","February 21, 2020","Date"
"https://www.renttherunway.com/pdp/items/NLS151","Monica","not worn","Belt was not sent with the top. Too large. The belt was a part of my choosing this top.","February 10, 2020","True to Size"
"https://www.renttherunway.com/pdp/items/NLS151","Selby","Great color great fabric but awful belt","I really wanted to love this top, but the belt is completely unusable, there's zero friction because of the slickness of the fabric so I could not for the life of me figure out how to keep it on. Without the belt. The cut of the shirt is unflattering and very boxy. It's a shame because everything else about this top is perfection but without a working belt I couldn't wear it.","January 26, 2020","Party"
"https://www.renttherunway.com/pdp/items/GRJ45","Valerie","Love love love! Great to compliment a simple outfit.","","February 27, 2020","Work"
"https://www.renttherunway.com/pdp/items/GRJ45","Vicky","Classy!","I ended up liking this more than expected! Really fun print and a very flattering cut! Got lots of compliments! Fits true to size. I recommend!","January 27, 2020","Work"
"https://www.renttherunway.com/pdp/items/GRJ45","Megan","Love this!","Might have to buy this one. It looks awesome for formal or work. Got loads to compliments on it.","January 20, 2020","Work"
"https://www.renttherunway.com/pdp/items/GRJ45","Brittany","Great universal jacket!","It is a little heavier so can be worn in 50 degree weather. I love this jacket so much and am definitely considering buying it.","December 18, 2019","Other"
"https://www.renttherunway.com/pdp/items/GRJ45","Geraldine","A change from basic black","Great fit. Material is on the thinner side, but good for 50F degree weather.","April 10, 2020","Everyday"
"https://www.renttherunway.com/pdp/items/GRJ45","Cara","Felt fancy!","Definitely added a pop to normal work outfits but it's not warm yet can make you too hot. I didn't love the two pockets on one side- thought that was off but overall enjoyed this piece.","March 15, 2020","Work"
"https://www.renttherunway.com/pdp/items/GRJ45","Julz","Great to pull together an outfit!","","March 4, 2020","Wedding"
"https://www.renttherunway.com/pdp/items/GRJ45","Elizabeth","Beautiful, but boxy coat.","The coat is beautiful. If you are a petite person (short torso, short arms, etc) the small will most likely not work for you. I had to roll up the sleeves about three rolls up. The jacket is boxy so this won't help us petites either. The coat did not close properly because it's much too boxy for my frame. I felt like I was playing dress up in my mom's clothes. The small was too big for a petite person.","March 2, 2020","Work"
"https://www.renttherunway.com/pdp/items/GRJ45","Ali","Nice slim fit black coat. Received several compliments on the leopard print. Loved it !","","March 1, 2020","Work"
"https://www.renttherunway.com/pdp/items/GRJ45","Tracy","Loved it!!","Fit was true to size. The coat has a little sheen but not so much that it looked holiday. Loved it!","February 26, 2020","True to Size"
"https://www.renttherunway.com/pdp/items/GRJ45","Angela","Love!","Love the fit of this jacket!","February 17, 2020","Work"
"https://www.renttherunway.com/pdp/items/GRJ45","G","Sleek silhouette","This is a lovely coat with a bit of sheen. I used it for both dress and casual and felt it had a nice, tailored fit. Overall it was probably true to size- but sleeves were a bit snug on athletic arms so I might size up next time.","February 12, 2020","Other"
"https://www.renttherunway.com/pdp/items/GRJ45","Senya","Wow!","I rented this coat and I love it so very much. I have used it every chance I have had. I wish I could keep forever. It's so sleek and definitely is very sophisticated.","February 11, 2020","Other"
"https://www.renttherunway.com/pdp/items/GRJ45","Emily","One of my favorite rentals ever!","I got so many compliments on this jacket. Beautifully tailored, super fun print.","February 8, 2020","Date"
"https://www.renttherunway.com/pdp/items/GRJ45","Miasha","Go to jacket","This jacket is so versatile and rich looking. Very quality item that can be worn in a variety of outfits.","February 1, 2020","Everyday"
"https://www.renttherunway.com/pdp/items/GRJ45","Teresa","Photos don't show sparkly thread on prints","Didn't wear it because it wasn't really office appropriate for me. Maybe if the sleeves hadn't been so short? It ran small.","January 24, 2020","Work"
"https://www.renttherunway.com/pdp/items/GRJ45","Kara","This jacket was a show stopper. Even though I ordered a size too large, I got so many compliments!","Kind of boxy fit, but the subtle pattern was so cool! Runs a little large.","January 13, 2020","Large"
"https://www.renttherunway.com/pdp/items/GRJ45","Brittany","Cute black jacket with a little edge","A lightweight black jacket with a little something extra to it. Loved it!","December 30, 2019","Date"
"https://www.renttherunway.com/pdp/items/GRJ45","Vishanya","Perfection","Omg this coat is simply amazing. It fits great, looks great and feels great. So stylish and makes everything look good. I absolutely love it.","December 19, 2019","True to Size"
"https://www.renttherunway.com/pdp/items/GRJ45","Nicole","Rented and getting a lot of use","Still using this item! It's great to dress up an outfit. Lightweight but enough for going out on a brisk evening. Looks good styled casually or formally. Might buy","December 15, 2019","Other"
"https://www.renttherunway.com/pdp/items/GRJ45","Sarah","Lightweight and Elegant","I rented this to wear as my coat to a black tie wedding. It has a nice sheen to it and I think is perfect for something like this. It runs a little large - I wear a size 12 and I would say it fits decent over my chest but runs large everywhere else. I would probably have rented the Large just to have a more slimming look but the XL works ok. It's very thin, not warm at all but perfect to wear for a night out!","December 5, 2019","Formal Affair"
"https://www.renttherunway.com/pdp/items/KP114","Courtney","Super comfy","Really loved wearing this sweater. I'm sure I would wear it every day if I could. It was both comfortable cute and I'll definitely rent it again.","April 14, 2020","Everyday"
"https://www.renttherunway.com/pdp/items/KP114","Christina","Great casual sweater","I love the sleeves and pattern. Totally comfortable and a nice change from my usual sweaters. Ran true to size. Really soft look.","February 23, 2020","Everyday"
"https://www.renttherunway.com/pdp/items/KP114","Vibhuti","Cozy and beautiful","Loved the sweater so cute and prefect. Not itchy at all and color is so nice!!","January 17, 2020","Other"
"https://www.renttherunway.com/pdp/items/KP114","Vanessa","Cozy sweater!","Soft, cozy, comfortable and dressy sweater!","December 25, 2019","Everyday"
"https://www.renttherunway.com/pdp/items/KP114","Lisa","Soft well made sweater","Normally wear a size S or M, but RTR suggested XS for this top.","December 14, 2019","Everyday"
"https://www.renttherunway.com/pdp/items/KP114","Michelle","Super soft","It fit well","March 29, 2020","True to Size"
"https://www.renttherunway.com/pdp/items/KP114","Julie","It was very comfy.","The sweater was very comfortable.","March 4, 2020","True to Size"
"https://www.renttherunway.com/pdp/items/KP114","Danielle","Very Comfortable!","Lovely Sweater Top, can go for a casual or dressy look because of neckline and peasant sleeves.","March 3, 2020","Everyday"
"https://www.renttherunway.com/pdp/items/KP114","Michelle","LOVE - so soft and feminine","Super comfortable and not too warm despite its cozy fuzzy look. Arms are big would rent again, but in a L.","February 28, 2020","Everyday"
"https://www.renttherunway.com/pdp/items/KP114","Susie","So cute!","I wore this twice already. It's super comfortable and the sleeves are a nice detail and make it special. I could have gone down a size, but the M wasn't available. The one downside is that that neck is really wide, so it's hard to find the right bra.","February 20, 2020","True to Size"
"https://www.renttherunway.com/pdp/items/KP114","Theresa","Great quality","I loved this sweater! It was lighter than it looks and very soft. It was super comfortable as well. Will definitely rent again in the future!","February 10, 2020","Everyday"
"https://www.renttherunway.com/pdp/items/KP114","Kerri","This is my favorite item in my everyday wardrobe.","SO cute with jeans, skirts, anything really! LOVE LOVE LOVE this top! It is very soft and comfy - flattering on many body types - hides a bit of my mummy tummy.","February 1, 2020","True to Size"
"https://www.renttherunway.com/pdp/items/KP114","Missy","Cute Sleeves!","Fun, warm sweater. I thought it was beige but it has just a hint of pale purple. The neck was wide, but I think it was big overall.","January 31, 2020","Everyday"
"https://www.renttherunway.com/pdp/items/KP114","Carla","Soft sweater!","Very flattering and comfortable. Got many compliments throughout the day","January 26, 2020","Other"
"https://www.renttherunway.com/pdp/items/KP114","Daniella","Big sleeves","I wore this for date night with jeans and boots. Wanted to wear to work, but i didn't notice i dipped the arm in soy sauce! They were so big i couldn't see where they were going. Really liked the look of it though. Sad i didn't get to wear it more than once.","January 20, 2020","Everyday"
"https://www.renttherunway.com/pdp/items/KP114","Laura","Pretty in lavendar","Really sweet, pretty sweater. Billowy sleeves are a nice detail.","January 19, 2020","True to Size"
"https://www.renttherunway.com/pdp/items/KP114","RTR Customer","Soft, comfortable and beautiful color.","Loved it!","January 12, 2020","Small"
"https://www.renttherunway.com/pdp/items/KP114","Erin","Gorgeous color and so soft","I loved this sweater. I sized up because a L was unavailable and I'm glad I did. Very feminine sleeves and neckline. I would definitely rent this again.","January 8, 2020","Everyday"
"https://www.renttherunway.com/pdp/items/KP114","Laura","So pretty and soft","Came with tags on. Loved it. Very flattering.","January 5, 2020","Everyday"
"https://www.renttherunway.com/pdp/items/KP114","Courtney","Super cute sweater.","This sweater is absolutely adorable. It fits very nice and the sleeves aren't overly poofy. I'm 5'9 and a XS hit me right at the hips.","January 4, 2020","Work"
"https://www.renttherunway.com/pdp/items/KP114","Roshni","Too small","This sweater is so pretty and very comfortable material. It was just too small and hugged my midsection too much. Would look very good on anyone without a mommy tummy","December 31, 2019","Other"
"https://www.renttherunway.com/pdp/items/KP114","Patricia","Sleeves just too big","I know big sleeves are in, but wish designers wouldn't overdo it. This top has a pretty color and design. It's sleeves are just shy of looking silly.","December 23, 2019","Other"
"https://www.renttherunway.com/pdp/items/KP114","Tara","Cozy work sweater","Cozy fit. I got it oversized and I could have gone down a size. So soft!","December 22, 2019","Everyday"
"https://www.renttherunway.com/pdp/items/VD64","Ashley","Comfy cute","This dress did not work for me but it was very comfortable fabric. The medium was a little loose the problem I ran into was with the bust. I feel this dress would suit a larger bust. I simply couldn't fill it out and there was uncomfortable gapping.","April 9, 2020","Large"
"https://www.renttherunway.com/pdp/items/US30","Taylor","Not a pencil","This skirt ended up being cute so it was fine, but it was definitely a-line, not a pencil. Great for going out but can also be a good work look","February 2, 2020","Everyday"
"https://www.renttherunway.com/pdp/items/US30","Jessica","Loved it!","I wore this several times. Loved the fit.","January 1, 2020","Other"
"https://www.renttherunway.com/pdp/items/US30","Dori","Too small in the waist","Normally LOVE Universal Standard but this was too small in the waist and uncomfortable.","February 25, 2020","Other"
"https://www.renttherunway.com/pdp/items/US30","Jessica","Ran big and lower on the waist","I wanted to wear this so much and love US, but it was just a little too big in the waist (rented an XS and I'm a usual 10-12). It isn't as high waisted as I felt like I wanted it to be, and it was more A-line.","February 24, 2020","Work"
"https://www.renttherunway.com/pdp/items/US30","Chanah","Not flattering for those with hips.","I wore this skirt twice, to work and on a date. I had to wear a long sweater to cover my hips because the pockets make it puff out in a very unflattering way. The material is not great quality and I was nervous about damaging it. It did accentuate my feminine blouses nicely.","January 10, 2020","Date"
"https://www.renttherunway.com/pdp/items/US30","Karin","Soft material, high quality, odd fit","It is much more of an A-line fit than represented in the picture. But, because the materials is so soft, it didn't stay in an A. The effect was a bunching of material in the front at the hemline. I really wanted to love it, but in the end, decided it could not be worn.","December 29, 2019","True to Size"
"https://www.renttherunway.com/pdp/items/MKP67","Misha","Great everyday sweater","","March 12, 2020","Everyday"
"https://www.renttherunway.com/pdp/items/MKP67","Abigail","Dress up or down","I wasn't sure exactly where I was planning to wear this when I rented it. Depending on what it's styled with it can easily be dressed up or down. It was fairly comfortable but rides up easily. The crop is significant but this came to the perfect length for high waisted jeans for me. Maybe because of my relatively flat chest. I recommend.","March 9, 2020","Everyday"
"https://www.renttherunway.com/pdp/items/MKP67","Kristen","Comfy cropped sweater","Cute cropped sweater with ruffles. Sleeves are a bit long but given the main photo for the sweater I think they're supposed to be that way","March 7, 2020","Other"
"https://www.renttherunway.com/pdp/items/MKP67","Erin","Felt cheap","I made sure to show the elastic in my picture. It felt so cheaply made. Cute style, but I could get a higher quality sweater at Target.","February 22, 2020","Everyday"
"https://www.renttherunway.com/pdp/items/MKP67","Linda","LOVE LOVE LOVE","I think this was the one thing I was the most excited to try! I absolutely love this top and it fits me in the best ways possible!","February 19, 2020","Everyday"
"https://www.renttherunway.com/pdp/items/MKP67","Jennifer","I copied a look I saw online by pairing this shirt with neutral pants. It was perfect!","The material was so soft and the color is very versatile. I paired this with beige and my favorite jeans. I kept it for 2 weeks and wore it 4 times. It is so well made and even though it is basic, the details around the sleeves and waist makes it look so fashionable.","February 7, 2020","True to Size"
"https://www.renttherunway.com/pdp/items/MKP67","Rachel","Cute & cropped","I rented this for a night out and it did not disappoint. I wore it with high waisted black jeans and just a little bit of midsection showed. It looked super cute and sleeves fit perfectly, when normally sleeves are too long!","January 31, 2020","Date"
"https://www.renttherunway.com/pdp/items/MKP67","Olivia","Very cropped","Cute sweater. Definitely a lot more cropped than expected.","January 26, 2020","Everyday"
"https://www.renttherunway.com/pdp/items/MKP67","Amanda","Great for day or going out! So comfy and great fit!","Perfectly cropped at waist! Great with high waisted jeans! Sleeves cinched so even though they were a tad long still worked","January 21, 2020","Everyday"
"https://www.renttherunway.com/pdp/items/MKP67","Alexandra","Loved it so much I bought it!","Cute cropped sweater. I loved the fit and felt like I would definitely wear it again so I bought it! I wore the small and it's a slightly baggy fit. Fabric was also soft and comfortable!","January 12, 2020","Other"
"https://www.renttherunway.com/pdp/items/MKP67","Catherine","LOVED this top","Such a cute cropped sweater!! Fit great and nicely with high waisted jeans.","January 8, 2020","Other"
"https://www.renttherunway.com/pdp/items/MKP67","Leah","Received even when I canceled order- but she's gorgeous!!","Loved this even though I canceled the order. This was cute but definitely cropped. Color wasn't brown and wasn't pink! Cute top overall","December 16, 2019","Other"
"https://www.renttherunway.com/pdp/items/MKP67","Brooke","So cute!","I wish I could buy this but can't afford to at the moment. This sweater is so flattering, unique, warm, and cute! I wore it to work and also on a date. Only wish it was a tad longer:) A must wear with high waisted jeans.","December 13, 2019","Everyday"
"https://www.renttherunway.com/pdp/items/MKP67","Olivia","Own it in pink","I didn't love it when I rented it but then I rented it in pink it took on a whole new life. It is quite cropped so heads up but I have super high waisted jeans that make it perfectly proportionate.","April 16, 2020","True to Size"
"https://www.renttherunway.com/pdp/items/MKP67","Lissette","Flattering","","April 10, 2020","Party"
"https://www.renttherunway.com/pdp/items/MKP67","Katherine","IN LOVE","Perfect short sweater to wear with high waisted pants! I wore this to work and on weekends. I loved it so much I bought it !","April 7, 2020","Everyday"
"https://www.renttherunway.com/pdp/items/MKP67","Rebecca","Soft and cute","I loved this sweater! It's obviously cropped so it looks best with high-waisted pants. It's super soft and stretchy as well - not too tight. I received a lot of compliments when I wore it.","February 6, 2020","True to Size"
"https://www.renttherunway.com/pdp/items/MKP67","Lyn","Super cute sweater!","Because of the elastic around the ruffles, the sweater tends to ride above your hips, so this looks best with high-waisted jeans. the sleeves are so cute and this was warm but not itchy.","January 20, 2020","True to Size"
"https://www.renttherunway.com/pdp/items/MKP67","Danielle","Fun sweater!","Beautiful color, very comfortable, and I love the ruffles! Fit true to size","January 7, 2020","Everyday"
