"links_link","links_reviews_name","links_reviews_title","links_reviews_text","links_reviews_date","links_reviews_purpose"
"https://www.renttherunway.com/pdp/items/REF62","Inga","Simple, easy dress","I wore this in Vegas during the day. Really cute dress. The sleeve length was good for my long arms. The skirt is short, but cute. the fabric was a bit form fitting, which is why I said it runs small. It really hugged the curves. I considered buying it, but my husband said I could get something like it at Forever21, which really says something, I think.... A fun easy rental nonetheless.","March 10, 2020","Small"
"https://www.renttherunway.com/pdp/items/REF62","Heather","Wore it to work with sweater tights. Without tights it would have been inappropriate.","The bust is a little tight on this, but overall the fit is good. I love the length and the fact that it's tight on top and swings a bit at the bottom, making it ok for work (informal work place.)","March 6, 2020","Small"
"https://www.renttherunway.com/pdp/items/REF62","Micayla","N/A","I LOVE THIS DRESS. It is so comfortable, flattering and versatile!","March 6, 2020","True to Size"
"https://www.renttherunway.com/pdp/items/REF62","Alycia","It was the perfect dress for sexy and sweet. Flattered my figure. Fit perfectly. Would rent 100x !","Fit like a glove !","February 25, 2020","True to Size"
"https://www.renttherunway.com/pdp/items/REF62","Elizabeth","could live in this dress","Wore this to work (more casual day) and on two flights as well as dinner. Very comfortable and straight cut. Will rent again!","January 24, 2020","Everyday"
"https://www.renttherunway.com/pdp/items/REF62","Megan","Runs small","Was a bit too tight on me, so didn't end up wearing. Love the style though!","January 22, 2020","Everyday"
"https://www.renttherunway.com/pdp/items/REF62","Caitlin","Little small","Really cute, but I normally wear a medium (so that's what I ordered) but it was tight in the chest for me.","January 9, 2020","Small"
"https://www.renttherunway.com/pdp/items/REF62","Melissa","Probably will buy this!","Fits like a glove, boyfriend loved it!","January 7, 2020","Date"
"https://www.renttherunway.com/pdp/items/REF62","Aimee","Comfortable","I am always an xs and the xs was a smidge tight so I ordered the small- had more breathing room So comfortable feels like a cotton long sleeve shirt I wore with leggings bc very short I am 5'6 came right below booty Kinda low cut but not terrible Stretchy good for everyday","December 24, 2019","Everyday"
"https://www.renttherunway.com/pdp/items/REF62","Brie","Fitted style. M fit great, usually 2-4/SM in other brands.","I'm 5'4"" and pear shaped, long enough to not worry about it being too short. Fitted style is very flattering. Wore with tights and made sure the top of those hit where the waist fits. Stretch material pulls you in and lays smooth. Longer sleeves, I rolled under an 1.5"" to hit perfectly at the wrist.","December 16, 2019","Small"
"https://www.renttherunway.com/pdp/items/REF62","Melissa","Comfortable but short","This dress is so comfortable that I almost slept in it! It's a very casual fabric and was tight and short, even on someone short like me, so maybe size up unless you're wearing it with tights (I didn't).","December 10, 2019","Date"
"https://www.renttherunway.com/pdp/items/CMO75","Helena","Super cute!","This sweater is amazing. Such a pretty blue, super soft, SO comfortable. The sweater is a bit cropped,l, but otherwise very roomy. LOVE.","April 8, 2020","Other"
"https://www.renttherunway.com/pdp/items/CMO75","Cate","Cute fuzzy pattern sweater","Good fit. Loved the pattern and fuzzy factor!","March 7, 2020","Everyday"
"https://www.renttherunway.com/pdp/items/CMO75","Sami","Loved!","So cute, warm and soft. It's cropped just FYI.","March 4, 2020","Other"
"https://www.renttherunway.com/pdp/items/CMO75","Emma","Little cropped, little itchy, but looks good!","Fits TTS, I'm 5'9 so it was a bit short for what I usually wear","February 27, 2020","Everyday"
"https://www.renttherunway.com/pdp/items/CMO75","Jennifer","WOW! Super soft!","Love this sweater! It's so soft! Very comfy! Warm! Definitely to be worn with high waisted jeans. Wish I could buy it!","February 1, 2020","True to Size"
"https://www.renttherunway.com/pdp/items/CMO75","Kayley","The coziest sweater!","So cozy and fun! Wore this for the holidays with my family and dressed it up with some heals!","January 16, 2020","Party"
"https://www.renttherunway.com/pdp/items/CMO75","Andrea","Very soft","Thick but soft fabric. I wore to a family dinner. It is cropped so you have to wear with high waisted.","December 15, 2019","Other"
"https://www.renttherunway.com/pdp/items/CMO75","Megan","So cute!","Such a cute sweater got so many compliments. The sweater is soooo soft and the blue color is so unique! Wanted to buy would totally rent again - the best sweater!","December 13, 2019","Other"
"https://www.renttherunway.com/pdp/items/CMO75","Zena","Comfortably, soft but short","Comfortable, not itchy and soft. Only issue was that it is short at the waist so would recommend high waisted pants or a tank top underneath (I have on black with black pants)","December 8, 2019","Everyday"
"https://www.renttherunway.com/pdp/items/CMO75","Austen","LOVE IT. WANT IT.","Been wanting a warm, fun, not itchy sweater. This is it. I want to keep but it's a bit too expensive so I'll just keep for a while!! I love the pop of color and the texture. Seriously a winter must-rent","November 20, 2019","Everyday"
"https://www.renttherunway.com/pdp/items/CMO75","Katie","Love this.","I sized up because it's a cropped fit, and I loved it. Super cozy, looks like such good quality, and got compliments on it.","February 18, 2020","Small"
"https://www.renttherunway.com/pdp/items/CMO75","Gail","This Sweater Got Me Through an Overnight Stay at the Hospital","I rented this because other people said it was so comfy and soft and it was! I had it on when I unfortunately had to take my fiancé to the ER for emergency surgery and ended up wearing it about 36 hours straight as I waited at the hospital. It was so cozy and comfy through all that time!! Plus it's cute and I got tons of compliments from the nurses","February 1, 2020","Everyday"
"https://www.renttherunway.com/pdp/items/CMO75","Chelsey","Wore this to school and got so many compliments!","It's a bit of a cropped fit and the material is so soft! I would've considered purchasing if it wasn't out of my price range.","January 13, 2020","Small"
"https://www.renttherunway.com/pdp/items/CMO75","Stephanie","Cozy and Complimentary","Lots of compliments - a break from your typical sweater. It is cropped so if you're not prepared to bare your midriff, make sure you have a pair of high-waisted pants to wear it with. It looks great wtih black jeans. It is very soft and not itchy at all. The cut is boxy so size down and expect room.","December 26, 2019","Large"
"https://www.renttherunway.com/pdp/items/CMO75","Sarah","Crop top","Unfortunately I had to return the sweater and wasn't able to wear it. Pros: super soft and comfortable. Fits true to size. Cons: the sweater was a crop top and my abdomen was exposed even with high waisted jeans.","December 22, 2019","Everyday"
"https://www.renttherunway.com/pdp/items/CMO75","Lindsay","So many compliments","Soft, fuzzy and comfortably cute.","December 18, 2019","True to Size"
"https://www.renttherunway.com/pdp/items/CMO75","Anisa","Fantastic colors and pattern.","Great cropped sweater","December 15, 2019","Work"
"https://www.renttherunway.com/pdp/items/CMO75","Angela","Great sweater!!","Super soft and perfect fit.","December 6, 2019","True to Size"
"https://www.renttherunway.com/pdp/items/RRR8","Lori","Fun print","My daughter wore this one (5'3'', 120#, 34B), so don't use this size and my measurements as a guide! She loved it. Fun print and the keyhole back is nice too. Very flattering.","April 14, 2020","True to Size"
"https://www.renttherunway.com/pdp/items/TBL30","Sandra","Beautiful dress.","Great dress. Well made Wrinkle resistant Large in the waist and hips. I added a jacket since it was cold this morning.","April 13, 2020","Work"
"https://www.renttherunway.com/pdp/items/TBL30","Amanda","Classy and Sassy","Busty girl, here. When I chose this dress, I was worried that I wouldn't be able to zip it up top; but it ended up being plenty big for my 36D chest and actually baggy at the waist. Paired with a red belt to pull it in some, and red heels for extra sass.","April 2, 2020","Work"
"https://www.renttherunway.com/pdp/items/TBL30","Lindsay","Love this style","I liked the style and quality of the dress but it was too big. I was able to pin it on the side and still wear because the smaller size wasn't available to exchange.","March 5, 2020","Large"
"https://www.renttherunway.com/pdp/items/TBL30","Jennifer","Pin stripe, sharp","Great fit, comfortable, great length for work, tear drop opening in top make it fun, tough to match with a jacket though","February 29, 2020","Work"
"https://www.renttherunway.com/pdp/items/TBL30","Natalie","Wildly inappropriate for work","Gaping hole that you can't see in the pictures. Not work appropriate","February 28, 2020","True to Size"
"https://www.renttherunway.com/pdp/items/TBL30","Emily","Great fit, cute dress","This dress fit extremely well and was really comfortable to wear all day. Easy to layer with a sweater a perfect work dress.","February 21, 2020","True to Size"
"https://www.renttherunway.com/pdp/items/FTW95","Tina","Lightweight and Lovely","I really like this top. It's so airy and bright that it lifts my mood just looking at it. I am usually between medium and large, and the medium fit perfectly. Would rent again!","April 3, 2020","True to Size"
"https://www.renttherunway.com/pdp/items/FTW95","Heather","Cute","Didn't quite know what to do with the tie in front.","April 1, 2020","Everyday"
"https://www.renttherunway.com/pdp/items/FTW95","Jennifer","Lovely top","This was made of nice material and fit nicely. It was a bit short so wearing a shirt under was necessary for work.","March 3, 2020","Work"
"https://www.renttherunway.com/pdp/items/FTW95","Mary","Fun piece in theory","Runs fairly large as it's meant to be an oversized fit. I am normally an XS-S and the XS was still a bit baggier on me than the model's picture shows. Regardless of fit, I didn't end up wearing because the tie pieces are so bulky - when tied in a bow like the picture, it protrudes so far out front that it looks out of place, but if you do a simpler knot the excess hangs nearly to my knees. Unfortunately this one was cute in theory but missed the mark in person.","March 10, 2020","Large"
"https://www.renttherunway.com/pdp/items/WVG134","Nicole","Felt very chic in this dress.","Wore it with some black knee high boots and a black belt to give it some edge:) Loved it!","April 22, 2020","True to Size"
"https://www.renttherunway.com/pdp/items/DVF322","Natasha","Stained Sleeve!!","I loved this sweater, it felt so cozy and the colors were beautiful. But the left sleeve and blue ink stains all over it. So disappointing!","March 30, 2020","Everyday"
"https://www.renttherunway.com/pdp/items/DVF322","Aiseneya","Looks nice, but bulky","While it's a nice looking sweater, I can't dau that it was flattering to my shape. It's also a little stiff and not as comfy as it looks. I wouldn't rent this again.","March 7, 2020","True to Size"
"https://www.renttherunway.com/pdp/items/DVF322","Rachel","Cute Sweater","This sweater is cute but made me feel a little boxy. It is itchy so something underneath is a must.","February 28, 2020","Work"
"https://www.renttherunway.com/pdp/items/DVF322","Alycia","Love love love","Love this sweater. It's warm but not too thick to wear in an office setting. I wore it on Valentines Day to work and then dinner and it was perfect. Got many compliments. I'm usually a Large but the Medium was the right choice for this one.","February 27, 2020","Everyday"
"https://www.renttherunway.com/pdp/items/DVF322","Lee","Warm and cozy","Fit was a little baggy, but I like sweaters that way so it was great for me. Fun colors that I don't usually own, was warm and went black and blue jeans.","February 24, 2020","Everyday"
"https://www.renttherunway.com/pdp/items/DVF322","Jenny","Unique and cool!","I love this sweater! It's warm though so if you run hot like I do, layers... wear a top underneath.","February 17, 2020","Everyday"
"https://www.renttherunway.com/pdp/items/DVF322","Ilia","My first rtr rental!","Super cute and comfy sweater !","February 16, 2020","Work"
"https://www.renttherunway.com/pdp/items/DVF322","Jacqueline","Comfy and cute","Super soft, bright and comfortable sweater. Runs large, so wear normal size if you want an oversized fit or size down for regular fit. Keeps you warm too!","February 13, 2020","Everyday"
"https://www.renttherunway.com/pdp/items/DVF322","Andrea","Cosy and standout sweater","Warm yet breathable, this sweater is versatile enough to work in the office as well as a day out with teenagers. I would own this sweater.","February 11, 2020","Everyday"
"https://www.renttherunway.com/pdp/items/DVF322","Alex","Super cozy","Ordered a medium because I wanted it to be oversized. It was already on the bigger size but I loved the way it fit. It's super comfy and a fun mix of colors.","December 12, 2019","Work"
"https://www.renttherunway.com/pdp/items/DVF322","K","Vivid Colors But Unflattering Shape","I think this was pretty new when I got it and I thought it was really high quality. The colors are so fun and bright. It is a bit more pink than it appears in the picture. However it was a bit longer than I would prefer (cropped sweaters 4 life) and I had to tuck it in and drape it to make it look vaguely flattering.","December 7, 2019","Everyday"
"https://www.renttherunway.com/pdp/items/DVF322","Jennifer","So warm, so comfy, so cool!","This sweater looked mostly red in the app, but it's got lots of hot pink in it, which totally changes the look! The material is super warm, perfect for a cold winter layer. I'm a size 10 on top (36C) and this Medium fit perfectly with just enough length to tuck in a bit of front, and enough structure to hang nicely when left untucked. If red isn't your color, but pink is (that's me!) then GET THIS SWEATER! You won't regret it!","December 1, 2019","Everyday"
"https://www.renttherunway.com/pdp/items/DVF322","Michelle","Didn't end up wearing it but it would be nice with jeans. Not as soft as I'd like.","A little on the big side but not enough to mark it as runs large. I'd wear it to work or a casual dinner. It wasn't scratchy but it wasn't as soft as I'd like. I'd wear it out if I was going out of the house. But with shelter in place, I'm not. I rented it for a cozy home sweater. It was not that.","April 4, 2020","True to Size"
"https://www.renttherunway.com/pdp/items/DVF322","Alexandra","prettier in photos","neither here nor there - not oversized but not too small","April 1, 2020","True to Size"
"https://www.renttherunway.com/pdp/items/DVF322","Georgeann","Great colors.","Super beautiful colors and loved the comfort.","March 10, 2020","True to Size"
"https://www.renttherunway.com/pdp/items/DVF322","Imogen","Very cozy/warm","","February 25, 2020","Everyday"
"https://www.renttherunway.com/pdp/items/DVF322","Amanda","Looked like something I thrifted for","Too much of a thrift store look for me, nice sweater but felt like it was trying too hard to be artsy.","February 25, 2020","Work"
"https://www.renttherunway.com/pdp/items/DVF322","Bridget","Super comfy colorful sweater!","Sweater is meabt to be oversized, and I wish I had sized down. I hated to return this sweater and will absolutely be renting it again. If it wasn't so expensive, I would be buying it for sure!","February 18, 2020","Everyday"
"https://www.renttherunway.com/pdp/items/DVF322","Wendy","Fun pop of color","This is one of the reasons I love RTR. I don't usually do this much color, so I wouldn't have bought this sweater. But it was fun to wear and it did get compliments on it. So I'd rent again but not something I'd wear every week. Perfect rental.","February 8, 2020","Everyday"
"https://www.renttherunway.com/pdp/items/DVF322","Jocelyn","Comfortable and loose fitting","I loved this sweater! So comfy and the pattern is really different and fun. The only thing I'd say about it is that it's a bit on the boxy side, so it was a very loose fit. But I really liked it! I'm usually a medium in tops but I went with a small and I'm glad I did.","January 23, 2020","Everyday"
"https://www.renttherunway.com/pdp/items/DVF322","Alexis","Warm, cozy and spunky","Loved this sweater and I received a ton of compliments. It's bright and stands out, but goes with a lot. You can dress it up or down. It's really warm and oversized, which I loved.","January 20, 2020","Everyday"
"https://www.renttherunway.com/pdp/items/DVF322","Mattie","Solid sweater choice to spice up an everyday look!","The colors are more vibrant in person and the red and pink are more distinct than as pictured. If you're between sizes, size down. I typically look for Mediums in sweaters and the Small fit exactly like a typical Medium to me.","January 10, 2020","Large"
"https://www.renttherunway.com/pdp/items/DVF322","Meredith","Very Unique","This is the most interesting ""wool"" sweater I've ever worn. The spandex made it so stretchy and I've never worn anything like it before. Super soft too - I fell asleep in it a couple times. I would have loved to buy it but it's way too expensive and even after my first time wearing it (NWT) it started pilling a lot. I revived so many compliments. I'll definitely rent again someday.","January 2, 2020","Everyday"
"https://www.renttherunway.com/pdp/items/DVF322","Elizabeth","The colors are even more interesting in person!","Loved the colors in this sweater! It definitely runs large and I should have ordered a size small.","December 27, 2019","Large"
"https://www.renttherunway.com/pdp/items/DVF322","Lauren","PINK and red sweater!!","I couldn't tell in the photo but this sweater is hot pink and red and it is SO much prettier in person!! Super warm and runs a bit roomy so if you want it fitted size down. Loved this with black jeans and booties, the colors are so fun!","December 26, 2019","Other"
"https://www.renttherunway.com/pdp/items/DVF322","Melissa","Pretty punchy colors","Incredibly soft and warm. The colors are stunning.","December 10, 2019","Everyday"
"https://www.renttherunway.com/pdp/items/DVF322","Laurel","Beautiful colors and comfortable to wear.","This is a real workhorse of a sweater. I wore in almost every day over a t-shirt for a week. It was warm, comfortable, and eye catching. RTR suggested that a size 14 go with large. It is supposed to be big, but I've rented both M and L and think the M was a better fit.","December 6, 2019","True to Size"
"https://www.renttherunway.com/pdp/items/PBO21","B","Great Material and Fun Print, NSFW","I liked the pants, but the reason for three stars is because the pants slit goes all the way to the top of the pants effectively cutting each pant into two pieces. Thankfully, I wore them to a dinner before work, because as soon as I sat down the bottom piece of the pants fell down and if I wasn't wearing shorts you would have seen my underwear. Had the slit been sewn at least 4 inches at the top I would have loved these pants. They are fun and made of great material. Do not wear in the wind. I think these pants would be great for a night on the town.","March 17, 2020","True to Size"
"https://www.renttherunway.com/pdp/items/PBO21","Jeanice","These pants are so cute but the waist runs very small.","The print is great... I wish they would have fit better in the waist.","March 14, 2020","Small"
"https://www.renttherunway.com/pdp/items/PBO21","Elizabeth","Side slits all the way up to your waist!","I really wanted to love these silky pants but I didn't expect the slit to go all the way up to the waist. If I were only standing, it would be just fine, but as soon as you sit down, your whole pant leg splits apart exposing your entire leg. I felt like I need to wear a swimsuit bottom underneath so not to expose myself. I didn't end up wearing the pants because I thought they were really strange and exposing.","March 11, 2020","Other"
"https://www.renttherunway.com/pdp/items/SBJC12","Aya","This sweater was very comfortable and stylish. However, it was a little bit long.","This sweater was extremely comfortable and high quality. I ended up wearing it several times throughout the time that I rented it. My only concern was that it was really long on me. You can kind of see how long it is on me in the picture. Overall, a fantastic sweater and would wear again.","March 15, 2020","Large"
"https://www.renttherunway.com/pdp/items/SBJC12","Lisa","Cute and comfy","Professional yet comfortable for work. Ran pretty big in the arms","March 6, 2020","Work"
"https://www.renttherunway.com/pdp/items/SBJC12","Heather","Pretty and very soft","Fit great! Cashmere is very soft. There is a vertical slit opening behind the bow that doesn't have a button to hold together, so if the bow shifts it is a bit scandalous (for work), but the bow does cover well most of the time. The particular shirt I am wearing is starting to show wear on the white knit sections (just a touch yellow), but still beautiful.","February 13, 2020","Work"
"https://www.renttherunway.com/pdp/items/SBJC12","Lyndsay","Adorable!","This top is just the cutest! However, it meets your pants right at the button so if you have any sort of belly it may be short or unflattering.","February 1, 2020","Work"
"https://www.renttherunway.com/pdp/items/SBJC12","Meagan","So soft and nice!","I absolutely LOVED this sweater. It was so soft and warm and the bow was a fun pop of design. I really loved the fit of this sweater. I paired it with a skirt that I rented and everyone loved it.","January 9, 2020","True to Size"
"https://www.renttherunway.com/pdp/items/SBJC12","Tereza","Cute look but runs short and small","I really liked the style and feel of this sweater - not too thick but still cozy. My main complaint was the length. I've got big boobs and it was just too short on me. I would def need to size up to provide more chest fabric but, not sure if that would fix the length issue. Clearly, didn't wear this shirt since it turned into a belly top on me...","January 4, 2020","Small"
"https://www.renttherunway.com/pdp/items/SBJC12","Jenny","Fun bow; soft sweater","So soft. Great sweater to dress up or down. Went up a size because I was afraid it would be short. Still short in length - better with high waisted pants - but was big in the arms so could have gone with normal size. But overall great rental.","December 8, 2019","Party"
"https://www.renttherunway.com/pdp/items/SBJC12","Margaret","Floppy bow","Sweater is cropped/short but I found the arms to run really big and baggy. The ribbon is a bit strange - kind of floppy and doesn't really hold the bow shape.","December 4, 2019","Everyday"
"https://www.renttherunway.com/pdp/items/SBJC12","Hannah","Adorable feminine sweater.","Soft and light sweater perfect for fall. Paired with black trousers and a pearl headband for a polished look for the office. Could also be dressed dow with jeans and sneakers for a chic weekend look. Adorable for sure rent this one.","November 20, 2019","Work"
"https://www.renttherunway.com/pdp/items/SBJC12","Sara","Cute sweater.","This is a cute sweater but the fit was a bit odd. The sleeves were exceptionally long and the waist was pretty short. (And I don't have short arms or a long waist.) There is an open placket underneath the bow, so if the bow is out of place, the sweater can be revealing.","March 23, 2020","True to Size"
"https://www.renttherunway.com/pdp/items/SBJC12","Kim","Hugs in the wrong place","It was soft and the bow was cute, but the white band at the bottom hugged right on my love handles.","March 20, 2020","Work"
"https://www.renttherunway.com/pdp/items/SBJC12","Jacqueline","Unable to wear.","Under the bow there is a peek-a-boo opening that is closed at the top with a button. The problem is that this leaves a large gap that shows everything. :( I was hoping to wear this to work, but no luck. If the bow shifts even slightly, everything is exposed.","February 27, 2020","Large"
"https://www.renttherunway.com/pdp/items/SBJC12","Alissa","Weird fit","I loved the style and how soft the sweater is, but it's a very odd fit. The sleeves are super long and baggy, and the sweater itself is quite loose, but the length is incredibly short. Felt like I needed to go down a size but I didn't want a crop top!","February 3, 2020","Everyday"
"https://www.renttherunway.com/pdp/items/SBJC12","Deirdre","It's cropped and has key hole at tie","It's soft, cropped with long sleeves. I was surprised by the key hole where the bow tie is.","January 23, 2020","Party"
"https://www.renttherunway.com/pdp/items/SBJC12","Elizabeth","The sweater was too worn and discolored for my taste.","Definitely need to not keep renting overworn pieces.","January 23, 2020","True to Size"
"https://www.renttherunway.com/pdp/items/SBJC12","Amy","This sweater is cute but has seen better days.","It felt a little stretched out and has areas where the fabric has pilled.","January 14, 2020","True to Size"
"https://www.renttherunway.com/pdp/items/SBJC12","Ankita","Runs small!! Weird fit","A lot cuter on the app then in person! Also runs small. I'm usually a 6 and a M and wish I got a L or even XL!","January 10, 2020","Work"
"https://www.renttherunway.com/pdp/items/SBJC12","Christine","Cute sweater, damaged bow","It was a really cute sweater, but there was damage to the silk bow when I received it. Overall great fit.","January 4, 2020","Work"
