"links_link","links_reviews_name","links_reviews_title","links_reviews_text","links_reviews_date","links_reviews_purpose"
"https://www.renttherunway.com/pdp/items/VB52","Jennifer","Great top! So light & airy","This top was super light & comfy - easily an everyday wear! The sleeves stayed pushed up without cutting off circulation and it went great with jeans or dressed up. Would totally rent again!","April 15, 2020","Everyday"
"https://www.renttherunway.com/pdp/items/VB52","Leah","Delivery. Came quickly.","Super cute, comfy, accurate sizing and high-quality fabric.","April 14, 2020","Everyday"
"https://www.renttherunway.com/pdp/items/VB52","Brittaney","Stand out blouse","The colors, print and fit of this blouse really stand out. Love the poof and shoulder detail - just enough! Fits TTS. A little short if you have a long torso but long enough to do a French tuck with jeans. Would be really cute with a high waisted jean or skirt.","April 9, 2020","True to Size"
"https://www.renttherunway.com/pdp/items/VB52","Mandy","Fancy quarantine blouse","Well tailored and great fit for my body. Liked the way it looked and hung and felt. Recommend!","April 7, 2020","Everyday"
"https://www.renttherunway.com/pdp/items/VB52","Michelle","I don't want to send it back !","So comfortable, perfect fit. The material is Uber flattering. Can be dressed up or down. I love the print ! Can't wait to try the dress in the same print this summer - when social distancing is over....","March 20, 2020","Everyday"
"https://www.renttherunway.com/pdp/items/VB52","Oksana","LOVE","I would buy this top in a heartbeat if it weren't so expensive. The material is light but not see-through, and has some stretch which is amazing. The neck is not tight at all. Can't wait to rent again.","April 24, 2020","Everyday"
"https://www.renttherunway.com/pdp/items/VB52","Chelsea","So fun!","nice quality and just pretty overall.","April 20, 2020","True to Size"
"https://www.renttherunway.com/pdp/items/OMR47","Goldie","Comfy but professional","Loved this for looking put together but still being comfortable. It's a soft drapey fabric, so don't rent if you need a proper business formal blazer. But perfect for a step up from a cardigan.","April 11, 2020","True to Size"
"https://www.renttherunway.com/pdp/items/OMR47","Kari","Did not love","This cardigan looked and get cheap. It was super wrinkled and seemed poorly constructed. I sent it back without wearing it.","April 1, 2020","Work"
"https://www.renttherunway.com/pdp/items/SBJC11","Brittany","Bow tie","LOVED the bow tie details on this top. It was MUCH shorter than I anticipated, so I had to wear a black shirt underneath. Outside the length is fit perfectly! Not too thick so could be worn on ""warmer"" fall/winter days.","March 19, 2020","Work"
"https://www.renttherunway.com/pdp/items/SBJC11","Megan","Like it, but don't love it.","It fits true to size. The fabric was much thinner than I anticipated. I paired it with black pants and booties. It's cute and I did wear it to work -and got compliments- but I'm not super crazy about the top. It's great for a rent, but I wouldn't choose to own this.","March 2, 2020","Work"
"https://www.renttherunway.com/pdp/items/SBJC11","Carin","Thin material and short","It wasn't flattering on me. I'm a bit Apple shaped, and since this is short there was no waistline.","February 19, 2020","Other"
"https://www.renttherunway.com/pdp/items/SBJC11","Zoe","Cute soft sweater, nice for work","Fits true to size. It's tighter around the waist and a bit loser in the stomach. The bow came untied a few times throughout the day but wasn't a big deal to do back up. The fabric in the tie slippery which I think caused this. The sweater is soft, not itchy.","February 11, 2020","True to Size"
"https://www.renttherunway.com/pdp/items/SBJC11","Heather","Cute, but not the best style for my body type.","This is cute, but I didn't love the fit. It seemed to shorten my torso. Good enough for a Friday work outfit though!","February 7, 2020","Work"
"https://www.renttherunway.com/pdp/items/SBJC11","Danielle","Not bad","This is super soft and comfy but I didn't think the look was anything super special and something about the color made it look a bit used/old. A bit short so might be cropped on a taller person. Overall cute for work.","January 30, 2020","Work"
"https://www.renttherunway.com/pdp/items/SBJC11","Liza","Darling, super sweet","Very cute and cozy sweater that I paired with black high waisted jeans and leopard booties. I have a long torso and without the HW jeans this would have been a crop top on me.","January 28, 2020","Everyday"
"https://www.renttherunway.com/pdp/items/SBJC11","Erin","Cute and cozy, but not super flattering","Stylish and warm, but the way the waist hits with the color blocking, it's not super flattering at the waist, which generally isn't my challenge!","January 13, 2020","Work"
"https://www.renttherunway.com/pdp/items/SBJC11","Joy","Flattering and conservative","Runs slightly large. (See sleeves in photo. Not fitted.) Flattering, comfortable and conservative for work.","January 11, 2020","Work"
"https://www.renttherunway.com/pdp/items/SBJC11","Molly","Sweet bow top! Very comfortable.","Easy wear!","December 23, 2019","Work"
"https://www.renttherunway.com/pdp/items/SBJC11","Deb","Wanted to own this","So warm And good for winter!","December 5, 2019","Work"
"https://www.renttherunway.com/pdp/items/SBJC11","Ann","Cute sweater, nothing too special","Nice looking sweater; got compliments to the extent I saw people this month (COVID-19). Comfortable for working from home, nice enough to wear to the office.","April 18, 2020","True to Size"
"https://www.renttherunway.com/pdp/items/SBJC11","Idania","Way too small","Runs very small and sits high on waist. I'm sure this works best on less sharply women.","April 18, 2020","Work"
"https://www.renttherunway.com/pdp/items/SBJC11","Elly","Cute bow; comfortable","Fits true to size","March 18, 2020","True to Size"
"https://www.renttherunway.com/pdp/items/SBJC11","Michelle","Nothing.","This sweater is cute, however it fits short and sheds fibers so anyone with sensitivity to cashmere fibers would want to skip this sweater.","March 16, 2020","True to Size"
"https://www.renttherunway.com/pdp/items/SBJC11","Tady","Basic","it was a little short on the bottom so it would lift up - it wasn't an issue for me but some may mind it. It also attracted waaaaay to much lint and fibers to the point where it looked dirty even though it wasn't. Cute top nonetheless.","March 6, 2020","True to Size"
"https://www.renttherunway.com/pdp/items/SBJC11","Marina","Below average","The sweater was slightly too short, it shed everywhere, and material didn't breathe well. Would not rent again.","March 6, 2020","Other"
"https://www.renttherunway.com/pdp/items/SBJC11","Carmen","N.A.","This would be better suited for shorter ladies. I'm 5'9"" and normally between a medium and large. I looked like a big girl in a tiny sweater.","March 4, 2020","Work"
"https://www.renttherunway.com/pdp/items/SBJC11","Jennifer","Cutest work sweater!","I LOVED this sweater. I have a fairly short torso, and it fit shorter than I thought (so long-torso ladies, this is going to fit like a crop), but looked absolutely perfected paired with black high-waisted work pants. I would normally wear a M and sized up to L on this one, and I'm glad I did. It fit like a glove.","March 2, 2020","True to Size"
"https://www.renttherunway.com/pdp/items/SBJC11","Sami","Didn't fit right","Not for my body type. Wasn't cute in person.","February 29, 2020","Work"
"https://www.renttherunway.com/pdp/items/SBJC11","Cheri","Super small and short with strangely long sleeves","This was so small it was unwearable. Would fit a small child. I am an XS and this fit but just looked ridiculous. Did not wear. Short, strangely tight, and yet -- the sleeves were insanely long.","February 27, 2020","Work"
"https://www.renttherunway.com/pdp/items/SBJC11","Amie","n/a","it pilled so I had to de-fuzz it before wearing to the office. It looks best with jeans.","February 26, 2020","True to Size"
"https://www.renttherunway.com/pdp/items/SBJC11","Gwendolyn","Cute sweater","Black silk bow makes this a bold statement piece. Non-breathable/synthetic material. Inside-out seams, which may not be best look for professional environments. Runs very large. I am a small to medium and had lots of room in an extra small.","February 24, 2020","Large"
"https://www.renttherunway.com/pdp/items/SBJC11","Ashlie","Loved this!","The fit of this sweater was spot on. Others mentioned it being too short - but I did not find that. I have a short torso and it tucked into a knit skirt perfectly. I received compliments when I wore it.","February 22, 2020","True to Size"
"https://www.renttherunway.com/pdp/items/SBJC11","Courtney","I overall liked this but it was a bit wide/loose","I thought the top was cute and I liked the style, but the fabric was a lot thinner than I was expecting. It made the material stretch easily. Also, it was a bit wider than I was expecting. It would be perfect if it was a tad more fitted.","February 22, 2020","Large"
"https://www.renttherunway.com/pdp/items/SBJC11","Sarah","It felt a bit worn & stretched. I've had a lot of success with Rent the Runway, but this was a miss.","Cute sweater, lots of compliments, but it felt a bit worn out and stretched.","February 19, 2020","True to Size"
"https://www.renttherunway.com/pdp/items/SBJC11","RTR Customer","Cute!","Very cute fit, bow covers boob hole and was able to wear it to work.","February 7, 2020","True to Size"
"https://www.renttherunway.com/pdp/items/SBJC11","Mackenzie","Cute, but nothing special","I just wore this as a desk to dinner look. It was cute, but that was it. Under the bow there is a slit, with a button that seemed a little awkward to me. It was cute and fir well, just nothing too special.","February 6, 2020","True to Size"
"https://www.renttherunway.com/pdp/items/SBJC11","Myra","I felt like Coco Chanel","This sweater was perfectly paired with the wide leg pleated paper sack pants. I felt chic and stylish. Comfortable sweater and fit perfectly.","February 1, 2020","Other"
"https://www.renttherunway.com/pdp/items/SBJC11","Karen","Love!","Adorable, but short if you have a long torso.","January 25, 2020","Party"
"https://www.renttherunway.com/pdp/items/SBJC11","Holly","Cute and professional!","Perfect with black pants or pencil skirt. Nice current style and comfortable to wear.","January 22, 2020","True to Size"
"https://www.renttherunway.com/pdp/items/SBJC11","Bri","Not my normal style so it really made an impression at the office.","Really thin sweater-ish top, not really worn for warmth. So cute and effortlessly flattering.","January 15, 2020","True to Size"
"https://www.renttherunway.com/pdp/items/SBJC11","Ryane","LOVE","Love this and will rent again. Received lots of compliments, and the fabric wasn't itchy at all.","January 15, 2020","Work"
"https://www.renttherunway.com/pdp/items/SBJC11","Jamie","it was soft and romantic :)","I am short and have a short torso. This sweater was great but does read a smidge boxy. If you have a longer torso, this will be short on you.","December 10, 2019","True to Size"
"https://www.renttherunway.com/pdp/items/SBJC11","Patricia","Cute, but won't wear well.","Delicate sweater material. If I had not been the first the rent, I am unsure if I would be able to provide such a positive rating. It may not keep integrity after several dry cleanings. Hope I'm wrong because a nice top for work.","December 4, 2019","Work"
"https://www.renttherunway.com/pdp/items/SBJC11","Dina","Very big","Arms are crazy long and when you push them up just looks baggy and unflattering","December 1, 2019","Other"
"https://www.renttherunway.com/pdp/items/SBJC11","Holly","Feminine and professional","Lovely knit of high quality yarn. Slightly dropped shoulders and moderately cropped length update this look.","November 26, 2019","True to Size"
"https://www.renttherunway.com/pdp/items/SBJC11","Kiana","Super cute with high waisted pants","Cute and comfy but runs large.","November 25, 2019","Work"
"https://www.renttherunway.com/pdp/items/RT280","Aglaia aimee","Love it!","Easy to wear, easy to style. Love the extra detail.","March 5, 2020","Work"
"https://www.renttherunway.com/pdp/items/RT280","Maureen","Loved the details, color is a little off","This is a great blazer that definitely brightens up a look! The detail on the lapel and pockets is SO fun and I loved it! The fit was PERFECT! The best length and size. I will say the color is sort of dated (much more Miami vice than I thought lol) but it definitely brightened up my winter look and I got a lot of compliments on it! Overall a very nice and well fitting blazer that is bold and feminine.","March 2, 2020","Work"
"https://www.renttherunway.com/pdp/items/RT280","Nicole","Power Suit","Don't mind my face, I loved everything about this blazer and the matching high waist pants. Both are TTS. I probably could have sized down for the blazer but I wanted a roomier fit. I'm 5 4 and was wearing 3 inch heels and the pants were almost high waters. I could've worn with flats with no problem. Only drawback was that it wrinkles pretty easily.","February 28, 2020","Work"
"https://www.renttherunway.com/pdp/items/RT280","Audrey","Compliments","This received rave reviews from my friend who is a prominent fashion blogger. And I felt casual cool in it for sure!","February 22, 2020","Everyday"
"https://www.renttherunway.com/pdp/items/RB69","Cassandra","Zebra Camo Realness","Oversized fit, the colors are tan and a camo green. Can be worn dressed up or down, would have been cute jeans and sneakers.","March 1, 2020","Work"
"https://www.renttherunway.com/pdp/items/RB69","Amanda","Never so many compliments on a sweater","Everyone loved this sweater! It was so chic and comfy. Deff will rent again","February 5, 2020","Work"
"https://www.renttherunway.com/pdp/items/RB69","Mandy","Adorable sweater","Thought was easy to wear and great pattern and colors. Super cute. Loved the cowl neck, the length and the detail on the sleeves.","February 4, 2020","Everyday"
"https://www.renttherunway.com/pdp/items/RB69","Paula","Cold day on the vineyard","This sweater kept me warm and fashionable on a cold foggy day in Portugal. I dresses it down with some fashionable leggings - this sweater can be dressed down or up!","January 25, 2020","Vacation"
"https://www.renttherunway.com/pdp/items/RB69","Sierra","Cozy, oversized turtle neck with some edge.","Normally wear a S in sweaters and this fit well. It's thick and warm but a tiny bit itchy so i wore a tee underneath. I really liked the color combination of all the shades of green with a pop of neon trim. Also loved the combo of the neon and the zebra print- on trend but not overly flashy. Worn with jeans and black booties for a casual but fashionable work look,","January 7, 2020","Work"
"https://www.renttherunway.com/pdp/items/RB69","Jaclyn","Fav sweater of the season!","This sweater is a winner! Soo soft, not too heavy weighted, and a perfect turtle neck. Looks so chic tucked into jeans, and is a great way to shake up your usual sweater game.","December 19, 2019","Everyday"
"https://www.renttherunway.com/pdp/items/RB69","Annaliese","Comfy short","This sweater was more cropped and boxy than RTR pic. Soft and cozy.","December 18, 2019","Everyday"
"https://www.renttherunway.com/pdp/items/RB69","Kathy","Comfy and Cozy for cold days","The sweater was a little big in the good way. It was so comfortable and warm for NY. I wore it on my snowy day off with Hunters and jeans and I wore it to work with dress pants and a big gold necklace","December 5, 2019","Everyday"
"https://www.renttherunway.com/pdp/items/RB69","Oksana","Stylish and warm","Great sweater, not itchy and not too thick. The collar stays up well. Feels really modern.","November 18, 2019","Everyday"
"https://www.renttherunway.com/pdp/items/RB69","Courtney","Lived in this sweater","I wore this sweater 4 times in one week. If the price tag wasn't what it was, I would have kept it in a heartbeat. Cool and cozy","November 13, 2019","Everyday"
"https://www.renttherunway.com/pdp/items/RB69","Morgan","So soft and cozy!","So cute and soft! It was a perfect match with my silk midi skirt and black boots.","November 7, 2019","Work"
"https://www.renttherunway.com/pdp/items/RB69","Isabelle","Yellow trim very sharp","Soft attractive sweater Wore it all weekend","April 5, 2020","Other"
"https://www.renttherunway.com/pdp/items/RB69","Colleen","Cute! But a bit worn (minor pilling.)","True to size.","March 18, 2020","True to Size"
"https://www.renttherunway.com/pdp/items/RB69","Rachel","Cute and cozy!","I really loved this sweater. I wore this french tucked into a pencil skirt. Probably would've been fine with a small but I was definitely going for the oversized look. So soft and cozy and I got a ton of compliments. I really like the hint of neon in the trim. Would rent again and would be tempted to buy!","March 2, 2020","True to Size"
"https://www.renttherunway.com/pdp/items/RB69","Adeleh","Weird fit","super large and boxy","February 25, 2020","Large"
"https://www.renttherunway.com/pdp/items/RB69","Melissa","Great sweater for casual wear. Got a little pilly.","Great sweater for casual wear. Got a little pilly.","February 21, 2020","True to Size"
"https://www.renttherunway.com/pdp/items/RB69","Sara ellis","GREAT sweater!","I loved this sweater! The details were so cute and I just loved the cut and color. I hated to send it back and considered buying it. I wore it probably 7-8 times while I had it and it was so versatile. Not particualry itchy and just an overall great sweater.","February 12, 2020","True to Size"
"https://www.renttherunway.com/pdp/items/RB69","Julie","Great sweater","Cute, cozy, runs a TAD big","February 4, 2020","Everyday"
"https://www.renttherunway.com/pdp/items/RB69","Marissa","Loved!","I wore this multiple times a week for weeks until I sent it back. Great (and fun) sweater.","January 28, 2020","Other"
"https://www.renttherunway.com/pdp/items/RB69","RTR Customer","It is a cozy, casual sweater.","stylish.","January 1, 2020","True to Size"
"https://www.renttherunway.com/pdp/items/RB69","Sara","Cozy, cute sweater","This sweater is perfect for cold weather. Its fabric is cozy and soft next to your skin. I wore this with fitted /skinny jeans and tall boats and got lots of compliments. I would rent this again.","December 26, 2019","True to Size"
"https://www.renttherunway.com/pdp/items/RB69","Marisa","So comfy.","So soft. Fit great. Perfect for everyday where. I wore it multiple times before I swapped!","December 23, 2019","Everyday"
"https://www.renttherunway.com/pdp/items/RB69","Nancy","Great Style & Great Sweater","Loved the fun touches of this sweater. Could have sized down, but it was cozy, warm and overall a great sweater. Would rent again.","December 23, 2019","True to Size"
"https://www.renttherunway.com/pdp/items/RB69","Gloria","So comfy!!!","Very comfortable!!! Soft and thick. Will rent again.","December 13, 2019","Vacation"
"https://www.renttherunway.com/pdp/items/RB69","Adrienne","Super soft and super fun","I felt so warm and toasty in this sweater, and it was so soft. I received tons of compliments.","November 18, 2019","True to Size"
"https://www.renttherunway.com/pdp/items/RB69","Nichol","very warm and cozy. lots of compliments.","it is a very warm sweater. Thick and the neck is higher than it looks in pics. I would maybe size down","November 13, 2019","True to Size"
"https://www.renttherunway.com/pdp/items/RB69","Robin","cozy, comfy and the perfect fall sweater.","This sweater has an oversized fit to it but doesn't feel bulky. I love the print and flash of color on the trim.","November 8, 2019","Large"
"https://www.renttherunway.com/pdp/items/RB69","Athena","Surprisingly flattering for an oversized sweater.","Turtleneck a bit stretched out, but that only makes it more comfortable.","November 7, 2019","Everyday"
"https://www.renttherunway.com/pdp/items/RB69","Renee","cute sweater","Really pretty sweater but boxy and runs large. I would rent again, but rent a small","November 5, 2019","Large"
"https://www.renttherunway.com/pdp/items/RB69","Kayla","Oversize Heaven","I love a good oversized sweater. This is so so soft and the perfect weight. I dressed this up one night with sleek black jeans and boots and also wore to the office with dark jeans and flats. I will definitely rent this again. I wish I could buy it!","November 4, 2019","Large"
"https://www.renttherunway.com/pdp/items/BH181","Charis","Great color nice cut","Color,cut and length was great for work. Fabric was unforgiving though, I recommend wearing shape wear under especially to reduce the appearance of a panty line.","April 17, 2020","Work"
"https://www.renttherunway.com/pdp/items/BH181","Elissa","Great spring work dress","Wore this for a formal day at work. I wear between a 4 and 8, and the six fit me perfectly. Super flattering and comfortable on. Even as someone short, with heels, the midi length worked perfectly. Will definitely rent again.","March 7, 2020","Work"
"https://www.renttherunway.com/pdp/items/BH181","Monica","Color and fit are Great!","Loved this dress. Great for work","April 10, 2020","Work"
"https://www.renttherunway.com/pdp/items/BH181","Cyndi","Beautiful dress","I could not get it to zip and I sized up from my usual size.","March 12, 2020","Other"
"https://www.renttherunway.com/pdp/items/BH181","Caroline","curvy, polished, very professional","I loved wearing this dress! great definition and color. I received so many compliments on the neckline. Also, I am quite flatchested and have very little for curves but this dress gave me a little action!","March 9, 2020","True to Size"
"https://www.renttherunway.com/pdp/items/BH181","Alesha","pretty color","runs small, size up","March 4, 2020","Small"
"https://www.renttherunway.com/pdp/items/BH181","Sara","Very small","I am between a 4 and 6 so ordered the 6. It was very small -- would need at least an 8 but for work May have preferred a 10.","March 2, 2020","Work"
"https://www.renttherunway.com/pdp/items/FZ66","Alison","Beautiful colors and max comfort","The artwork of the flowers on this jumpsuit is sooo pretty and satisfying. The deep blues and purples are so rich and saturated and counter balanced perfectly w the lighter shades and open spaces. Also, it is incredibly comfortable, as in, I could have worked out in this if I wanted to (I didn't), comfortable. If someone wearing jeans tried to fight me, and I was wearing this, I would have won, comfortable. Pants a little long tho, espesh if you wanna wear w flats.","March 25, 2020","Other"
"https://www.renttherunway.com/pdp/items/FZ66","Laura","Loved the color!","This is a beautiful piece and I loved wearing it but feel I should have sized down! I'm 5'4"" so I knew I would need heels for the length but when I saw photos afterwards I realized the crotch was really long on me and it looked big. Rent this but size down if you are my height! - plenty of stretch in the fabric!","March 19, 2020","Vacation"
"https://www.renttherunway.com/pdp/items/FZ66","Joellen","Dress up or down","Great look for work with boots. Or after hours for some straps sandals. I paired with a denim for work in Chicago in February but could go great for an outdoor summer party. Super comfortable to wear. A bit of stretch makes it comfortable and not binding. Material looks sheer but covers well. Love it!","March 4, 2020","Work"
"https://www.renttherunway.com/pdp/items/FZ66","Lynn","Absolutely love it but not able to wear","I LOVE this and only didn't wear it because the event was cancelled. I wish I could own it, but too expensive for me to justify right now.","April 19, 2020","True to Size"
"https://www.renttherunway.com/pdp/items/FZ66","Kat","Adds a little elegance to WFH.","Easy piece to wear. Comfortable enough for daily wear, dressy enough to wear out to dinner and casual enough to hang out with a glass of wine with friends by the pool.","April 10, 2020","True to Size"
"https://www.renttherunway.com/pdp/items/FZ66","Shana","Vacation cancelled - COVID19","Really cute and awesome fit. Rented for a cruise, will have to rent again. ☹️","April 8, 2020","True to Size"
"https://www.renttherunway.com/pdp/items/FZ66","Deanna","It's cute. Super easy to put on. Very long on me and I'm 5'8. Like it but didn't love it.","","March 23, 2020","Other"
"https://www.renttherunway.com/pdp/items/FZ66","Christiane","Beautiful pattern, color and easy to wear ! The strapless elastic band is very tight (good)!","","March 17, 2020","Other"
"https://www.renttherunway.com/pdp/items/FZ66","Casey","So comfortable and pretty","So very pretty and comfortable, even better in person","March 14, 2020","True to Size"
"https://www.renttherunway.com/pdp/items/DVF313","Natasha","Spicy work skirt","I loved this skirt it was so cute on! Usually pencil skirts aren't very flattering on my shape but the print made this one work perfectly. I didn't get to wear into the office but I will definitely rent again when the world is back to business as usual!","April 13, 2020","Work"
"https://www.renttherunway.com/pdp/items/DVF313","Karen","Comfy fit. On trend, yet professional.","","March 11, 2020","Everyday"
"https://www.renttherunway.com/pdp/items/DVF313","Casey","Cute print","Wore this to work and it was cute and fit the bill for the office. I'm usually a medium but read reviews about the elastic waste band so the small worked for me.","February 25, 2020","Everyday"
"https://www.renttherunway.com/pdp/items/DVF313","Helen","Cute midi-skirt","I enjoyed wearing the skirt and got many compliments. The fit is good. Lots of stretch but not too tight","February 21, 2020","Everyday"
