links_link,links_reviews_name,links_reviews_title,links_reviews_text,links_reviews_date,links_reviews_purpose
https://www.renttherunway.com/pdp/items/MKP56,Ann marie,Short and boxy but fun,Broadens shoulders and has a shorter boxy fit. But very fun and cute,"April 8, 2020",Everyday
https://www.renttherunway.com/pdp/items/MKP56,Aditi,Fierce!,Would have like it much better in a smaller size but the large was still VERY CUTE! Also so super warm!,"February 18, 2020",Everyday
https://www.renttherunway.com/pdp/items/MKP56,Caroline,So cute but VERY cropped,"Loved the design. Color is as bright as pictured. Not particularly soft, but not scratchy either. My boyfriend loved the sweater so much he asked if they made a men's version. Lol! Only drawback is that the sweater is very cropped. Also boxy, which is fine by me. Might try out a medium if it shows up.","February 6, 2020",Date
https://www.renttherunway.com/pdp/items/MKP56,Julia,On my to buy list!,"Comfy sweater with a unique print that wasn't too busy or over the top...just the right amount of character! Loved it, probably should have just bought it instead of renting because I want to wear it again and again!","January 16, 2020",Everyday
https://www.renttherunway.com/pdp/items/MKP56,Mariya,"This sweater says, ""grrr""",I loved the whimsical quality of this sweater. Who doesn't want two snow leopards with them at all times? The sweater was comfortable and not too warm. It runs a bit on the shorter side but it's not quite a crop.,"January 5, 2020",Party
https://www.renttherunway.com/pdp/items/MKP56,Rebecca,Super bright & cheerful!,"I was afraid to rent this thinking the sleeves were too funky for me. Um, I loved this sweater! It was soft & warm but not too warm. I'm 5'2"" and it wasn't too short. It will be a little cropped if your any taller than 5'5"" It's roomy and doesn't taper in at the gut like some women's sweaters do. It's boxy but not too boxy. It's perfect. The sweater was in fantastic shape when it arrived. I wore it to a causal dinner, went shopping, ice skating, Etc. The teal color with the white sleeves looks really pretty. I wore black leggings, black tank under and black wedge booties.","December 23, 2019",Everyday
https://www.renttherunway.com/pdp/items/MKP56,Janice,I liked it so much I bought it!,"Great everyday sweater. Got tons of compliments on it. Very high quality fabric. As with current trends, it is not super long, but I only wear high waisted jeans, so it worked for me.","December 23, 2019",True to Size
https://www.renttherunway.com/pdp/items/MKP56,Jolie,"Cute Style, Not Cute Fit","I got an XS, but the shoulders still looked like they had shoulder pads in it. The color and style are great, but I wasn't thrilled with the over all fit. Additionally, this particular garment had several pulls in it.","December 17, 2019",Everyday
https://www.renttherunway.com/pdp/items/MKP56,Hilary,Unique and warm,"I had my eye on this sweater to rent, finally got it and very pleased. Love the color and pattern. Very warm on a cold December day in NY!","December 5, 2019",Everyday
https://www.renttherunway.com/pdp/items/MKP56,Ashley,Pretty good,Shorter than I expected. Sleeves felt a bit ruffled which was cute,"October 25, 2019",Everyday
https://www.renttherunway.com/pdp/items/MKP56,Alex,"Fun, thick sweater","Got a ton of compliments on this one. It's kind of boxy, so I'm glad I got the XS. It's a little cropped but worked well with high waisted pants. It's thick and pretty cozy. Would rent again.","October 23, 2019",Other
https://www.renttherunway.com/pdp/items/MKP56,Gonzalez,Super soft + chic,"Check out my IG for more RTR Looks! @latinaexplorer I've gotten countless compliments when I wore the sweater. The material is very soft; it's not very breathable, so it's perfect for colder weather. I usually don't rent pieces two times, but I would definitely rent this sweater again. I am traditionally an extra-large, but I went with the extra extra large for that more casual loose look.","October 9, 2019",Other
https://www.renttherunway.com/pdp/items/MKP56,Madeline,Love!,"This sweater came to me brand new with the tags still on. It's very soft but does shed a bit. Medium fit, probably could have worn a small if I wanted a slightly more fitted look.","October 1, 2019",Everyday
https://www.renttherunway.com/pdp/items/MKP56,Courtney,"Cute, soft, very warm","Such a fun shirt, but definitely not for transitional summer to fall days—it's a heavy material that's best for brisk weather.","September 28, 2019",Other
https://www.renttherunway.com/pdp/items/MKP56,Mackenzie,Attention grabber!,"Tons of compliments. Sweater is soft, high quality, warm and not itchy! Detail is beautiful. I loved it, ended up purchasing!","September 20, 2019",Everyday
https://www.renttherunway.com/pdp/items/MKP56,Mia,Loved it - very comfortable and eye catching!,"Sweater was fitted, but still had a relaxed feel. More of a cropped cut so great with jeans. Got tons of compliments on the pattern!","January 1, 2020",True to Size
https://www.renttherunway.com/pdp/items/MKP56,Shannon,fun snow leopard print sweater is comfortable & entertaining. It made me happy just to have it on,The sleeve tops have an 80's pop to it a bit like faux shoulder pads,"December 24, 2019",Everyday
https://www.renttherunway.com/pdp/items/MKP56,Kelly,Fun!,"Fun sweater that will stand out from the crowd! I felt like it was a little scratchy for my personal liking. Overall, a fun rental!","November 20, 2019",True to Size
https://www.renttherunway.com/pdp/items/MKP56,RTR Customer,Wanted to love this,"I wanted to love this sweater but the cropped look just did not look great on my body shape. The sweater is very heavy, good for cold days.","November 15, 2019",Small
https://www.renttherunway.com/pdp/items/MKP56,Erin,So fun!,"I rented this after almost buying it off of an Instagram ad and was not disappointed. The thickness is a little more than I was expecting, but it worked because it's starting to get cold! Such a cool sweater!","November 1, 2019",True to Size
https://www.renttherunway.com/pdp/items/MKP56,Jasmine,Such a good statement piece!,Love the fit - a bit boxy but not too bad. Got tons of compliments. Not itchy either!,"October 24, 2019",True to Size
https://www.renttherunway.com/pdp/items/MKP56,RTR Customer,Lots of compliments,Very soft. High quality. This sweater will make you stand out!,"October 12, 2019",True to Size
https://www.renttherunway.com/pdp/items/MKP56,Callie,super cute. So many compliments,super heavy yet soft sweater.,"September 19, 2019",Large
https://www.renttherunway.com/pdp/items/TKC1,Heather,"Super cute but too small for ""my girls"" to wear comfortably. Not the fault of the dress!",I have big bazoongas and they just don't fit into this cute dress. I do usually wear this size but it all depends on the cut and style. This was too small in the top for me to wear it in public. I am a 38DD. The rest was super cute and I would have loved it.,"February 26, 2020",True to Size
https://www.renttherunway.com/pdp/items/TKC1,Alyssa,Loved this dress,This was the perfect little dress for a desert vacation. Great for day or night! May rent again for an upcoming beach vacation.,"February 19, 2020",Vacation
https://www.renttherunway.com/pdp/items/TKC1,Katie,Love! I want to buy,"Amazing color, fit and length. I wore it almost every day in Maui!","October 13, 2019",Vacation
https://www.renttherunway.com/pdp/items/TKC1,Whitney,Perfect Vacation Dress! But can be worn for so much more!!,Rented this for a family vacation to Disney World! It was light weight and perfect for Florida! I did wear spandex shorts under for this trip since dealing with rides and kids. It wasn't necessary but made me feel better! This dress could easily have been dressed up for date night or something else! Wish it weren't so expensive or I would be keeping it! Highly recommend!,"October 13, 2019",Vacation
https://www.renttherunway.com/pdp/items/TKC1,Rachel,"Gorgeous color, easy throw on",I rented this for a vacation down south. It was the perfect item to dress up or down depending on our activities that day. The straps are adjustable which I adore. The fabric does wrinkle easily but nothing a quick iron can't fix.,"September 30, 2019",Vacation
https://www.renttherunway.com/pdp/items/TKC1,Ashley,Perfect summer dress!,Rented this dress to wear for some mid week fun during the summer. It was easy breezy with some cute ruffle details! Only complaint was that it did wrinkle so I had to steam it but other than that love it!,"August 3, 2019",Everyday
https://www.renttherunway.com/pdp/items/TKC1,Shannon,Love!! So cute,Billion comments wore it a few times and would have bought if it wasn't so expensive! Love love,"August 2, 2019",Everyday
https://www.renttherunway.com/pdp/items/TKC1,RTR Customer,Cute and fun,Cut and flattering fit for everyday or vacation but a little tight in the hips,"April 20, 2020",Everyday
https://www.renttherunway.com/pdp/items/TKC1,Jordyn,Perfect dress for vacation! You can dress up or down.,Fit well and true to size. Material was fine (confused why it is so expensive!) and not wrinkly. Color was pretty! Overall comfortable and would rent again.,"February 29, 2020",True to Size
https://www.renttherunway.com/pdp/items/TKC1,Ali,Didn't wear,Was lovely but too cold on vacation to wear,"February 27, 2020",True to Size
https://www.renttherunway.com/pdp/items/TKC1,Callie,"Perfect beach cover up, or throw on a sweater to go out for dinner!","Flowly, not too short, fit perfectly.","February 25, 2020",True to Size
https://www.renttherunway.com/pdp/items/TKC1,Erin,Just meh,I ordered this to wear on vacation but I sent it back. It fit nicely but nothing special.,"February 21, 2020",Vacation
https://www.renttherunway.com/pdp/items/TKC1,Sara,cute comfy dress,Really cute. Couldnt wear with a bra.,"February 12, 2020",True to Size
https://www.renttherunway.com/pdp/items/TKC1,Sam,"Cute, everyday/vacation casual dress","I've worn this in both a zero (my usual size) and a 2 (which I ordered by mistake) - both worked for a casual beach look. I live in Florida so this is a great everyday dress, and I've also worn it on vacation. It was comfortable, cute and easy to throw on for errands or a trip to the beach. It hit me just above the knee in both sizes.","February 2, 2020",Vacation
https://www.renttherunway.com/pdp/items/TKC1,Amanda,Great vacation dress!,"Wore this while on vacation in Cancún and it was perfect for a nice dinner with wedges! Length is true to size, but chest is a little tight - would size up for a bigger bust.","February 1, 2020",Vacation
https://www.renttherunway.com/pdp/items/TKC1,Nicole,Not for Pear Shapes,I rented this for a beach vacation and was excited when I got it. Unfortunately the top was a bit too large (I'm small - 32A). I probably still could have worn except there is an awkward seam near the hips that made it too tight on the bottom. Sizing up or down wouldn't have worked for my body shape and therefore couldn't wear.,"January 15, 2020",Vacation
https://www.renttherunway.com/pdp/items/TKC1,Victoria,Breezy!,"Wore this on vacation in Florida in October. The middle seam is a little odd, but it works for a skater-style casual dress. Straps are super skinny so definitely need a strapless bra. I'm a TALL girl and I think the length worked perfectly on me, so it might be a little long if you're a little petite.","January 3, 2020",True to Size
https://www.renttherunway.com/pdp/items/TKC1,RTR Customer,Perfect day dress,Great day dress on vacation. Nice flowy material.,"January 1, 2020",Vacation
https://www.renttherunway.com/pdp/items/TKC1,Joanne,Cute but not for me,This is adorable but not for my body type.,"December 22, 2019",Vacation
https://www.renttherunway.com/pdp/items/TKC1,Kristen,Easy Dress,"I rented to wear on vacation. It's an easy dress and fit well, but not really anything special. I typically wear a 4 and it was true to size.","November 27, 2019",Vacation
https://www.renttherunway.com/pdp/items/TKC1,Jen,nice fabric . Nice flow. loved it.,Loved everything about this dress. Would rent again.,"November 17, 2019",True to Size
https://www.renttherunway.com/pdp/items/TKC1,Lauren,Cute dress,,"November 1, 2019",Other
https://www.renttherunway.com/pdp/items/TKC1,RTR Customer,A bit big in the waist,"It was pretty cute, but I found that it was a bit baggy in the waist. Also, the weather has turned, and unfortunately I no longer can really wear a cute sundress!","October 10, 2019",Large
https://www.renttherunway.com/pdp/items/TKC1,RTR Customer,Loved this dress!,Fit great and was really comfortable!,"October 7, 2019",Party
https://www.renttherunway.com/pdp/items/TKC1,Allison,Cute vacation dress,I didn't end up wearing this bc I didn't get in time for my vacation - it came the day I left - but very cute and I definitely would have worn on vacation. Might be too short for me for regular day,"October 3, 2019",Vacation
https://www.renttherunway.com/pdp/items/TKC1,Charlotte,SO flattering,I loved this dress so much - it was so flattering and easy to dress up.,"September 24, 2019",Other
https://www.renttherunway.com/pdp/items/TKC1,Heather,Cute. easy dress!,"This dress was super cute and easy for my vacation. I ordered in a size 6 and probably should have gone with the size 4 as it was a bit loose on me. Overall, very cute!","September 17, 2019",True to Size
https://www.renttherunway.com/pdp/items/TKC1,Cassie,TTS,"Cute dress, fits true to size","September 8, 2019",Everyday
https://www.renttherunway.com/pdp/items/TKC1,Elizabeth,Cute day dress!,"I run between a 2 and 4 and the 2 fits. Super cute, great length, flattering cut and color - think I'll get a few late summer wears out is this one for sure!","September 4, 2019",Other
https://www.renttherunway.com/pdp/items/TKC1,RTR Customer,Wore it 3 times,"This is a really cute dress. I'm 5'3 and the length was perfect. It fit very well. For a looser fit I could have ordered up a size but it wasn't available. I wore it 3 times and received lots of compliments. Great pattern! The straps are adjustable too, which is very helpful to adjust the top.","August 30, 2019",Everyday
https://www.renttherunway.com/pdp/items/TKC1,Katherine,Runs small in the derrière,Very cute dress but due to the drop waist style it sticks the the behind if you have one! Order up for sure.,"August 28, 2019",Everyday
https://www.renttherunway.com/pdp/items/TKC1,Cindy,"it fit well and it flowed, wore with white denim jacket",Fit well and was flattering,"August 26, 2019",True to Size
https://www.renttherunway.com/pdp/items/TKC1,Trish,Great Summer dress!,"I am 5""10 and this was an appropriate length on me for a casual weekend dress. Another pro is it has adjustable straps. It's not form fitting but definitely a fun little Summer dress!","August 19, 2019",Vacation
https://www.renttherunway.com/pdp/items/TKC1,Mai,Very light and breezy - cut of chest kind of funny,"The straps and chest area were cut a bit funny, probably because the fabric is cut on the bias? It was a cute dress that is very roomy, but short. Very light fabric, great for summer.","August 6, 2019",Large
https://www.renttherunway.com/pdp/items/TKC1,RTR Customer,Not made for an hourglass/pear figure,Loved the pattern. The dress is very light weight and slim through the hips. I could get it on but it bunched at the waist and the straps were long. I didn't wear it and wouldn't recommend for pear shaped ladies.,"August 1, 2019",Everyday
https://www.renttherunway.com/pdp/items/TKC1,Nicole,This dress was beautiful and flowed well and was so easy to wear! I will definitely rent again.,The fit was comfortable but still cute and had a little extra pizzaz with the ruffles. It also traveled really well and didnt wrinkle.,"July 31, 2019",True to Size
https://www.renttherunway.com/pdp/items/TKC1,Donna,Fantastic summer dress!,"I wanted to wear this dress every day. It was easy and comfortable, a great color, and just perfect for summer. Rent it!","July 30, 2019",True to Size
https://www.renttherunway.com/pdp/items/TKC1,Sara,Cute summer dress,This dress is a nice lightweight summer dress that can be dressed up or down. Also it's a good length (not too short) that I would feel comfortable wearing during the day. There is not much shape to it but I thought it still looked flattering. I'm usually a 4 but went with a 6. It was a little flowy but I think it looks better that way.,"July 27, 2019",Everyday
https://www.renttherunway.com/pdp/items/TKC1,Miranda,Great color,I wore this both dressed down and dressed up. It looks much better dressed up. When I wore it casually it looks a bit like a swim coverup. But with heels and earrings it looks amazing.,"July 21, 2019",True to Size
https://www.renttherunway.com/pdp/items/TKC1,Lulu,So flowy,Great weekend dress,"July 19, 2019",Other
https://www.renttherunway.com/pdp/items/CEL47,Stacy,Unique and Fun Hoodie,"I love the color of this and the cut makes it an interesting and flattering hoodie. I wanted to buy it, but couldn't bring myself to spend $200+ on a sweatshirt","October 10, 2019",Everyday
https://www.renttherunway.com/pdp/items/CEL47,Tierney,Loved this hoodie! So cool!,I rented this hoodie after seeing my coworker wear it. It's so cool and comfy and great for causal outfits. I would have purchased it to keep in my closet if the buy price wasn't so high.,"September 15, 2019",Everyday
https://www.renttherunway.com/pdp/items/CEL47,Brenda,Great for high wasted jeans - bought this one!,"I love this sweatshirt so much I bought it. It's great for high wasted yoga pants or jeans. It's cozy yet fashionable enough to get away with wearing it out on a Friday night. I only got the size 2 because there were no other options. As you can see it's short on my long torso, so I reviewed as true to size. If I would have worn my regular size (6 or 8), it would have fit like a true sweatshirt in my opinion.","August 20, 2019",Everyday
https://www.renttherunway.com/pdp/items/CEL47,Mary kate,"LOVE!!! if it weren't so expensive, I'd buy in a heartbeat.","Absolutely love this form-fitting take on a hoodie. The bottom hem hit right at my lower waist/hips (I'm 5'8), and the corset-like detailing on the waist is SO flattering. Perfect color. Will rent again. And again.","August 7, 2019",Everyday
https://www.renttherunway.com/pdp/items/CEL47,Camarie,"cute color, runs small and cropped",I didn't find this hoodie cute in person. Love the color but it is super cropped and runs small.,"April 17, 2020",Everyday
https://www.renttherunway.com/pdp/items/CEL47,Emily,"So many compliments on this cute, casual hoodie.","Loved this hoodie! I probably should have sized up to have a longer length in the arms (I got a size 1 — I'm 5'7"" and 130 lbs). So cute for casual wear and got so many compliments on this sweatshirt.","February 9, 2020",True to Size
https://www.renttherunway.com/pdp/items/CEL47,Jill,not a good shape for tall and slender type,It's pretty short and did show mid drift skin even with high waisted pants. This would be perfect for someone who is busty and has a shorter torso.,"November 6, 2019",True to Size
https://www.renttherunway.com/pdp/items/CEL47,Ashley,Super cute everyday sweater,The sweater was more fitted around the bust/rib area. The size 1 fit really well. It is cropped though so best with high wasted jeans! Overall a great sweater if you're looking for something laid back and comfortable.,"November 4, 2019",True to Size
https://www.renttherunway.com/pdp/items/CEL47,Rachel,Hood is heavy.,"This is cute, but the food is so heavy that I felt like it was choking me.","October 26, 2019",Other
https://www.renttherunway.com/pdp/items/CEL47,Bridget,I was just wearing this for everyday.,"This is cute, but the sleeves are bulky and so wearing it oversized didn't really feel like an option. This is something you need to fit - when in doubt, size down.","October 17, 2019",Large
https://www.renttherunway.com/pdp/items/CEL47,Brina,The color is amazing on me,I loved this sweatshirt. The feminine tomboy look with dress boots or sneakers. It feels really good too..really good quality. I'm thinking of buying it.,"October 9, 2019",True to Size
https://www.renttherunway.com/pdp/items/CEL47,Rae,Love,I love this sweatshirt! I wish it were a little tighter or come in sizes but it has a cool look as is. The fabric was super comfortable and warm too.,"September 12, 2019",Everyday
https://www.renttherunway.com/pdp/items/CEL47,Tara,Great Little Piece,Cropped sweater that I wore for lounging. I was going to wear it out but it was too hot outside. I loved how it was cropped and tailored at the bottom. Will rent again,"August 23, 2019",Small
https://www.renttherunway.com/pdp/items/DVF309,Minette,So comfortable and so many compliments!,"I wore this to a funeral for a little pop of color in a sea of black. I loved it! The waistband is elastic and the skirt has stretch, too. Will rent again!","March 11, 2020",True to Size
https://www.renttherunway.com/pdp/items/DVF309,Taylor,One of my favorite rentals,This skirt is amazing. It's so comfortable and waist band is stretchy. Even the material of the skirt is stretchy. I dressed it up for work but you could definitely make it more casual too. I got a lot of compliments and felt comfortable all day.,"March 6, 2020",Work
https://www.renttherunway.com/pdp/items/DVF309,Emi,Beautiful skirt with stretch waist.,I rented a medium and am normally between 10-12 and fit large. This fit well and was super comfortable. Great length and material. Considered buying!,"March 4, 2020",Work
https://www.renttherunway.com/pdp/items/DVF309,Kerry ann,Comfortable elastic waist pencil skirt.,I rented as part of my unlimited for work. Paired with brown tights and a navy blue sweater. Very comfortable and looked great! Nice change for my wardrobe. I rented a DVF skirt before and got an XL - I went with a L this time - fits better. I am a size 14 pants.,"February 12, 2020",Work
https://www.renttherunway.com/pdp/items/DVF309,Tammy,Clueless outfit (90's reference),So cute! Felt like Elle from Clueless.,"February 11, 2020",Other
https://www.renttherunway.com/pdp/items/DVF309,Courtney,First Pencil Skirt that worked for me!,"Love, love, love this skirt! The wool is so soft and warm and it hugs your curves nicely. If the price wasn't so steep, I would have purchased it. I wore it several times before sending it back. It's a great piece for your work wardrobe!","February 5, 2020",Other
https://www.renttherunway.com/pdp/items/DVF309,Emily,Fun pattern with a pop of color,"I wore this skirt to work. I loved the pattern and the yellow pop. It is a pull-on skirt with no zipper or buttons. The waistband looked a little strange when exposed, so I had to make sure my shirt folded over it a bit.","January 29, 2020",Work
https://www.renttherunway.com/pdp/items/DVF309,Sondra,Lovin' the Lenna!,"Love love love this Lenna skirt. The fabric is comfortably stretchy and form fit flattering. I love print and texture mixing, so I paired it with RTR's J. Crew Plaid Parke Blazer which also has black/white/yellow plaid houndstooth combined pattern for a yellow/grey effect. For accessories I added a yellow stone arrowhead necklace and a vintage Perry Ellis plaid yellow & grey scarf from Germany. I got lots of compliments on how well put together the outfit look. I will also wear it just with black and possibly other colors in the future.","January 29, 2020",True to Size
https://www.renttherunway.com/pdp/items/DVF309,Destini,Liked it more as the day went on,Was expecting more structure based on the designer. Very comfortable and stretchy. Was a great workday look with a button down and black cardigan. Received lots of compliments.,"January 26, 2020",Work
https://www.renttherunway.com/pdp/items/DVF309,Janis,Perfect for work.,Very comfortable and nice fabric.,"January 15, 2020",True to Size
https://www.renttherunway.com/pdp/items/DVF309,Ruby,Love this skirt!,"I paired this DVF plaid skirt with an oversized sweater I found in my closet that I've never worn before! 🤷‍♀️ I thought it matched the skirt perfectly! 😉 Per product detail, there is a back zipper? But I did not see any zipper.","January 6, 2020",Large
https://www.renttherunway.com/pdp/items/DVF309,Morgan,Tons of compliments!,Stretchy material so don't worry about sizing up,"December 21, 2019",Work
https://www.renttherunway.com/pdp/items/DVF309,Emily,Comfortable and chic work skirt,So comfortable and stretchy. Modest but sexy at the same time. Paired with tights and a sweater for the winter.,"December 19, 2019",Work
https://www.renttherunway.com/pdp/items/DVF309,Natalie,Unique and classic at the same time!,"Perfect for cold weather! This was comfortable, warm, and fashion forward with a color that's so on trend! Received many compliments on this skirt!","November 25, 2019",Other
https://www.renttherunway.com/pdp/items/DVF309,Jacylyn,Perfect Fall Skirt,"The pattern and fabric are perfect for fall! But the best part for me is the fit! Holds its shape, drapes well, and elastic waist is forgiving if you are in between sizes! Will rent again for sure!","November 13, 2019",Work
https://www.renttherunway.com/pdp/items/DVF309,Dana,Why I love unlimited,"I would never buy something like this, but tried it on a whim for fun. Is super comfy ' came to my knees, even as a tall woman. Runs big, wore the 16, buy could have easily done 14 or maybe 12. Will have to try in the future!","October 25, 2019",Work
https://www.renttherunway.com/pdp/items/DVF309,Delna,Most comfortable skirt,This skirt is to die for. It's super stretchy and a great pattern to spice up your wardrobe if you are a simple dresser like me. Paired with a sweater for a conference and wore a 2nd time with a jacket for work. Got lots of compliments. It's a little long if you are short. I just hiked it up above my waist wand you couldn't even tell. The material is knit but not thick and bulky. It has a nice weight to it when it's cold out.,"April 3, 2020",Work
