links_link,links_reviews_name,links_reviews_title,links_reviews_text,links_reviews_date,links_reviews_purpose
https://www.renttherunway.com/pdp/items/TNT123,Monique,Must rent!!,"Usually with dresses like this, they are fitted and show every flaw, but this was loose fitting. I'm usually an xl but per other reviews, I got the large and it was a great fit! I wore to a Galentines networking event. I got so many compliments. Loved it!! To see what else I've tried, follow me on IG @itsminefornow","February 14, 2020",Work
https://www.renttherunway.com/pdp/items/TNT123,Pauline,"Gorgeous unique sweater dress, but runs big","Rented this twice, first time size S was too big and made this look like pajamas so I didn't wear. Re rented at size XS when it became available and is amazing! Normal black bra worked for me and didn't show in the back","February 9, 2020",Everyday
https://www.renttherunway.com/pdp/items/TNT123,Catherine,Pink + SPARKLE + Open Back!,"TTS with plenty of stretch but still holds its shape. It's hard to see in the stock photos but some of the stripes have metallic threads that give them a perfect amount of sparkle. A little long if you're petite but it still worked for me at 5'3"" - just add heels! I had to wear a strapless bra because the straps were visible on the side.","January 24, 2020",Work
https://www.renttherunway.com/pdp/items/TNT123,Rosemary,So many compliments!,Loved this dress so much. It was a great fit.,"January 21, 2020",Party
https://www.renttherunway.com/pdp/items/TNT123,Sofia,Not bra friendly,Really nice dress with beautiful metallic stripes. Nice and comfortable without being too tight. Only downside is the open back which is not bra friendly. The weight of the dress makes it hard to conceal even a strapless bra band.,"January 14, 2020",Work
https://www.renttherunway.com/pdp/items/TNT123,Carla,Bold colors and form fitting,"Absolutely loved this dress and would rent again. Wore to a New Year's Eve party- form fitting, but not too tight and comfortable. Colors are bright and rows of glitter are nice addition without looking like too much.","January 1, 2020",Other
https://www.renttherunway.com/pdp/items/TNT123,Kate,Loveee this dress,Super comfy and stretchy! Could have worn a medium but extremely flattering. Mid calf length is perfect,"December 22, 2019",Everyday
https://www.renttherunway.com/pdp/items/TNT123,Maureen,Not for those who don't want attention!,"Wore to 4 events in 2 days and got tons of compliments. Comfortable, striking, and fit beautifully on me, 42-31-36. Colors as vivid as in photos. The stripes hit me just perfectly. Not at bodycon as I expected with this rib knit. The only con is that I think the hips stretched out a bit after several hours. But then my hips aren't curvaceous to begin with. I would definitely rent this again, in a Small if available.","December 14, 2019",True to Size
https://www.renttherunway.com/pdp/items/TNT123,Alexandra,I honestly may keep this one. It's so good.,"I felt amazing in this dress! Fits like a glove but without being too tight. The backless detail is so gorgeous - I was able to wear a strapless bra and it didn't show. It's comfy, sexy, and so fun with the colors and metallic threading. Really considering buying this, I'm obsessed.","December 7, 2019",Date
https://www.renttherunway.com/pdp/items/TNT123,Alia,Perfect date night dress,Cute dress with sexy peep hole back. The knit does stretch throughout the night. Be mindful you can't wear a strapless bra due to backless part of the dress.,"November 19, 2019",Date
https://www.renttherunway.com/pdp/items/TNT123,Lindsay,Better for taller bodies/smaller boobs,Cute enough dress. My larger chest made me a bit boxy since it didn't come back in after my boobs. Was fine for video calls. I wouldn't have worn it out and about. Pink is very bright and the sparkly threads are a little itchy.,"April 11, 2020",True to Size
https://www.renttherunway.com/pdp/items/TNT123,Tracie,Back was cut way too low!,I was so excited to wear this and it fit perfectly but unfortunately the cutout in the back was way too low so it's impossible to wear with a bra because your bra will show. So disappointed I couldn't wear it!,"March 2, 2020",Work
https://www.renttherunway.com/pdp/items/TNT123,Gretchen,I would never have bought this but I loved wearing it.,Fit great.,"February 21, 2020",True to Size
https://www.renttherunway.com/pdp/items/TNT123,Madi,"Love this dress. Sexy, cozy, and so fun!",,"February 19, 2020",Other
https://www.renttherunway.com/pdp/items/TNT123,Karina,Amazing Dress would totally rent again,good for day and night,"February 5, 2020",True to Size
https://www.renttherunway.com/pdp/items/TNT123,Erin,"Business in the front, party in the back","Very sexy open back, slightly challenging to find bra. Stripes hit in all the right spots, loved this dress--forgot your take pics.","January 30, 2020",Date
https://www.renttherunway.com/pdp/items/TNT123,Jo ann,GREAT Dress!!,And I really enjoyed the stress! Fit beautifully and was extremely comfortable.,"January 9, 2020",Everyday
https://www.renttherunway.com/pdp/items/TNT123,Karen,Comfortable and sexy,From the front this was a professional fun dress for work. From behind I had to make sure I wore the right bra and covered up with a scarf around my shoulders. Then when it was time for happy hour I threw it off.,"December 9, 2019",Work
https://www.renttherunway.com/pdp/items/TH175,Kerry,Very Chic Blazer,"I love love love this blazer. It's very classy and has a great cut for hourglass shapes. The material isn't bulky like some blazers, so it doesn't add weight to you visually. It also seems quite wrinkle resistant. It's Theory, so it's tailored for a narrower frame; I would recommend sizing up if you have muscular arms or broad shoulders.","February 4, 2020",Work
https://www.renttherunway.com/pdp/items/TH175,Diane,"Perfect fit, soft flannel, great color.","I wore this several times over a Trina Turk denim shift and boots. Looks professional and tailored but stylish. Great for fall or winter. The only downside is that the flannel wrinkles when you sit down,","January 20, 2020",Work
https://www.renttherunway.com/pdp/items/TH175,Melissa,Takes you from 9-5 to dinner and drinks,"This lightweight jacket is very versatile. If you are on the fence about sizing, size up as the jacket does run slightly snug in the arms and chest. The only con is that it does wrinkle easily. I had this jacket in for about 15mins and started to notice small wrinkles forming.","October 2, 2019",Other
https://www.renttherunway.com/pdp/items/TH175,Sarah,Perfect Fall Transition Piece,Wore this to work. On the lighter side of blazers which is great for the in between fall weather. Has a slim fit. Would DEFINITELY rent again.,"October 2, 2019",Work
https://www.renttherunway.com/pdp/items/TH175,Lydia,Surpassingly comfortable with room on the arms. This is OLD theory though.,Jacket is old. It's a really soft blazer but still has nice structure. Not a poly blend like a formal blazer. Nice with jeans or cotton pants or casual work dress/skirt.,"February 21, 2020",Everyday
https://www.renttherunway.com/pdp/items/TH175,Angela,Great fit,This is one of my favorite blazers. It's lightweight and travels well. Doesn't look rumpled even out of a suitcase. It's a great neutral that can be paired with jeans or dressed up for work. I bought it.,"January 31, 2020",True to Size
https://www.renttherunway.com/pdp/items/TH175,Eliana,Flawless jacket,This jacket was perfect in every way. The fit was so flattering but professional. I worry about beiges washing me out but this one didn't. Should have purchased!,"January 22, 2020",Work
https://www.renttherunway.com/pdp/items/TH175,Tiffany,Classic piece!,"Wore this to work and a night out. A staple for any wardrobe! Considered purchasing it, but the price tag was a little out of my range.","December 3, 2019",True to Size
https://www.renttherunway.com/pdp/items/TH175,Sarah,Meh,"I love Theory but am underwhelmed by this blazer. Material is great for summer, but not all season. Much more prone to wrinkle than I prefer. Fit is nice and tailored, just as you'd expect from this brand.","November 3, 2019",Work
https://www.renttherunway.com/pdp/items/TH175,Christina,Classic piece,Really versatile wardrobe staple. I got it with my first unlimited subscription and haven't sent it back yet!,"October 31, 2019",Everyday
https://www.renttherunway.com/pdp/items/TH175,RTR Customer,Beautifully made,Stunning for such a simple piece. I felt totally put together. Wore it with a black sheath.,"October 30, 2019",Work
https://www.renttherunway.com/pdp/items/TH175,Marlena,Unique!,"Received so many compliments when I wore this to work. I paired it with medium wash jeans, a white tee, and nude/cork heeled mules. So cute, will rent again!!","October 23, 2019",True to Size
https://www.renttherunway.com/pdp/items/TOD7,Aisha,Perfect jumpsuit,"I wore this for a private event during a long conference weekend and it was the best! Comfy, but elegant with heels, and long enough for my 5'9"" legs with inches to spare! It was a bit large in the front so I was conscious of that, but nothing fashion tape can't fix. I may just buy it.","October 21, 2019",Party
https://www.renttherunway.com/pdp/items/TOD7,Piper,Cute and comfy jumpsuit,I'm 5 foot 10 and usually wear a six or an eight. This jumpsuit fit me fine.,"August 16, 2019",Everyday
https://www.renttherunway.com/pdp/items/TOD7,Meg,Big all around,"It was a bit too loose around the waist, too much room at the arm and neck holes and too long. I wore it with heels but had to use fashion tape to keep the top in place","August 7, 2019",Everyday
https://www.renttherunway.com/pdp/items/TOD7,Hannah,Wouldn't rent this one again,,"March 14, 2020",Other
https://www.renttherunway.com/pdp/items/TOD7,Rebecca,"Tons of compliments, so comfy!",Effortlessly chic!,"September 18, 2019",Everyday
https://www.renttherunway.com/pdp/items/TOD7,Anna,Fun color!,"Too baggy in the chest. Needed a smaller size, but super cute!","August 29, 2019",Large
https://www.renttherunway.com/pdp/items/TOD7,Elizabeth,Way too big and long,Fabric and color nice. Fit super large- size down one to two sizes. Dress up or down.,"August 12, 2019",Everyday
https://www.renttherunway.com/pdp/items/TOD7,Roz,looks v 70s/80s,"i'm into this look! i'm short so had to wear platform wedges w a 5"" heel for this not to drag, but totally worth it. it does run large so if you're smaller than me, i wld avoid this. hits quite low so expect to wear a sports bra or strapless that will peak out. fun and comfortable. wld recommend for a casual wknd!","August 6, 2019",Large
https://www.renttherunway.com/pdp/items/TOD7,Dawn,Cute jumpsuit,"Really liked the jumpsuit, but way too long, even in heels! I'm 5'4"" and had to constantly pull up not to trip over the fabric.","July 15, 2019",Everyday
https://www.renttherunway.com/pdp/items/TOD7,Megan,Great jumper!,"With a long torso, it's difficult to find jumpers/rompers that fit appropriately. It is little loose on top for my small bust - but great for a breezy summer look. Will be wearing again this summer.","July 13, 2019",True to Size
https://www.renttherunway.com/pdp/items/TOD7,Jocelyn,Way too big,I was looking forward to this one piece to slip into for all my errands but it was way too big,"July 12, 2019",Everyday
https://www.renttherunway.com/pdp/items/TOD7,Caroline,"Cute, comfy, flattering","I loved this jumpsuit. It was so comfortable and cute and perfect for vacation. It wrinkled a bit, but they seemed to come out when I wore it. I usually wear a 4/6, and ordered a small. It was baggy on top, so I wore it with a black lace bralet that I felt comfortable exposing. An XSmall would have probably fit a little better.","July 8, 2019",Vacation
https://www.renttherunway.com/pdp/items/TOD7,Shakamar,Loose,"Fit was TTS in the waist but neckline was very loose and length was too long with flats (I'm 5'4"").","July 3, 2019",Everyday
https://www.renttherunway.com/pdp/items/TOD7,Heidy,Coulnt wear,Too large,"June 25, 2019",Large
https://www.renttherunway.com/pdp/items/CLUB35,Allison,Agree too big! Definitely not for petites,"This was way to big, even tho I got the extra small. It had high slits up above my belly button on the side. Might be better with all black.","February 12, 2020",Work
https://www.renttherunway.com/pdp/items/CLUB35,Rachel,Jazz up your outfit,Surprisingly formal- thick blazer material. Hangs well with peekaboo slits on sides. Fun conservative piece to mix things up.,"December 10, 2019",Work
https://www.renttherunway.com/pdp/items/CLUB35,Lauren,Love this vest!,I really liked this piece! It's well made and lays quite nicely. It really elevated a simple outfit!,"November 13, 2019",Everyday
https://www.renttherunway.com/pdp/items/CLUB35,Abby,Great statement piece,Comfortable jacket for the office-- I am always cold. And it has pockets!!!!!,"September 28, 2019",Work
https://www.renttherunway.com/pdp/items/CLUB35,Patricia,Loved this! Wore it many times. Many occasions,So versatile and such a great look,"February 16, 2020",Everyday
https://www.renttherunway.com/pdp/items/CLUB35,Colby,Loved. So sophisticated.,Loved this vest. I felt so sophisticated wearing it and got many compliments. Definitely a great item to elevate any outfit!,"February 8, 2020",Other
https://www.renttherunway.com/pdp/items/CLUB35,Daniella,It's okay... not great.,This vest photographs more refined than it appears in person. In actuality I found it to be a little sloppy in its construction. I wore it to work once and sent it back.,"December 14, 2019",Work
https://www.renttherunway.com/pdp/items/CLUB35,Clarissa,"High quality, versatile garment","I loved this rental. Actually can’t stop thinking about it and considering buying. I was able to wear it many times, mostly in professional settings. It’s stylish and flattering, with the pomp of a blazer and the swing of a jacket. On top of black pants and a black long-sleeve shirt, it’s the perfect piece to elevate my typical work uniform.","December 8, 2019",True to Size
https://www.renttherunway.com/pdp/items/CLUB35,Emily,Great for work and play,I wore this twice a week for the month I rented it. I could transition it from work or to the weekend. It was great to wear during the holidays. I received a ton of compliments when I wore it! Great pockets too.,"November 20, 2019",True to Size
https://www.renttherunway.com/pdp/items/CLUB35,Malorie,Love this! Might keep it...,The material is very thick and you can see the quality in this piece. I love Club Monaco for classic yet stylish staples and this is perfect for over a dress or a turtleneck.,"October 16, 2019",Work
https://www.renttherunway.com/pdp/items/CLUB35,RTR Customer,For Work,Fit perfectly,"October 8, 2019",True to Size
https://www.renttherunway.com/pdp/items/CLUB35,Kelley,Loving this item. Great fall transition item.,Heavy fabric but not in a bad way. Loving this fit.,"September 26, 2019",True to Size
https://www.renttherunway.com/pdp/items/CLUB35,Laura,Yes,Fit well. Stylish. Wore with sleeveless silk black shell and skinny pants for sleek work look with heels.,"September 14, 2019",Work
https://www.renttherunway.com/pdp/items/CLUB35,Alaina,Too large to wear,"I so wanted to love this as I had it in mind for a work trip to Paris, and it came new with tags. Unfortunately the Small was too large and since the material was heavy, it created a boxy fit and showed no figure whatsoever so I had to send back without wearing. I recommend sizing down.","September 12, 2019",Work
https://www.renttherunway.com/pdp/items/CLUB35,Jill,Interesting silhouette,"I have wide shoulders, so normally wear size 10 tops. But the large was very big on me. It was a nice blazer material, heavy weight. Dressed up a tank top for work. But if you want it to show any shape, size down.","September 4, 2019",Large
https://www.renttherunway.com/pdp/items/KHT15,Nancy,So unique!,I absolutely love this shirt. Great quality and fun. It's fabric is a nice weight and isn't see through. You can dress this up or down!,"January 10, 2020",Other
https://www.renttherunway.com/pdp/items/KHT15,Dabe,Statement Blouse,"If this blouse wasn't so dang expensive, I'd buy it right now. The PERFECT top for making a statement all while wearing comfy jeans. Not see through at all, and so soft!","December 20, 2019",Work
https://www.renttherunway.com/pdp/items/KHT15,Norine,Looks pretty much as pictured,"The fabric is a sort of crepey fabric. I found it a little bit warm. For me, it was too much shirt. I wore it for a few hours and took it off, too hot, too much fabric in the way.","April 2, 2020",True to Size
https://www.renttherunway.com/pdp/items/KHT15,Lulu,"Cute silhouette, but couldn't get it on.","Everything about it was great, except the shoulder holes and arm sizes were so small I couldn't get it on. Great material with no give.","February 25, 2020",Small
https://www.renttherunway.com/pdp/items/MDW22,Natasha,Tiger Queen,"Cute and comfy tiger stripes. Very cropped, high waisted pants required. Was cute but a little boxy.","April 17, 2020",Everyday
https://www.renttherunway.com/pdp/items/MDW22,Michelle,Fun and Stylish!,"I loved this sweater! I was in the mood to try something different- I don't usually do animal prints or cropped anything. It's definitely cropped, so I paired it with a black tank top each time I wore it. I ended up using this for work, date night, and a beach party. It was fun, comfortable, and I received so many compliments! I would definitely rent this again.","March 3, 2020",Other
https://www.renttherunway.com/pdp/items/MDW22,Danielle,"Love the pattern, don't love the cut!","I know it's the fashion trend but, I don't love short sweaters. This one was a little too short for me. I've paired it with jeans and felt uncomfortable but, with a high waisted black skirt I liked it better.","March 2, 2020",Everyday
https://www.renttherunway.com/pdp/items/MDW22,Skylar,Comfy and cute!,"This is definitely a cropped sweatshirt, but works great with high-waisted jeans/pants. I was going to try to pull it off for work but it's clearly a sweatshirt, so although more elevated than a normal pullover, it's still pretty casual. Flattering fit and great length, especially if you have a shorter torso.","February 20, 2020",Everyday
https://www.renttherunway.com/pdp/items/MDW22,Amy,Perfect little sweatshirt,Great sweatshirt! I wore it to travel in. I will probably rent again or go buy it. It is not super heavy but super comfortable. Runs true to size.,"January 28, 2020",Everyday
https://www.renttherunway.com/pdp/items/MDW22,Melissa,Meh,"This is most definitely NOT a sweater. It's totally a sweatshirt. Definitely not for work. So I wore it with jeans to a party and it was fine. As others have said, it's very cropped, so beware","December 19, 2019",Everyday
https://www.renttherunway.com/pdp/items/MDW22,Erinn,Cute casual,"More of a thin sweatshirt material than a sweater, but very versatile I wore it to work and on the weekend","December 3, 2019",Everyday
https://www.renttherunway.com/pdp/items/MDW22,Noella,Birthday sweater,I wore this on my birthday and love it. Thin sweeter. Not too bulky. Size up one for comfort.,"November 26, 2019",Other
https://www.renttherunway.com/pdp/items/MDW22,Tana,Cropped,Cropped but super cute and comfy,"November 12, 2019",Other
https://www.renttherunway.com/pdp/items/MDW22,Denise,Cute enough,"Glad I rented it, it was cute and went with lots of things","March 6, 2020",Everyday
https://www.renttherunway.com/pdp/items/MDW22,Anne,N/A,This is sweatshirt material that is starting to show its wear a bit. It fit well and looked as I expected!,"March 6, 2020",True to Size
https://www.renttherunway.com/pdp/items/MDW22,Kristie,Comfy and cute,Loved this cozy sweatshirt. The cropped look was stylish with jeans. Comfy enough for around the house wear and looked dressy enough for a family night out. Will rent again!,"February 11, 2020",Everyday
https://www.renttherunway.com/pdp/items/MDW22,Georgeanne,"lightweight, good for layering",looks great wtih a heavily starched white collared top or dress underneath fun length,"February 11, 2020",Small
https://www.renttherunway.com/pdp/items/MDW22,Lauren,Great fabric!,"This is definitely more of a sweatshirt material than an actual sweater, which I liked, but it runs REALLY short.","January 28, 2020",Small
https://www.renttherunway.com/pdp/items/MDW22,Molly,First time!,Definitely more dropped but super cute and cozy!,"November 23, 2019",Everyday
https://www.renttherunway.com/pdp/items/MDW22,Lynore,Love!,This was more like nice sweatshirt material. It fit perfectly for me but I can imagine it might be too short for taller girls.,"November 5, 2019",Other
https://www.renttherunway.com/pdp/items/MDW22,Lacey,Easy everyday sweaters,More cropped than I would have liked. It worked well with high waisted pants.,"October 21, 2019",Everyday
https://www.renttherunway.com/pdp/items/NZE2,Hailey,Cozy fur dream,Got so many compliments on this coat. I never buy any light colored coats so it was so nice to rent one. It definitely is loose fitting so you should either get your actual size or size down. I was happy with my normal size though!,"March 3, 2020",Everyday
https://www.renttherunway.com/pdp/items/NZE2,Candice,Love this teddy!,It's getting too warm in LA to wear this but it's so soft and comfortable I want to keep it. Runs large. I threw this on top of jeans and a tee and this fancy Mugler dress. I love it!,"February 2, 2020",Party
https://www.renttherunway.com/pdp/items/NZE2,Sandra,Kept for Weeks,Wanted to buy this! Adrorable and fun,"January 31, 2020",Other
https://www.renttherunway.com/pdp/items/NZE2,Kayla,Winter white,This coat runs large but looks cute and oversized. Keeps me very warm during nyc winters. I never buy white/light colored coats so it was fun to try something different. This coat goes down to about mid calf.,"December 31, 2019",Everyday
https://www.renttherunway.com/pdp/items/NZE2,Brit,It's like a robe you can wear outside,"Basically a bathrobe, but you can make it FASHION. Multiple times while I was wearing this people would come up and pet me. So if that's your vibe this is the coat for you. Runs large!!!","December 19, 2019",Everyday
https://www.renttherunway.com/pdp/items/NZE2,Kassie,Fun Faux Fur Coat,Very warm and comfortable. Went well with work outfits. The fur did seem a little worn out though!,"February 28, 2020",Work
https://www.renttherunway.com/pdp/items/NZE2,Candice,Huge,Even the Medium was huge - I didn't end up wearing.,"February 27, 2020",Party
https://www.renttherunway.com/pdp/items/NZE2,Lauren,Doesn't work for tall folks!,"Loved the look and feel of this coat, but the arms were laughably short on me! I'm 5'9"" with arms on the slightly longer side.. these sleeves hit me mid-forearm. The body of the coat was great, but I couldn't do it with such short sleeves.","February 17, 2020",Everyday
https://www.renttherunway.com/pdp/items/NZE2,Maggie,Definitely a statement coat! It definitely turned a lot of heads,It's a very beautiful and cozy coat. It feels more like a statement coat than a winter coat though - it only has one button. I wish I rented it in November but it's not warm enough for January/February in New York City.,"January 21, 2020",Large
https://www.renttherunway.com/pdp/items/NZE2,Stephanie,HUGE POLAR BEAR VIBES,"I'm 5'2"" and this was huge on me. I returned it immediately without wearing it. It did feel warm but I looked like a polar bear.","January 21, 2020",Other
https://www.renttherunway.com/pdp/items/NZE2,Ren,So many compliments!,"I receive so many compliments with this coat. It is not super warm, think LA winters. I live in NYC and layer a windbreaker underneath. Regardless of how underdressed I am, this coat makes up for it - so gorgeous and chic. I will most likely end up buying this one.","January 21, 2020",Everyday
https://www.renttherunway.com/pdp/items/NZE2,Veronica,Weird fit,Large all around. Sleeve length was too short. So I was cold in this coat,"January 19, 2020",Other
https://www.renttherunway.com/pdp/items/NZE2,Cara,Love this coat,This coat feels so much more expensive than it is. The quality is amazing. It's very warm.... warm enough for NYC winters. Compliments from everyone.,"December 31, 2019",Everyday
https://www.renttherunway.com/pdp/items/NZE2,Stephanie,Fuzzy coat without the bulk,"This coat was super cute and soft. Unlike the other teddy coats, it was semi light weight and not bulky. I'm top heavy so I look like a linebacker with some teddy coats but this one was different and I felt great. I'm normally a large and ordered a medium and could of definitely sized down to a small.","December 28, 2019",Party
https://www.renttherunway.com/pdp/items/NZE2,Karen,Warm and cozy,Fits great with a nice weight to it. Great way to bring your winter style up a notch. Rented the white and received lots of compliments. Was able to dress it up and also where with jeans and tennies,"December 24, 2019",Everyday
https://www.renttherunway.com/pdp/items/NZE2,Elizabeth,Not beige,"It's pink. Most definitely pink. Absolutely not beige. Brand new, very nice quality just the pink threw me and wasn't my style. Runs large but style / fit as expected.","December 17, 2019",Other
https://www.renttherunway.com/pdp/items/NZE2,Priscilla,Chic and easy,Slightly boxy with ample arm room which is great for wearing over winter layers. It has a wonderful drape and feels soft as butter. Loved wearing this over casual denim.,"December 14, 2019",Everyday
https://www.renttherunway.com/pdp/items/EQ131,Christine,Good work jumpsuit,Comfortable and chic. I really liked this piece for work.,"January 13, 2020",Work
https://www.renttherunway.com/pdp/items/EQ131,Sondra,Classy one and done,"Very nice jumpsuit, beautifully done. It was a little formal for my everyday job, but worked well for a couple of work holiday and evening events. True to size and easy, classy piece.","December 24, 2019",True to Size
