links_link,links_reviews_name,links_reviews_title,links_reviews_text,links_reviews_date,links_reviews_purpose
https://www.renttherunway.com/pdp/items/JE135,Dana,This sweater rocks!,"Love it - comfortable, cozy, and stylish. The color of the sweater has a green tinge - definitely chartreuse and not golden yellow. This will be great for multiple events over the Thanksgiving holiday weekend.","November 20, 2018",Everyday
https://www.renttherunway.com/pdp/items/JE135,Jennifer,The perfect sweater!,"I loved everything about this sweater - it was warm without being heavy, the fit was modern with an interesting silhouette, and the color is right up my alley. I really thought about keeping this one! I know some reviewers found it itchy, but that was not my experience, mine was soft and comfy. Highly recommend.","April 27, 2020",Everyday
https://www.renttherunway.com/pdp/items/JE135,Azra,"Unique, comfortable sweater!","This sweater is a very unique color, more lime green than shown in the photo. It is slightly itchy but manageable and fits true to size. I would definitely recommend.","March 12, 2020",True to Size
https://www.renttherunway.com/pdp/items/JE135,Tara,Lots of compliments but extremely short!,So wish this had another couple inches in length!,"February 28, 2020",Work
https://www.renttherunway.com/pdp/items/JE135,Shanno,Nice color,Fun color to wear that I wouldn't normally buy. Loved the sleeves but it was a little cropped,"January 10, 2020",Everyday
https://www.renttherunway.com/pdp/items/JE135,Carol,Wouldn't rent again.,"Color is more green than yellow as photos led me to believe, but the sweater was still cute. However, the material was itchy and by the end of the night my neck was hot, red, and blotchy. It's too bad, because it was pretty!","December 25, 2019",Large
https://www.renttherunway.com/pdp/items/JE135,Terese,Great color and fit,"Fit perfectly, the turtleneck is not too high or bulky. The color is truly mustard, nice and bright.","December 16, 2019",True to Size
https://www.renttherunway.com/pdp/items/JE135,Emily,SO comfortable and a great color. Lots of compliments from friends and coworkers.,"I ordered it in the small based on reviews and i'm glad I did. I like my sweaters to be a little bit oversized and this one still is even in a small. One note is that the sleeves aren't as poofy as they look in the photo, but I'm okay with that!","November 18, 2019",True to Size
https://www.renttherunway.com/pdp/items/JE135,Emily,Fabulous color!,Fit was a bit oversized but I liked it that way. I got a lot of compliments on the color! The sweater itself if VERY warm though so keep that in mind if it's not quite sweater weather yet near you!,"October 31, 2019",True to Size
https://www.renttherunway.com/pdp/items/JE135,Angela,Non itchy and beautiful color,Great piece. I love that the fabric is non itchy and not too warm. Perfect for Fall in the Bay. The vibrant color is rich yet not too much. I love it.,"October 21, 2019",True to Size
https://www.renttherunway.com/pdp/items/JE135,Shealia,Cute cut but not my color.,Didn't end up wearing this because I was expecting the color to be marigold but it had a little more green in it than I wanted. Didn't look good with my complexion (pale and red hair) but the cut was great.,"October 14, 2019",Everyday
https://www.renttherunway.com/pdp/items/JE135,RTR Customer,Love the color. Warm and cozy.,Fits great. Not to long but does not fit short and show stomach either.,"September 12, 2019",True to Size
https://www.renttherunway.com/pdp/items/JE135,Caroline,2nd time I rented this,Comfy and good looking sweater in a nice color. Forgot I rented it before and picked it again! Didn't disappoint,"September 10, 2019",Other
https://www.renttherunway.com/pdp/items/JE135,RTR Customer,Cool-girl sweater,"Fantastic color, a sweater that got compliments everywhere I went on my vacation in the Pacific NW. I felt stylish in it with some high waisted jeans. Great piece!","May 8, 2019",Vacation
https://www.renttherunway.com/pdp/items/JE135,RTR Customer,Gorgeous color-pop,This sweater is s rich mustard color that just pops ! The cut is great for highwaisted jeans !,"April 28, 2019",Everyday
https://www.renttherunway.com/pdp/items/JE135,Luciana,Loveeeed it,"There's nothing like a mustard yellow sweater, and this one fit the bill perfectly","April 20, 2019",Everyday
https://www.renttherunway.com/pdp/items/JE135,RTR Customer,n/a,"Gorgeous. Color, which is definitely more green than gold, is amazing. I would have bought this but it was a little heavy for San Diego. I'll rent it again.","April 5, 2019",True to Size
https://www.renttherunway.com/pdp/items/JE135,Angela,A beautiful top for any day,"A great shape and a special look for the office or out on the town. Comes up short, so be aware when pairing.","April 5, 2019",True to Size
https://www.renttherunway.com/pdp/items/JE135,Megan,Beautiful sweater,"Great sweater! Not itchy, color was beautiful and shape was flattering. I loved the sleeves.","March 25, 2019",Everyday
https://www.renttherunway.com/pdp/items/JE135,Leslie,"Beautiful color, cool style","This was a flattering color, not too bright, not too dull, and made me feel chic and trendy as soon as I put it on!","March 12, 2019",True to Size
https://www.renttherunway.com/pdp/items/JE135,Jasmine,Great sweater,Great looking sweater! Got many compliments on the color!,"February 28, 2019",Everyday
https://www.renttherunway.com/pdp/items/JE135,Sarah,Great every day sweater!,Very cute! Got tons of compliments. Only wore once since it's pretty distinct. The neck is a touch itchy and it's a little short for me. Could barely tuck without it coming out every time I moved my arms. That said would still rent again,"February 28, 2019",Everyday
https://www.renttherunway.com/pdp/items/JE135,RTR Customer,Not the right shape for my body.,the color was more green than yellow and it was a bit short.,"February 18, 2019",True to Size
https://www.renttherunway.com/pdp/items/JE135,Desiree,Did not Wear,Sleeves are like balloon sleeves? Not as soft as you think it would be. Did not wear.,"February 10, 2019",Everyday
https://www.renttherunway.com/pdp/items/JE135,Stephany,I love the knit around the chest area; it acts a minimizer.,"It fits very well. The sleeves are a little long, but that's always a problem for me. I wore it with the plaid Trina Turk pants and it was a hit.","February 6, 2019",True to Size
https://www.renttherunway.com/pdp/items/JE135,Michelle,Great color!,Nice fit. I loved the color,"February 2, 2019",Everyday
https://www.renttherunway.com/pdp/items/JE135,Alessandra,Very cute sweater love the color!,"Great knit sweater with cute details. Ribbed, somewhat chunky and oversized, but maybe a little cropped if you have a longer torso or broad shoulders. The color is very cute and 70s! Wore a few times over the week and would def rent again!","January 18, 2019",True to Size
https://www.renttherunway.com/pdp/items/JE135,RTR Customer,Comfy sweater for a casual work look,"This sweater kept me warm and chic at work! I paired it with black pants and chunky earrings, and I felt great. The material was pretty good; I did expect it to be a little more plush, but overall it was comfortable. A great work or weekend piece!","January 18, 2019",Work
https://www.renttherunway.com/pdp/items/JE135,Alex,💛💛💛,Obsessed with this sweater. Wore dressed up and down. Seriously considering buying it!,"January 13, 2019",Everyday
https://www.renttherunway.com/pdp/items/JE135,Ai,The yellow pops very well paired with the theory high waisted leggings.,"The only con is this rental, the sweater had a small snag on it.","December 21, 2018",True to Size
https://www.renttherunway.com/pdp/items/BM655,Sydney,Stunning but...,The V was far too low for me to wear to work. It fit true to size everywhere except the chest area where it was far too roomy for me (I'm 32c-ish). Wish it would have worked because it looked very polished and the color is beautiful.,"April 23, 2020",Work
https://www.renttherunway.com/pdp/items/NUD8,Taylor,I loved this sweater!,"Really cute and different, beautiful color, fit nicely.","March 5, 2020",Everyday
https://www.renttherunway.com/pdp/items/NUD8,Olivia,Fun and bubbly,"Very flattering for a sweater. I really enjoyed the sleeves, and I didn't find it itchy.","January 20, 2020",Everyday
https://www.renttherunway.com/pdp/items/NUD8,Emily,Cute & interesting sweater,"Loved the texture details on this sweater, cute bell sleeves. It is pretty cropped. I'm 5'2 and I felt like it was even a little short on me. Nice coral color, and comfortable!","January 9, 2020",True to Size
https://www.renttherunway.com/pdp/items/NUD8,Lauren,Girly and cute,"Love the bell sleeves and color! The fabric was a little itchy, but fine with a long sleeve shirt underneath. A great sweater to throw over jeans!","January 1, 2020",Other
https://www.renttherunway.com/pdp/items/NUD8,Breanne,"High quality, great sweater!",Let's talk about these sleeves! This sweater is high quality and so much fun! It hit my hips at the perfect spot on me to be worn with high rise jeans.,"December 22, 2019",Everyday
https://www.renttherunway.com/pdp/items/NUD8,Natasha,Cute cozy sweater!,"Loved this I wore it so many times. I like the best causal with high wasted jeans but it was also cute with dress pants for work. It's true the neck hole is tight, do your makeup before putting the shirt on! It was a little itchy around the neck but not too bad.","December 9, 2019",Everyday
https://www.renttherunway.com/pdp/items/NUD8,Kendall,Cute but a little itchy!,"Wore for a casual Thanksgiving day. Very cute & true to size, but as others have noted it has a slight itchiness to it. All in all, a good option for a simple sweater with a fun pop of color!","November 29, 2019",Everyday
https://www.renttherunway.com/pdp/items/NUD8,Chelsea,Such a cute sweater!,Wore this cute sweater and got so many compliments. Loved the color and sleeves. It was a little cropped but still looked good and fit well - especially with boyfriend jeans. I also wore it tucked into a skirt and it was also cute that way as well. Couldn't recommend it enough!!,"October 10, 2019",Everyday
https://www.renttherunway.com/pdp/items/NUD8,Kasey,Loved the bright color!,"Rented this for everyday wear and work. Wore it out to run errands the other day and I loved how it fit. The sleeves are beautiful and I really like the detailing. Paired with ripped jeans and slip on sneakers for errands, planning on wearing to work with nicer high waisted jeans and ankle booties.","October 8, 2019",Everyday
https://www.renttherunway.com/pdp/items/NUD8,Anna,"Gorgeous color and quality, a little warm for March, a little short for my taste","Loved the color, the fun but understated pom poms, and the softness of the wool. Was a little too warm for March, though, and pretty short/cropped.","April 15, 2019",Everyday
https://www.renttherunway.com/pdp/items/NUD8,Bri,Fun bobble sleeves!!,"Loved the coral color of this and enjoyed wearing the bobble-adorned sleeves. The sweater is cropped so I wore it with a black tank tucked into my jeans. The neck hole is rather small when putting on, but didn't bother me while I was wearing.","April 6, 2019",Everyday
https://www.renttherunway.com/pdp/items/NUD8,Tara,Cute crop,This was borderline too short but I am pretty tall. Pair it with some high waisted skinnies and it worked great. I wore it to date night and work!,"March 5, 2019",Everyday
https://www.renttherunway.com/pdp/items/NUD8,RTR Customer,Received so many compliments on this adorable sweater!,"Fit perfectly, fit shows a little stomach so I wore high waisted jeans. Material is warm but breathable. Love it!","February 28, 2019",True to Size
https://www.renttherunway.com/pdp/items/NUD8,Roxanne,So many compliments!,"Fits so comfortably, super soft and warm. I have received so many compliments on this - I might have to purchase!","February 4, 2019",Everyday
https://www.renttherunway.com/pdp/items/NUD8,Amy,Love this sweater!!!,This sweater is so warm and cozy. It fit me great and I got a ton of compliments on it!,"January 17, 2019",Everyday
https://www.renttherunway.com/pdp/items/NUD8,Alissa,Great sweater just a little itchy!,"I really love, love the look of this sweater and the color is just fabulous but alas, as other reviewers noted - it's definitely itchy in the neck area and anywhere you aren't covered (I'm wearing a camisole underneath). If this wasn't itchy, it would be dreamy. I'd probably steer clear if you have sensitive skin - I'm going to power through it :).","January 4, 2019",Everyday
https://www.renttherunway.com/pdp/items/NUD8,Liz,Favorite sweater ever rented!,This sweater was so fun and such a great color. Flattering sleeves. So many compliments.,"December 11, 2018",True to Size
https://www.renttherunway.com/pdp/items/NUD8,Katie,LOVE THIS SWEATER,Such a fun sweater with the raised stitching on the sleeves. Fell in just the right spot at the waist and wore with high waisted jeans. Loose enough to hide thanksgiving dinner belly. Also wonderful color. Would love to buy this because I loved it so much!!!,"November 27, 2018",Everyday
https://www.renttherunway.com/pdp/items/NUD8,Gia,Statement Sweater,"This ran large and I should have sized down to a 46, but I didn't want it to be too cropped. Ended up tucking the front into jeans so it wasn't so baggy. This was a fun color, and the sleeves really make a statement!","April 15, 2020",Large
https://www.renttherunway.com/pdp/items/NUD8,Sudie,This is a cute pop of color....,"sleeves are long, but it hangs nicely. received many compliments--wore it with black pants to dress it up, and with jeans for an everyday look.","March 5, 2020",True to Size
https://www.renttherunway.com/pdp/items/NUD8,Jamie,Wore it for my bachelorette weekend in New Orleans,Love the color and fit! Got sooooo many compliments on it. If lived anywhere that had regular sweater weather I would buy it in a heart beat.,"February 24, 2020",True to Size
https://www.renttherunway.com/pdp/items/NUD8,Dena,Loved it,So many compliments. Can't wait to wear it again.,"February 19, 2020",Work
https://www.renttherunway.com/pdp/items/NUD8,Erin,So cute and so many compliments!,Great color and unique cut garnered tons of compliments from friends. Wish I could buy it!,"January 2, 2020",Everyday
https://www.renttherunway.com/pdp/items/NUD8,Courtney,On wednesdays we wear pink!,"Rented this to see Mean Girls on broadway (on a Wednesday, duh!) Will rent again for sure, it's such a cute sweater!!","December 12, 2019",Other
https://www.renttherunway.com/pdp/items/NUD8,Michelle,So cute!,"Love the color and detail. The one issue is for tall people. It fit great in the chest, but because I'm small on top, the sleeves are short on a tall person. It's not terrible! Definitely slightly cropped. Super cute!","November 19, 2019",Everyday
https://www.renttherunway.com/pdp/items/NUD8,Aimee,Weird Fit,"This sweater has a very odd fit. Neck hole was super tight & difficult to pull over my head. The cropped style isn't really cropped or normal length, falls at an awkward spot & is very boxy. Sleeves were also not nearly as long or dramatic looking as the photo.","October 18, 2019",Everyday
https://www.renttherunway.com/pdp/items/NUD8,Brya,OBSESSED,"I wore this sweater 4 times while I had it! I loved it SO much! It was so versatile, comfortable and trendy! I will probably rent it again I loved it that much!","October 14, 2019",Everyday
https://www.renttherunway.com/pdp/items/NUD8,Ally,Cute sweater - runs small and cropped,Very cute sweater and fun color. Runs small and very cropped. I'm 5'7 and have a very long torso so I needed to wear high waisted pants,"July 22, 2019",Everyday
https://www.renttherunway.com/pdp/items/NUD8,Joanna,Great for fall or winter,Love the color and the fit. Sleeves are unique and I received a lot of compliments.,"May 31, 2019",Everyday
https://www.renttherunway.com/pdp/items/NUD8,Emily,Itchy,Cute sweater. Loved the color. Extremely itchy. I wore this sweater for about an hour and had to go home and change it was so uncomfortable,"April 19, 2019",Everyday
https://www.renttherunway.com/pdp/items/NUD8,Rebecca,A little scratchy and unflattering on me,I wasn't a huge fan of this sweater. The proportions on my body did not work - the sleeves were too big for the cropped look and I found it to be a bit itchy. But it was a pretty sweater and could work on someone with smaller shoulders.,"March 28, 2019",True to Size
https://www.renttherunway.com/pdp/items/NUD8,RTR Customer,"Fun, beautiful spring color!","Super cute, great color, lots of compliments! Definitely worth trying. Heads up tho- the crop is a bit shorter than I expected, you'll need to wear very high rise jean and it's a tad scratchy. I wore it with spanx arm tights (the best invention ever) which made it very warm and the fabric didn't bother me","March 12, 2019",Other
https://www.renttherunway.com/pdp/items/NUD8,RTR Customer,Amazing!,"This sweater is amazing. It has the most amazing ""puffy"" sleeves. The material is soft, but I can see how people with sensitive skin would say it feels itchy. The color is fabulous! My husband wanted me to buy it, and I wish I could. I would definitely rent this again!","March 8, 2019",True to Size
https://www.renttherunway.com/pdp/items/NUD8,RTR Customer,So many compliments,"Loved it, everyone complimented the color.","March 6, 2019",Work
https://www.renttherunway.com/pdp/items/NUD8,Mollie,Cute crop sweater!,Wasn't expecting it to be a crop sweater but was pleasantly surprised!! The bell sleeves balance the crop perfectly. Super cute and fun.,"February 20, 2019",Everyday
https://www.renttherunway.com/pdp/items/NUD8,Aubs,Love this sweater!,"I've gotten so many compliments on this sweater. Definitely size up because it's on the shorter side, but it fits me great having gone up a size. I highly recommend this sweater, it's super cozy and adorable!","February 12, 2019",Everyday
https://www.renttherunway.com/pdp/items/NUD8,Caitlyn,Cute but not suited for my shape,This sweater is cute but didn't do me any favors. A little too boxy and cropped for my shape.,"February 11, 2019",True to Size
https://www.renttherunway.com/pdp/items/NUD8,Karen,Wow!,"Color, style, feel - all great. Wore a thin shirt underneath given reviews. I'd recommend. Great color for drab winter New England days.","January 27, 2019",Everyday
https://www.renttherunway.com/pdp/items/NUD8,Laurel,"Love the sleeves, but the color is too pepto for me","This is a really fun sweater, the fit is good and the sleeves are enormous in the best way. For me the color wasn't right, but I am sure it would work for many others.","January 24, 2019",True to Size
https://www.renttherunway.com/pdp/items/NUD8,Lauren,I felt and looked awesome!,"Beautiful top and fit, slightly cropped, which i hadn't realized,","January 23, 2019",True to Size
https://www.renttherunway.com/pdp/items/ODLRPE278,Jules,Super cute but kept falling,Maybe I have chubby ears but these kept falling off. Such a bummer because they are so cute!,"March 24, 2020",
https://www.renttherunway.com/pdp/items/ODLRPE278,Hadley,Too heavy,Unfortunately these super cute earrings were too heavy and pulled my ears. No way I could wear them at work all day as planned.,"March 3, 2020",Work
https://www.renttherunway.com/pdp/items/SH341,Sandra,Cute sweater dress,"I typically wear a small, I rented this in medium and it was snug. There is not a zipper, so it goes over your head, which I personally hate. But, it was a nice dress and well made. Slightly high waisted and loose in the waist, so I added a belt.","April 29, 2020",Work
https://www.renttherunway.com/pdp/items/SH341,Lisa,Beautiful dress - nicely made and Bernice details. Very flattering.,,"April 22, 2020",Work
https://www.renttherunway.com/pdp/items/SH341,Carol,"Stretchy and thick. Hard to get on, easy to wear","I liked the thick stretchy fabric, which was very forgiving. There is no zipper so it was a challenge to pull on and off. It was body con on me and I probably could have stood to size up.","March 7, 2020",Other
https://www.renttherunway.com/pdp/items/SH341,C,Size up,Body con so it fit me better one size up. Thick knit camouflages lumps so I skipped the Spanx. Great for a work presentation. Was able to wear a blazer. It's on the longer side so it looked better with heels.,"February 29, 2020",Work
https://www.renttherunway.com/pdp/items/SH341,Megan,Very flattering,"As others have recommended, I thought this dress was awesome. I got a lot of compliments on it at work. I will wear it again before I return it. It was tight and showed any seam from undergarments so I wore some Shapeware which made me less comfortable than I would like but that’s also because I chose to go with the smaller of my two typical sizes","February 27, 2020",Work
https://www.renttherunway.com/pdp/items/SH341,Fola,Flattering,The midi length and round neck made this conservative and the body hugging fabric made it flattering.,"February 21, 2020",Other
https://www.renttherunway.com/pdp/items/SH341,Jessica,Good work dress,Comfortable and flattering.,"February 15, 2020",Work
https://www.renttherunway.com/pdp/items/SH341,Rachel,Super Flattering Dress!,"This is such a beautiful dress, the fabric falls well and is super flattering on my body type - pear and I'm sure on many others. It gives you the curves in the right places. I got so many compliments today. Will rent again for sure.","February 4, 2020",Work
https://www.renttherunway.com/pdp/items/SH341,Heather,Nice dress!,"Beautiful, heavy fabric smooths everything out. My photo doesn't do it justice especially in the poor hotel lighting. Wore it for a speaking engagement; lots of compliments.","January 26, 2020",Work
https://www.renttherunway.com/pdp/items/SH341,Marjorie,"Thick material, nice silhouette",True to size and tight. Creates a really nice shape. Got a lot of compliments on it for a work meeting. I also paired with a navy blazer which worked well!,"January 10, 2020",Work
https://www.renttherunway.com/pdp/items/SH341,RTR Customer,Great Fit. Elegant look.,Fits true to size. Nice conservative length. Enjoyed how the darker color was on the bottom. Great for a nice dinner or party.,"December 28, 2019",Party
https://www.renttherunway.com/pdp/items/SH341,Aimee,Sturdy dress,I look terrible in this photo but I liked the dress Fits true to size- it was fitted but not bodycon tight Was a little Loose under bust but I liked it being not super tight. May be tight if you have a big booty. I am 5'6 came to knee cap Was thick but not stifling No itch comfortable Colors were okay _ a little muted,"November 24, 2019",Formal Affair
https://www.renttherunway.com/pdp/items/SH341,Madison,Cute and flattering,"Wore this dress for work. It was fitted but comfortable/stretchy. Nice, thick material. Would recommend.","November 16, 2019",Everyday
https://www.renttherunway.com/pdp/items/SH341,Alicia,Unique Work Dress,"Pretty material, comfortable to wear, and perfect for a different dress to work. Great for a rental, as you couldn't wear it too much (people would remember). The blue in particular is very vibrant, the white is not see- through, and no special undergarments needed.","November 15, 2019",Work
https://www.renttherunway.com/pdp/items/SH341,Samantha,"Great dress, unique pattern, very comfy to wear","At first I thought it was a little tight, but it definitely loosened up without getting stretched out and was very comfortable. My boobs looked ENORMOUS. I wouldn't have selected it in store due to the impact of my boobs, but given I received it by mail, I decided to wear it to the office anyway. I received compliments all day long, but felt slightly self conscious up top.","November 11, 2019",Work
https://www.renttherunway.com/pdp/items/SH341,Casandra,Loved it!,Received many compliments!,"November 7, 2019",Other
https://www.renttherunway.com/pdp/items/SH341,Ginny,Sent me the wrong item. But loved the shirt,I tried to rent out the dress but reviewed the incorrect item. Was not very happy at first but ended up loving the shirt,"November 7, 2019",Work
https://www.renttherunway.com/pdp/items/SH341,Nicole,Cute but weird fabric,Very cute dress but the fabric is kind of weird and does not hide any flaws and is not very soft.,"November 5, 2019",Other
https://www.renttherunway.com/pdp/items/SH341,Barbi,Beautiful knit - great for travel,"This is a great travel dress - the knit is thick and high quality. It fit very bodycon, so a size up would also work. Looked more conservative than I expected.","October 21, 2019",Work
https://www.renttherunway.com/pdp/items/SH341,Lisa,Great dress! Lots of compliments.,The length was a tad long but overall it fit well and was perfect for temple on the high holidays. Would be great for work too.,"October 19, 2019",Other
https://www.renttherunway.com/pdp/items/SH341,Kristel,So comfortable and classy,"I loved this dress and felt so confident. I see in the pictures my bra should have been more supportive cause I was a little ""low"" after a long day lol. The dress doesn't necessarily photograph well due to the black and navy bottom but it looks amazing in daylight.","October 17, 2019",Work
https://www.renttherunway.com/pdp/items/SH341,Sasha,Beautiful print,Beautiful print and runs slightly large. Heavy fabric that looks very lux! I enjoyed the style and comfort of this dress.,"October 14, 2019",Work
https://www.renttherunway.com/pdp/items/SH341,Ashley,All around amazing!,This dress is epic. Compliments all day at a work event. Fit like a glove and gorgeous fabric!,"September 12, 2019",Work
https://www.renttherunway.com/pdp/items/SH341,Kemi,Fits perfectly!,There is a really nice weight to the dress. It just feels good on you. It hugs your curves but is so comfortable at the same time. Really beautiful pattern. I got so many compliments today.,"September 12, 2019",Work
