"links_link","links_reviews_name","links_reviews_title","links_reviews_text","links_reviews_date"
"https://www.nuuly.com/products/stones-flocked-leopard-tongue-tee?color=001","jillcarter","Fun tee!","I wore this tee with jeans and docs. I got a lot of compliments although I got the medium and it definitely fit like a Large. I wish I had ordered the Small!","30-Jan-2020"
"https://www.nuuly.com/products/stones-flocked-leopard-tongue-tee?color=001","clarekhogan","Love this top","I loved this top so much, I really should have bought it! I wore it a bunch for concerts, or as just a fun pairing with jeans.","28-Jan-2020"
"https://www.nuuly.com/products/stones-flocked-leopard-tongue-tee?color=001","MMB","Perfect Comfy TShirt","Obsessed with this slightly oversized tee! It fit loosely and looked great with jeans or tucked into a skirt! I’m very seriously considering keeping it!","27-Jan-2020"
"https://www.nuuly.com/products/stones-flocked-leopard-tongue-tee?color=001","carolekv","Great T-shirt","I love this cute shirt. Haven’t worn yet but will a lot in summer, I am sure. It’s comfy, with great colors and an adorable image","22-Jan-2020"
"https://www.nuuly.com/products/stones-flocked-leopard-tongue-tee?color=001","CocoJax","Real cute and REAL BIG","I did dark jeans and leopard sneakers with this - cute and comfy and real big. I normally wear a small and ordered the extra small and still had to tie it at the waist. Soft, cute with just about anything.","21-Jan-2020"
"https://www.nuuly.com/products/stones-flocked-leopard-tongue-tee?color=001","Megabyte","The best graphic tee!","Only great things to say about this one! Super soft and cozy. Wore it with leggings and camo jacket and sneakers one day and then with flares and a leather jacket that night!","17-Jan-2020"
"https://www.nuuly.com/products/stones-flocked-leopard-tongue-tee?color=001","chandlerlayne","Casual and so cute!","Loved this! It fit pretty true to size (maybe a little on the large side). I wore this multiple times and got lots of compliments on it.","14-Jan-2020"
"https://www.nuuly.com/products/stones-flocked-leopard-tongue-tee?color=001","Court91","Comfortable - soft","Loved this one. The perfect oversized tee. In tops, I usually wear a medium but knowing this is an oversized tee I ordered a small. The fit was great. If you're short, this will be on the longer side for you. But you can tuck it if you don't like wearing it long. I wore it both ways. Super versatile - I wore it to run errands as well as go out. Also, really soft material. Almost bought this one.","11-Jan-2020"
"https://www.nuuly.com/products/stones-flocked-leopard-tongue-tee?color=001","Genericwhitechick","Cool, relaxed tee","The material was very soft and I loved the design on the front. It is large and slouchy. May size down if I order this again.","8-Jan-2020"
"https://www.nuuly.com/products/stones-flocked-leopard-tongue-tee?color=001","Jaqqnicole","So fun!","Felt rad and hip in this! Would buy & jeep since i love it so much, but $60 for a t-shirt is a bit much for me.","4-Jan-2020"
"https://www.nuuly.com/products/stones-flocked-leopard-tongue-tee?color=001","MollyMadness","Adorable!","Sassy and fun! Loved this statement T-shirt. Got tons of compliments.","4-Jan-2020"
"https://www.nuuly.com/products/stones-flocked-leopard-tongue-tee?color=001","Caribrooke","Cute top. Over-sized.","Loved the print on the front and the soft cotton fabric. Was a big though so harder to dress up. Looked a little slouchy. Could see it being easier to dress up if I had a long/lean body type. Would rent again in a smaller size.","4-Jan-2020"
"https://www.nuuly.com/products/stones-flocked-leopard-tongue-tee?color=001","emerald_gypsy","super fun tee","I wore this to a friends surprise party and a few other times! it was easy to wear and to mix/match with different pants","2-Jan-2020"
"https://www.nuuly.com/products/stones-flocked-leopard-tongue-tee?color=001","Renee1005","Perfect tee","The fabric on this shirt is amazingly soft. Shirt is oversized but meant to be that way. Loved the graphic and my boyfriend complimented me on the graphic as well.","2-Jan-2020"
"https://www.nuuly.com/products/stones-flocked-leopard-tongue-tee?color=001","Valski","Loved it","I dressed it up with party pants and also paired it with leggings to teach Pilates in. Fun shirt! Be warned though, it’s big!","31-Dec-2019"
"https://www.nuuly.com/products/stones-flocked-leopard-tongue-tee?color=001","Leesawe","Super comfy tee!","Loved this tee, it was super soft and the perfect size- not tight, not overly baggy but just right.","27-Dec-2019"
"https://www.nuuly.com/products/stones-flocked-leopard-tongue-tee?color=001","KrysteeJ","Perfect Everyday Tee","I loved this so much I’m keep it. Have pair with leggings and a jean jacket, jeans and booties and skirts.","26-Dec-2019"
"https://www.nuuly.com/products/stones-flocked-leopard-tongue-tee?color=001","Akmoss","Love","Love with leggings and midi skirt","25-Dec-2019"
"https://www.nuuly.com/products/stones-flocked-leopard-tongue-tee?color=001","FashionJem88","Sexy IT tee of the season","Obsessed! Wore it with jeans, skirts, leather pants, and more. Always got compliments. Crazy soft and long short sleeve makes it comfy on arms.","24-Dec-2019"
"https://www.nuuly.com/products/stones-flocked-leopard-tongue-tee?color=001","AltheaK","Great travel shirt","Great for travel. Super comfy, but hey! I’m still put together.","20-Dec-2019"
"https://www.nuuly.com/products/stones-flocked-leopard-tongue-tee?color=001","Gguarino66","Oversized","Jeans and jean jacket!! Super cute","20-Dec-2019"
"https://www.nuuly.com/products/stones-flocked-leopard-tongue-tee?color=001","emmap123","Love","Love this top it’s so cute and fun! The Medium was a tad big on me i wish i got it in a small but still worked perfect","14-Dec-2019"
"https://www.nuuly.com/products/stones-flocked-leopard-tongue-tee?color=001","bbd818","SIZE DOWN","I ordered my regular size medium and it looked like I borrowed my boyfriend's shirt. It's so big I can't really wear it as it looks too sloppy. If it was the right size I would love it, really soft material and cute design - bummer!","9-Dec-2019"
"https://www.nuuly.com/products/stones-flocked-leopard-tongue-tee?color=001","Cece129","Great Tshirt Material","Well made with a cool graphic.","4-Dec-2019"
"https://www.nuuly.com/products/whimsical-pintucked-blouse?color=049","asdf","Cute everyday tank","Nice material great for hot weather, longer in the back","7-May-2020"
"https://www.nuuly.com/products/marilee-trucker-jacket?color=060","","","",""
"https://www.nuuly.com/products/femme-striped-jumpsuit?color=015","","","",""
"https://www.nuuly.com/products/provence-embroidered-mini?color=095","rnphotog","Cute but Not My Style","Cute in concept, but on my body type it just didn't work, it was a lot of structure in fabric, but an attempt at whimsy with design. Not the right mash up for me.","13-May-2020"
"https://www.nuuly.com/products/provence-embroidered-mini?color=095","SoFloLady","Love!","I loved this dress! I tend to be more comfortable in long maxi dresses but this dress was so cute and I received tons of compliments!","8-May-2020"
"https://www.nuuly.com/products/provence-embroidered-mini?color=095","Lilycass","It was okay...","Felt oversized overall and voluminous in the sleeves. The material is also thick which isn't great for hot humid GA summers. Really wanted to love this, but fell short. Maybe try ordering a size down?","6-May-2020"
"https://www.nuuly.com/products/provence-embroidered-mini?color=009","rnphotog","Cute but Not My Style","Cute in concept, but on my body type it just didn't work, it was a lot of structure in fabric, but an attempt at whimsy with design. Not the right mash up for me.","13-May-2020"
"https://www.nuuly.com/products/provence-embroidered-mini?color=009","SoFloLady","Love!","I loved this dress! I tend to be more comfortable in long maxi dresses but this dress was so cute and I received tons of compliments!","8-May-2020"
"https://www.nuuly.com/products/provence-embroidered-mini?color=009","Lilycass","It was okay...","Felt oversized overall and voluminous in the sleeves. The material is also thick which isn't great for hot humid GA summers. Really wanted to love this, but fell short. Maybe try ordering a size down?","6-May-2020"
"https://www.nuuly.com/products/zadie-satin-jumpsuit?color=018","","","",""
"https://www.nuuly.com/products/chevron-slip-dress?color=095","","","",""
"https://www.nuuly.com/products/mairead-midi-dress?color=018","SnooMama","Unflattering; gaping in the bust","This dress ran a little small for me, and gaped in the bust (which meant it was unwearable without a camisole to cover me up underneath).","11-May-2020"
"","","","",""