"links_link","links_reviews_name","links_reviews_title","links_reviews_text","links_reviews_date"
"https://www.nuuly.com/products/nellie-corduroy-culottes?color=066","catmom","Perfect Fit","Loved these pants. They fit true to size...actually maybe a teeny bit more roomy than other sz 24 pants I've tried on. I didn't realize it from the photos, but these actually have a lot of stretch in them which made them extra comfortable. I'm short, so they weren't as cropped don me as the picture, but I still loved them and wore them several times. The color is also really nice and trendy. If I wore color more, I would totally buy these. But they were perfect to have for a month.","2-Jan-2020"
"https://www.nuuly.com/products/nellie-corduroy-culottes?color=066","hinseattle","Fun corduroys","These were a fun rental piece. I would not buy though. I loved the color, length, and wide-leg. They were a little too bootylicous for me to wear to work, so I either had to do a long cardigan for work to cover my butt or save them for going out. I got lots of compliments wearing them though!","1-Jan-2020"
"https://www.nuuly.com/products/nellie-corduroy-culottes?color=066","emilytshirt","soft and comfortable","these were a super soft corduroy that almost felt like wearing sweatpants. cute color and high waisted enough to feel comfortable in. i styled this with a black turtle neck and black heeled booties.","31-Dec-2019"
"https://www.nuuly.com/products/nellie-corduroy-culottes?color=066","atxchristina","Cute and comfy!","Great pants. Wore multiple times.","30-Dec-2019"
"https://www.nuuly.com/products/nellie-corduroy-culottes?color=066","Doodle","Color is perfect!!!","I got tons of compliments on these. The color and style is awesome!! I ordered a size up so they stretched a bit too much after 2-3 wears and I didn’t wear them last that. However, I’ll definitely be renting the smaller size and possibly purchasing!","29-Dec-2019"
"https://www.nuuly.com/products/nellie-corduroy-culottes?color=066","Fuki","I liked them culotte","My second pair of Paiges with Nuuly and I'm hooked! These pants were as comfortable as the last pair and the color was great. They were a little bit looser than I prefer my pants to be so I think you can size down if you like tighter pants. I am only 5'1 so they didn't hit above the ankle but they were so comfortable I still wore them everywhere. And with everything even though the color was pretty bright.","29-Dec-2019"
"https://www.nuuly.com/products/nellie-corduroy-culottes?color=066","HollyT","The best pants","These pants are THE BEST. Can be dressed up or down.","28-Dec-2019"
"https://www.nuuly.com/products/nellie-corduroy-culottes?color=066","Mkidd629","The perfect casual pant","I love how these pants fit they make my waist and legs look small. They are really stretchy and comfortable to wear throughout an entire work day.","27-Dec-2019"
"https://www.nuuly.com/products/nellie-corduroy-culottes?color=066","inthenow","stylish and comfortable","I really liked the feel of these corduroys, they had good stretch to them and were quite soft. If I were to rent again, I would try a size down. I'm pretty consistently a 27, but these had a bit of room in the waist that made them a bit bulky. If it had been cooler here this month, I would have worn them more.","25-Dec-2019"
"https://www.nuuly.com/products/nellie-corduroy-culottes?color=066","AllyE","LOVED. perfect for holiday season","Loved these! Wore to my holiday parties and wearing again to my boyfriends family’s Christmas. Paired with black booties and black turtleneck for a classic look.","23-Dec-2019"
"https://www.nuuly.com/products/nellie-corduroy-culottes?color=066","Boop","Amazing pants","Great fit, and feel like sweatpants. I wish I could keep them. I really like the color.","23-Dec-2019"
"https://www.nuuly.com/products/nellie-corduroy-culottes?color=066","edubbdubb","Great pants!","Super comfortable and a great color. Very true to size.","22-Dec-2019"
"https://www.nuuly.com/products/nellie-corduroy-culottes?color=066","AthenSpec","Comfy fit for petite sizes","Loved the soft pink color and it was the perfect length for my short legs. I would have purchased it, if not for the price and the fact that I purchased most of my case.","21-Dec-2019"
"https://www.nuuly.com/products/nellie-corduroy-culottes?color=066","JoYo","Ah-mazing","There’s pants are so good! They fit so well, super comfortable, and very flattering. I got tons of compliments. Will definitely get again.","14-Dec-2019"
"https://www.nuuly.com/products/nellie-corduroy-culottes?color=066","EricaLouise","Not flattering","Didn’t end up wearing because they were so unflattering.","12-Dec-2019"
"https://www.nuuly.com/products/nellie-corduroy-culottes?color=066","exwaitress","Extremely comfortable and cozy","Great fit, and super comfortable! I'm bigger on the bottom but also short, and always have a difficult time with pants. I went with a 29 for these and definitely could have been comfortable in a 28. These are super cute with ankle boots -- definitely looking forward to putting these into heavy rotation at work for the rest of the month.","7-Dec-2019"
"https://www.nuuly.com/products/nellie-corduroy-culottes?color=066","JessicaSliman","These are so cute!","So cute, so comfy. The one thing from my first nuuly I considered buying. They have a nice about of stretch.","6-Dec-2019"
"https://www.nuuly.com/products/nellie-corduroy-culottes?color=066","Destinynoel1","In love","Love these! Am debating buying them but they are a little too big. Material is soft. Incredibly flattering for loose pants. Cute with everything in my closet. Highly recommend!","6-Dec-2019"
"https://www.nuuly.com/products/nellie-corduroy-culottes?color=066","Annajenn","Such a fun pant for fall/winter!","I got so much wear out of these! The style is so on-trend and the color is gorgeous. My only complaint was that the pants were a little tight around the waist and thighs, and because the material is a little thinner than other cords I'm used to, you could see the stretch of the fabric (not the most flattering). I probably would have kept these if I had sized up.","5-Dec-2019"
"https://www.nuuly.com/products/nellie-corduroy-culottes?color=066","jemx10","Obsessed","I loved these pants! They were so cute, and I received so many compliments. Great brand and quality, and fit me great.","4-Dec-2019"
"https://www.nuuly.com/products/nellie-corduroy-culottes?color=066","mackenzie","So cute!","Love these! If they weren't such a bold color, I would have purchased them.","3-Dec-2019"
"https://www.nuuly.com/products/nellie-corduroy-culottes?color=066","gogoose","So comfortable","I wore these to Thanksgiving dinner. That's how insanely comfortable they are. They are quite stretchy but the high waist keeps them in place. I will probably rent again and maybe purchase.","2-Dec-2019"
"https://www.nuuly.com/products/nellie-corduroy-culottes?color=066","KarlaLiv","Loved them so much I bought them","I usually wear a 27, but I got them in 26 and they were a perfect fit! The color is gorgeous, it’s a beautiful 70s Indian orange. I loved them so much that I bought them. They are comfy and go with everything! New staple item in my closet","1-Dec-2019"
"https://www.nuuly.com/products/nellie-corduroy-culottes?color=066","AmyW","Obsessed","I’m really struggling with deciding if I should buy these, but I feel they were perfect to rent for this season. I got sooo many compliments in these and even had people tell me they loved my style. The fit is so cute - I typically love fitted items and I loved stretching my style with these perfectly oversized pants.","29-Nov-2019"
"https://www.nuuly.com/products/nellie-corduroy-culottes?color=066","coldslaw99","Soft and beautiful","Like another reviewer described, these are buttery soft. The color is gorgeous and they're so flattering. I felt like a cool 70s chick wearing these with a cropped sweater and boots.","28-Nov-2019"
"https://www.nuuly.com/products/nellie-corduroy-culottes?color=066","Kas","Love these","Love the color. Fit great. Almost bought them.","27-Nov-2019"
"https://www.nuuly.com/products/nellie-corduroy-culottes?color=066","JSlope","Rent these pants!","These are the absolute cutest pants. I got so many compliments while wearing them and am planning on buying them from the my Nuuly order. They are really comfortable and the length is perfect for wearing boots or flats or sneakers with. The are a little bit snug in the thigh at first, but once I wore them a few times they fit really well! Rent these pants! You won't be sorry!","24-Nov-2019"
"https://www.nuuly.com/products/nellie-corduroy-culottes?color=066","mfrank","GREAT pants","These are SO cute and SO versatile. I'm normally a 26 and ordered a 26 - they fit perfectly. They're a great marigold color, and I felt like they went with 100 things in my closet already, so I found a lot of opportunity to wear them. And they're easy to dress up or down. Highly recommend!","21-Nov-2019"
"https://www.nuuly.com/products/nellie-corduroy-culottes?color=066","nat_beeee","Very comfy","Loved these! Very comfy. The fabric was a little worn though.","21-Nov-2019"
"https://www.nuuly.com/products/nellie-corduroy-culottes?color=066","MggM","Didn’t love.","I was so torn on these pants. At first I loved them so much - perfect high waist, perfect cropped cut, perfect cord. But then I wore them and eh - they were comfy but something felt not quite right. Then I wore them one more time and pegged it. While they fit me perfectly in the waist, the way the fabric laid coming off my butt made them look super sloppy and saggy behind. It just didn’t match what I expected them to look like as I walked by a mirrored window and scoped out my own butt. :) Also the color is VERY pumpkiny which was a bit much for me.","18-Nov-2019"
"https://www.nuuly.com/products/nellie-corduroy-culottes?color=066","Joanna","The perfect pants do exist!","I am absolutely in love with these pants. On top of looking super great and stylish, they are EXTREMELY comfortable. The material has just enough give so that I can wear them throughout the day, eat, and move around in them, and they’re never too tight. On the flipside, they never stretch out like some pants do, so I can wear them all the time and they never look too big even at the start of the day. Magic? The silhouette is also great. I’m 5’4’ and have a long torso. Sometimes pants of this cut aren’t very flattering on me since they can make my legs look shorter than they are. That was NOT the case with these pants. Definitely considering keeping them!","17-Nov-2019"
"https://www.nuuly.com/products/nellie-corduroy-culottes?color=066","jeesika","Comfortable, stylish!","This is a great piece for shorter people like me (5'3"")! I wore them with everything and almost multiple times a week. The fit was true to size, no elastic in the waist. This was great to wear in the office all day because the legs aren't tight. I wish I could buy these, but they are still expensive used. I wore them with black strappy sandals, but they looked better with any heel.","15-Nov-2019"
"https://www.nuuly.com/products/nellie-corduroy-culottes?color=066","BlueLover","Love me some Fall color","A bit tight, but wearable for an outing because the fabric gives a little. Such a great Fall color. The corduroy is soft and fairly lightweight, which makes it comfortable. My 5'2"" height made these pants less cropped than full-length, but they still looked sharp and intentional.","13-Nov-2019"
"https://www.nuuly.com/products/nellie-corduroy-culottes?color=066","talulasmom","True to size","Fits as expected.","11-Nov-2019"
"https://www.nuuly.com/products/nellie-corduroy-culottes?color=066","Scemcem","Perfect Corduroy Culottes","I love these pants! They are buttery soft and have a bit of stretch to them. The pants aren't too thick so you don't have to worry about getting too hot in these. Keep in mind they hit me right at my ankle and I'm 5'6 so I imagine this might hit someone a little longer if you are shorter. Super awesome pants!","8-Nov-2019"
"https://www.nuuly.com/products/nellie-corduroy-culottes?color=066","KateS","Soft!","These pants are so soft and fit really well. I wore them to work and also on the weekends. I am going to check if they are on the site in another color for my next order of clothes because I liked them so much.","30-Oct-2019"
"https://www.nuuly.com/products/nellie-corduroy-culottes?color=027","Shiny","Wish it were longer","I have fairly long legs for my height (5'6) - wasn't wild about where these hit between the shin and ankle. They also seemed to run a bit big, but I probably could have gone with a 30. Generally cute, just not my style.","14-Apr-2020"
"https://www.nuuly.com/products/nellie-corduroy-culottes?color=027","ericab","Sighhh so dreamy","I love these pants. I've gotten them in multiple colors. So comfy, flattering and cute!!!!","31-Mar-2020"
"https://www.nuuly.com/products/nellie-corduroy-culottes?color=027","JumpingBean","Great stretch and good quality!","I think these run true to size, very good stretch for corduroys! Nice soft pink color went with a lot during late winter and early spring! I would have bought if we had cooler spring!","27-Mar-2020"
"https://www.nuuly.com/products/nellie-corduroy-culottes?color=027","happyhappy","Suprisingly great!","I wasn't sure about these when I first tried them on because they were kind of an in between length - too short to be ankle length and too long to be cropped. But I guess that is what culottes are?? Anyway, I got past that and ended up wearing these a lot. So comfy and the rust / orangey color was great (although March was about the last time I could wear this color - better for fall / winter vs. spring).","24-Mar-2020"
"https://www.nuuly.com/products/nellie-corduroy-culottes?color=027","heyitsmejenni78","Fell in love with these!","I knew I would like these cords, but from the first time I put them on, I was in love. Sometimes I worry cropped pants will look silly on me because I’m tall, but these were the perfect length. They are super stylish and fit perfectly. They’re also extremely comfortable, so they’re great for casual days but can also be dressed up for work.","23-Mar-2020"
"https://www.nuuly.com/products/nellie-corduroy-culottes?color=027","mlp678","great spring cords!","I love cords and I was happy that they were on the thinner side, so this was an easy transition piece into spring. I'm 5'4"" and it hit me right at the ankle (which is what I was hoping for).","12-Mar-2020"
"https://www.nuuly.com/products/nellie-corduroy-culottes?color=027","maklee","So many compliments","I love these pants. If you are in between sizes I would size up. They held their shape really well, and went with everything.","11-Mar-2020"
"https://www.nuuly.com/products/nellie-corduroy-culottes?color=027","megang","Too Small! Size Up!!!","I wear Paige Jeans and I ordered same size in these cords. Barely zippered, could not wear. Would suggest sizing up a size or 2 for better fit!","9-Mar-2020"
"https://www.nuuly.com/products/nellie-corduroy-culottes?color=027","Ddani","Really cute and flattering!","These pants were great! They were really comfortable because they have stretch in them and were flattering because there is no front pockets adding bulk.","9-Mar-2020"
"https://www.nuuly.com/products/nellie-corduroy-culottes?color=027","clairet","LOVE","Love these pink pants! Fun and girly!","8-Mar-2020"
"https://www.nuuly.com/products/nellie-corduroy-culottes?color=027","FridaSD","Fun and flattering","What's not to like about big pink pants? I wore these a lot in the month of February, to work, to an engagement party, and on Valentines day. I received many compliments. My only complaint would be that there are no front pockets.","5-Mar-2020"
"https://www.nuuly.com/products/nellie-corduroy-culottes?color=027","OandTsMama","Awkward fit","The fit of these pants was just not flattering on me. if they were higher waist they might have worked better. Also the color was super unflattering. I think a darker color that would have helped, too.","5-Mar-2020"
"https://www.nuuly.com/products/nellie-corduroy-culottes?color=027","jaykay","Stretchy but still small","This pants are super cute, however even though they stretch A LOT, they were still a little too tight to be comfortable. I wore them once.","4-Mar-2020"
"https://www.nuuly.com/products/nellie-corduroy-culottes?color=027","paigeann","Nice corduroy pants","Wore these to church, out on the weekends, overall easy to throw on pants!","3-Mar-2020"
"https://www.nuuly.com/products/nellie-corduroy-culottes?color=027","CheyB","What you see is what you get","Love these pants. Everything is exactly as it seems. Super comfortable, fit great and I worth them a ton and received a ton of compliments. Definitely recommend these.","2-Mar-2020"
"https://www.nuuly.com/products/nellie-corduroy-culottes?color=027","Lkat","The cutest pants ever","Obsessed. So flattering and cool. Will be buying.","2-Mar-2020"
"https://www.nuuly.com/products/nellie-corduroy-culottes?color=027","ee_watson","V day pants","I ordered these for the month of Feb and wore them several times. I received a bunch of compliments on them!","29-Feb-2020"
"https://www.nuuly.com/products/nellie-corduroy-culottes?color=027","28","Amazing color","The color is amazing! I’m a true 25 and it fit just right at the waist. It felt a 2-3 inches too long for me, but I still tried to make it work.","29-Feb-2020"
"https://www.nuuly.com/products/nellie-corduroy-culottes?color=027","kerileigh","new favorite pants!","so flattering, so comfy, so many compliments","28-Feb-2020"
"https://www.nuuly.com/products/nellie-corduroy-culottes?color=027","Jlittle","Cute but odd.","I really was hoping to love these. Sadly the fabric while thick is also kind of thin. You could seem every bump or jiggle while wearing these. The length is not meant for shorties. Not long enough nor short enough.","27-Feb-2020"
"https://www.nuuly.com/products/nellie-corduroy-culottes?color=027","RyanTheGirl","Just Right","I'm 5'1"" so I was nervous that these weren't going to be cropped on me but the length was perfect. I could've maybe fit into a size 26 but I'm glad I got the 27 because I was on vacay, so needed the tiny bit of extra room for drinking and meals if you know what I mean. And yes, I paired it with the same blazer the model is wearing and basically styled an identical outfit. Got lots of compliments! Highly recommend!","26-Feb-2020"
"https://www.nuuly.com/products/nellie-corduroy-culottes?color=027","Katert0t","Comfy, vintage look","Liked these! Comfortable, but I wish the waist were higher.","24-Feb-2020"
"https://www.nuuly.com/products/nellie-corduroy-culottes?color=027","darling","Monthly MVP","These pants are pretty much perfect. I ended up wearing them a TON and would have purchased if not for the price. Super comfortable, versatile rise, didn't slip down throughout the day, just enough stretch to fit. The golden orange color is vibrant but really easy to coordinate with. I also liked the medium-wide wale of the cords. The only thing that would have made them better is front/side pockets in addition to the back pockets. I'm renting these again.","EMPLOYEE REVIEW"
"https://www.nuuly.com/products/nellie-corduroy-culottes?color=027","Katie88","Cute Cords","I love these cords! High rise. Lots of compliments. Comfy. Mine were definitely washed a few times by previous wearer and it showed, but I still loved them! I needed a smaller size. I typically find that Paige runs small, but these cords were the opposite.","20-Feb-2020"
"https://www.nuuly.com/products/nellie-corduroy-culottes?color=027","SammiWein","Super Cute","These pants were perfect for a fall look. I paired it with a brown and red patterned turtle neck and it was the perfect thanksgiving look","19-Feb-2020"
"https://www.nuuly.com/products/nellie-corduroy-culottes?color=027","brandi","Cute and Comfy","I had a lot of compliments on these Culottes. They are a little snug but relaxed within wearing a couple hours.","19-Feb-2020"
"https://www.nuuly.com/products/nellie-corduroy-culottes?color=027","maurafortino","Cute, but long","These were cute but long on me - they didn't touch the floor, but they would have looked a lot better had I worn them with heels - which i don't really wear - or if I was just taller. They were fun to try and different from what I normally wear, but I didn't love them.","18-Feb-2020"
"https://www.nuuly.com/products/nellie-corduroy-culottes?color=027","tLove","Large around waist","I liked these but wanted to like them more. Just not as flattering as some other pants like this. I still wore them a few times. Comfortable and cute nonetheless.","15-Feb-2020"
"https://www.nuuly.com/products/nellie-corduroy-culottes?color=027","mepe","Perfectly cute","these fit great and received a ton of compliments when I wore them. The rise was just right and the wide leg was pretty darn cute. I wore the pants pretty casual each time - sneakers and a T-shirt. Would rent again.","7-Feb-2020"
"https://www.nuuly.com/products/nellie-corduroy-culottes?color=027","SydneyB","Amazing Pants!","I loved these pants and got lots of compliments when wearing them! They were the perfect color to wear with white, brown and black. The only issue I found was that they did stretch out easy after some wear. I have longer legs and they worked perfect with a high top boot like Dr. Martens.","5-Feb-2020"
"https://www.nuuly.com/products/nellie-corduroy-culottes?color=027","HeyJenny","Not for a petite girl!","These fit fine but just seemed too much for my 5'4"" frame. Maybe the color was just too much for me.","3-Feb-2020"
"https://www.nuuly.com/products/nellie-corduroy-culottes?color=027","maxwellsilver","Best Pants Ever","These were awesome. They were extremely comfortable. Such a fun color and texture to add to a look. Will most likely rent these again.","1-Feb-2020"
"https://www.nuuly.com/products/nellie-corduroy-culottes?color=027","cness","comfy corduroy","These were a little shorter than I would have liked but they have a lot of stretch and are super comfortable. I normally wear a 27 but I sized down and they fit perfect.","30-Jan-2020"
"https://www.nuuly.com/products/nellie-corduroy-culottes?color=027","gemlongo","So cute","Love these pants, really made me fall in love with corduroy. I'm only 5'3 so they cover my ankles and are wide leg. They are adorable!!","27-Jan-2020"
"https://www.nuuly.com/products/nellie-corduroy-culottes?color=027","Penuche","Fab Crop Cords","Great fit and super comfy!","27-Jan-2020"
"https://www.nuuly.com/products/nellie-corduroy-culottes?color=027","evilonion","Awesome Fit & Super Comfy","These pants are very comfortable and easy to style with a lot of different tops. I have gotten a compliment on these every time I've worn them! They are a little out of my price range to purchase but I would definitely consider them as an off-season bargain buy.","24-Jan-2020"
"https://www.nuuly.com/products/nellie-corduroy-culottes?color=027","RachelYW","Most surprising pants","This ended up being my favorite piece of the entire batch and my most worn. Very flattering. Because it's cropped and high waisted, it looked really good on my short 5'1 frame. 👍👍","24-Jan-2020"
"https://www.nuuly.com/products/nellie-corduroy-culottes?color=027","Sadgirl666","Perfect fit","I love these cords! Perfect fit at the waist and very flattering. I loved the mustard color, gives a 70s vibe that I love. Would consider purchasing!","18-Jan-2020"
"https://www.nuuly.com/products/nellie-corduroy-culottes?color=027","Sarami","Way too small.","These are not true to size. I consistently wear a 31 in all pants and jeans and I couldn't even get this up past my hips.","15-Jan-2020"
"https://www.nuuly.com/products/nellie-corduroy-culottes?color=027","en1989","Cute, snappy, sassy!","Great fit. Lots of compliments on the color.","15-Jan-2020"
"https://www.nuuly.com/products/nellie-corduroy-culottes?color=027","Floraandfauna","So so","The quality is very nice and the pants are quite warm. I ordered a size up and still the were tight around the waist and definitely not “full leg”. I still wore them, but they’re probably better suited for a taller person.","15-Jan-2020"
"https://www.nuuly.com/products/nellie-corduroy-culottes?color=027","JJJ","Great pants, I prefer the burnt orange color","I had rented these pants in orange in size 31 and they were great, though a little constricting at the waist. So I tried them again in a 32 in the pink color. They are less constricting in the larger size, but I think they looked better in the smaller size, which is really my true size (but corduroys can be funny in terms of sizing), and I thought they looked better in the burnt orange color. But all in all they are cute, on-trend pants.","13-Jan-2020"
"https://www.nuuly.com/products/nellie-corduroy-culottes?color=027","MB","Great Pants","I loved these pants so much. Very comfortable and flattering. I would have purchased them but they were too much for used clothing.","10-Jan-2020"
"https://www.nuuly.com/products/nellie-corduroy-culottes?color=027","LKG123","cute","These were so cute! Stretched a bit throughout the day.","9-Jan-2020"
"https://www.nuuly.com/products/nellie-corduroy-culottes?color=027","juliagulia","Very comfortable and flattering","I loved these pants. They did seem to stretch out a bit through the day, but not bad. I would size down. I wish they were in a navy blue or darker color.,... i'm not big on pink but I loved wearing these.","9-Jan-2020"
"https://www.nuuly.com/products/nellie-corduroy-culottes?color=027","sriog","love these","im considering keeping these. i love the color, they look great w/ so many different style tops. i was worried they'd be too small but they offer a little stretch which is nice.","8-Jan-2020"
