"links_link","links_reviews_name","links_reviews_title","links_reviews_text","links_reviews_date"
"https://www.nuuly.com/products/significant-other-sweater?color=004","HGOODY","Perfect oversized sweater!!","LOVED this sweater!! Thought about keeping after my month. So cozy and oversized, loved the pocket and hood. Got lots of compliments! Great length over leggings. Only complaint is the bottom hem rides up a little at times so kept having to pull it back down.","21-Apr-2020"
"https://www.nuuly.com/products/significant-other-sweater?color=004","SJMAZ","Big and Cozy!","Great oversized look. You’ll want to wear it everyday.","1-Apr-2020"
"https://www.nuuly.com/products/significant-other-sweater?color=004","smith468","Perfect","This sweatshirt is soo comfy. It’s meant to be a bit oversized so just be aware of that when choosing a size. I got the xs and it still fits slightly oversized. I love it!","21-Mar-2020"
"https://www.nuuly.com/products/significant-other-sweater?color=004","Nsenfrida","Okay","It’s very long!","12-Mar-2020"
"https://www.nuuly.com/products/significant-other-sweater?color=004","bjcarlson2003","Awesome sweater!","Really fun sweater, runs very large! Versatile! Highly recommended!","27-Feb-2020"
"https://www.nuuly.com/products/significant-other-sweater?color=004","MorganR","Super comfy","This is definitely an oversized sweater but it’s super comfortable! Definitely a cute loungey look","25-Feb-2020"
"https://www.nuuly.com/products/significant-other-sweater?color=004","LizzieA","slouchy and long","i only wore this once bc it fit super loose but the band at the bottom was really tight and made it look like i had a muffin top. i should’ve gone down a size but it was still really long. just not ideal for my figure but great quality and super soft!","14-Feb-2020"
"https://www.nuuly.com/products/significant-other-sweater?color=004","BrittanyHaywood","Loved it- different color","The one I received has different colors- all over grey with tan band. I was bummed at first, but then I ended up loving it. I got so many compliments. I wore it everywhere.","12-Feb-2020"
"https://www.nuuly.com/products/significant-other-sweater?color=004","MoPeot","Cozy and Warm","I've worn this sweater 4 times now. I love how it's super comfy and cozy. Could be too warm for places that aren't that cold. Cute with leggings or jeans. I ordered a small and for someone smaller than 5'7/128 you might be swimming in it. It's def oversized which is the pt but it's quite oversized.","11-Feb-2020"
"https://www.nuuly.com/products/significant-other-sweater?color=004","Jenniferbryan","HUGE!!!","I never wore this item. I tried it on and there was no way to make it look good. If your tall maybe but short you look like your wearing a potato sack.","11-Feb-2020"
"https://www.nuuly.com/products/significant-other-sweater?color=004","mariaho19","Not as pictured","I'm not certain I received the item in the picture. It looked entirely different. The colors were not as pictured (white was more of a dark cream and cuffs were tan?) and the material was so itchy I barely wore it. It was also SUPER oversized (which I expected/wanted) but I would still suggest sizing down.","10-Feb-2020"
"https://www.nuuly.com/products/significant-other-sweater?color=004","Girlwithadog","Fun and comfy","Easy to wear. Comfortable and not itchy","10-Feb-2020"
"https://www.nuuly.com/products/significant-other-sweater?color=004","50nFab","Great sweatshirt!","This runs big but loved it with joggers.","7-Feb-2020"
"https://www.nuuly.com/products/significant-other-sweater?color=004","KayleeMay","Sweater Obsessed!","THIS WAS MY FAVORITE! It was soooo soft and comfortable! I loved the color combo and it was the perfect winter lounging sweater.","4-Feb-2020"
"https://www.nuuly.com/products/significant-other-sweater?color=004","lexifal","Big and Cozy","It is oversized but I like sweatshirts to be big! Super comfortable material. I did not receive the item shown though—mine had tan where this has dark grey on the bottom of the sleeves and sweatshirt","15-Jan-2020"
"https://www.nuuly.com/products/significant-other-sweater?color=004","shlee_m","Very cozy!","I liked this sweater a lot (although the one I received had a tan/beige color block on the bottom, rather than the gray shown in the photos.) It was extremely cozy and comfy and perfect to wear around the house while lounging over the holidays, or even out to bars with jeans and booties for a comfy, casual look.","14-Jan-2020"
"https://www.nuuly.com/products/significant-other-sweater?color=004","Apem","Very comfortable & cozy!","It’s oversized, but it still feels huge. Very cozy!!","22-Dec-2019"
"https://www.nuuly.com/products/significant-other-sweater?color=004","RachDip","Oversized But Cozy","Probably not the most flattering sweater but perfect for leggings and lounging around on a weekend.","22-Dec-2019"
"https://www.nuuly.com/products/elin-high-rise-crop-jean?color=012","mssfromnd","Comfortable and cute","I really liked these. They were comfortable and true to size. They did stretch out a little but not so much that I couldn’t wear them.","17-May-2020"
"https://www.nuuly.com/products/elin-high-rise-crop-jean?color=012","Charis","Stretchy and comfortable","Too large in the waist and they didn't stay up. Fit elsewhere, but too soft and stretchy to stay in place. Didn't want to belt. Length was barely cropped for me at 5'2"".","29-Apr-2020"
"https://www.nuuly.com/products/elin-high-rise-crop-jean?color=012","CindyK","Beautiful- love them","I loved the cut and fit.","13-Apr-2020"
"https://www.nuuly.com/products/elin-high-rise-crop-jean?color=012","Court","Didn’t flatter for me","I think if I sized down would have been too tight elsewhere","12-Apr-2020"
"https://www.nuuly.com/products/elin-high-rise-crop-jean?color=012","mkuiper","too big","Didnt get to wear but also too big","20-Mar-2020"
"https://www.nuuly.com/products/elin-high-rise-crop-jean?color=012","TheCreativeSoul","Liked the color and rise of fit.","Fit a little on the larger size. The rise was nice and material was a nice jean material.","18-Mar-2020"
"https://www.nuuly.com/products/elin-high-rise-crop-jean?color=012","katx777","Love these","Great material, super soft & just enough stretch. Wore these to work with a wedge heel & tan leather belt. They are cream in color like vanilla ice cream. I’d rent these again or consider buying.","11-Mar-2020"
"https://www.nuuly.com/products/elin-high-rise-crop-jean?color=012","Sadie","Size up for looser fit","Love this pair! They're so comfortable and have a good amount of stretch. If you want a super skinny fit, size down. For a more straight-leg fit, size up. For the shorter ladies, the pair will not be cropped!","5-Mar-2020"
"https://www.nuuly.com/products/bardot-sweater?color=018","Ajs92","Cute WFH top","Cute, comfy and just like the photos. I’d order this again, the fabric is thicker so it was too hot here to wear more than once this month though.","16-May-2020"
"https://www.nuuly.com/products/bardot-sweater?color=018","Lacasta","maternity approved","i love anything crop, including this sweater. will try in all colors. it’s short in the front and i’m about 23 weeks, any further along and i would have had to size up. i choose a small but would have choose the XS pregnancy, even the XS will be big.","15-May-2020"
"https://www.nuuly.com/products/bardot-sweater?color=018","Rcsoup13","Cropped!","This is very cute and oversized. Just be aware it is super cropped! Which I didn’t know renting it","7-May-2020"
"https://www.nuuly.com/products/bardot-sweater?color=018","Tauberl","Cute and comfy","I reached for this a lot this past month. It's easy to throw on over leggings and would have been cute with jeans or a maybe even a dress too if I was wearing those things these days. It's very cropped and easy to move around in.","7-May-2020"
"https://www.nuuly.com/products/bardot-sweater?color=018","ItsNotThatDeep","Liked the cut","I loved the cut but the color I wasn’t too jazzed about and I didn’t find myself reaching for this sweater as often as I thought I might. Would def rent again in the stripes.","4-May-2020"
"https://www.nuuly.com/products/bardot-sweater?color=018","paigeann","Great spring sweater","I liked the color and cropped version of this sweater that was perfect for spring.","4-May-2020"
"https://www.nuuly.com/products/bardot-sweater?color=018","Peachy-pink","Long live the Bardot sweater","This is the second time I've gotten a Bardot sweater in my nuuly box. I love them. I want them in every color. It's ""just a sweater"" but I promise it's incredible. It's perfect for layering, it's also perfect to wear on its own. It's soft, it's slouchy, it stretches, the neckline is flattering, it's cute enough that you don't look like you're just wearing sweats, it does it all.","4-May-2020"
"https://www.nuuly.com/products/bardot-sweater?color=018","WestTownChiGirl","Love the oversized look - feels like a towel","Why do so many of these free people sweater feels like beach towels? I can't decide if i love it or just tolerate it. Anyway the big sleeves and cropped length are FAB and the boat neck top makes the sweater almost chic. Love! Might consider trying more of this style in diff colors for diff seasons","4-May-2020"
"https://www.nuuly.com/products/bardot-sweater?color=018","AlwaysLossst","Not a bad piece","Somehow I thought it would be softer. And it was shorter and wider than I had hoped. Maybe if I weren’t in quarantine I would’ve worn it out, but it wasn’t my favorite.","4-May-2020"
"https://www.nuuly.com/products/bardot-sweater?color=018","TryingIt","Perfect sweater","Selected this for a comfortable sweater that I could wear over and over considering no one was going to see it during quarantine. I loved it! Only thing was that it came in the opposite colors as the picture. The mint green was the smaller lines and the darker green was the majority of the sweater which was fine, just not what I was expecting","1-May-2020"
"https://www.nuuly.com/products/bardot-sweater?color=018","SNB","Slouchy sweater","This sweater is a good slouchy fit, but also a little boxy at the bottom. The material was a little thicker than I expected and had a gritty feel to it. Still enjoyed it enough to wear it a few times, just not a comfy/cozy feel.","29-Apr-2020"
"https://www.nuuly.com/products/bardot-sweater?color=018","noellestearns","comfy & oversized: my two fav things!","Super comfy and very cute! Wore this sweater almost everyday!","26-Apr-2020"
"https://www.nuuly.com/products/bardot-sweater?color=018","AubreyAnne","Perfect spring sweater","Perfect for cooler temps","26-Apr-2020"
"https://www.nuuly.com/products/bardot-sweater?color=018","Kristinwaslike","I liked this in another color but...","But the one I got in this particular color was older I could tell and it fit boxier? Not sure why. I loved this in the yellow-orange color.","26-Apr-2020"
"https://www.nuuly.com/products/bardot-sweater?color=018","bekkibuen","Great sweater","Loved the color and style. Fabric was a tad itchy but otherwise a really versatile sweater","25-Apr-2020"
"https://www.nuuly.com/products/bardot-sweater?color=018","Sskog","Comfy staple piece","Such a great sweater. Looks just like the picture. Easy staple to just throw on with jeans or yogas. Super comfortable too!","24-Apr-2020"
"https://www.nuuly.com/products/bardot-sweater?color=018","Jenx","Beautiful sweater!","I loved everything about this sweater! The fit, texture, and color were perfect!","22-Apr-2020"
"https://www.nuuly.com/products/bardot-sweater?color=018","sav94","I wanted to love this","I love yellow lately and I wanted to love this sweatshirt so bad. It’s oversized width wise but not in length. The material is literally like wearing a towel so if you’re looking for something soft and comfy this is not it. I wore it a few times and just never really liked it","20-Apr-2020"
"https://www.nuuly.com/products/bardot-sweater?color=018","Ajs92","Cute!","Another good work from home shirt when you have video conferences. Would order again, looks exactly as pictured!","20-Apr-2020"
"https://www.nuuly.com/products/bardot-sweater?color=018","TaraBean","Cute and roomy","This fits incredibly loosely, but is cute and comfy. The fabric is a little rough, but it’s not scratchy. This shirt definitely has some substance to it as well - it’s heavier than I was expecting. Overall, I really liked it and wore it several times.","20-Apr-2020"
"https://www.nuuly.com/products/bardot-sweater?color=018","Erin312","Good one","I like this one! It has a terry cloth feel, that still felt comfortable to me. The fit makes you feel like you're being kind of stylish while also totally comfortable which I love. I didn't feel like the over-sized sleeves were in the way, which sometimes can happen with bell/puffy sleeves. i would consider purchasing this item.","17-Apr-2020"
"https://www.nuuly.com/products/bardot-sweater?color=018","perrywinkle","good hangout top","this was a pretty cute and easy piece, less cozy than expected. the material is basically like an old towel (i say that with love). it was more cropped than i usually prefer but roomy enough that it still looked good. love stripes!","15-Apr-2020"
"https://www.nuuly.com/products/bardot-sweater?color=018","Rave","Short torso Odd fit","I saw so many cute images of people in this but it just didn’t work for this petite girl with a short torso.","15-Apr-2020"
"https://www.nuuly.com/products/bardot-sweater?color=018","stacysumo","Cute and comfy, easy to match","I loved this sweater! It's so cute and matches everything. Would rent again in the future!","13-Apr-2020"
"https://www.nuuly.com/products/bardot-sweater?color=018","AmandaG","Love","Super cute and chic. It's boxy but cropped so really flattering.","12-Apr-2020"
"https://www.nuuly.com/products/bardot-sweater?color=018","Tayhetz","Cozy","Loved the fit - size down if you are typically in-between sizes in FP - and color. Wore multiple times.","10-Apr-2020"
"https://www.nuuly.com/products/bardot-sweater?color=018","Tayhetz","Comfy Crop","I've rented a couple different colors in the Bardot sweater. Super comfortable and cute with the slight crop. Size down if you are typically in-between sizes with FP.","10-Apr-2020"
"https://www.nuuly.com/products/bardot-sweater?color=018","Forever21","Couldn’t take it off!","Comfy, light, bright and happy! Worn it a lot around the house and outside - a perfect “home” spring sweater","10-Apr-2020"
"https://www.nuuly.com/products/bardot-sweater?color=018","HiMyNameIsAce","Glad I got the extra small","great sweater to throw on during quarantine(what a weird statement). Comfy and oversized.","9-Apr-2020"
"https://www.nuuly.com/products/bardot-sweater?color=018","mf12","Very orange, runs large","I would have preferred an XS despite more commonly wearing a small in tops. Didn't love the material and I expected the color to lean more yellow - but it is VERY orange","9-Apr-2020"
"https://www.nuuly.com/products/bardot-sweater?color=018","Rkchey","Colors off","It was more of a pukey Green color than the mint I envisioned based on the picture. The sweater fit and I can see it looking very cute in other color palettes. Just not the color for me","4-Apr-2020"
"https://www.nuuly.com/products/bardot-sweater?color=018","PilarAlfaro","Rough Material","I was most excited about receiving this sweater. I was disappointed with the material. Not super soft, kind of itchy. Usually a raglan sleeve is flattering, but this seemed a bit too oversized causing a ""off"" look that left me messing with it all day. I only wore it once.","3-Apr-2020"
"https://www.nuuly.com/products/bardot-sweater?color=018","aBf","Lived in this","This was my best friend while being forced to be inside all the time. Cute, comfy and the blue color was vibrant and cheery.","3-Apr-2020"
"https://www.nuuly.com/products/bardot-sweater?color=018","Samina","My favorite of the month","Very comfy, cozy, and warm for everyday wear. The Colors are adorable. Very easy to match and style.","2-Apr-2020"
"https://www.nuuly.com/products/bardot-sweater?color=018","sepackett","Loved!","I couldn’t wear this sweater enough! Perfect loose fit!","1-Apr-2020"
"https://www.nuuly.com/products/bardot-sweater?color=018","VeryVA","Love the colors and concept","I have a smaller frame so a boxy fit is a challenge for me. It was cute with jeans but fell off my shoulders. If you are broad shouldered, this is a perfect sweater","1-Apr-2020"
"https://www.nuuly.com/products/bardot-sweater?color=018","chigdon","Love this sweater","This is the second color I've rented in this sweater and I love this relaxed but put-together look. So comfy and really cute dressed up or down.","31-Mar-2020"
"https://www.nuuly.com/products/bardot-sweater?color=018","Abigail","Cozy and not bright white","Ordered this sweatshirt as part of my Coronavirus stay at home Nuuly, and it has not disappointed. Been pairing it with high-waisted leggings. Extremely cozy--I sized up because I'm between small and medium. The base color is not bright white like it appeared to me in pictures, rather it's off white (could've been discolored from time and wear, hard to tell). Ever so slightly itchy terry-type material but because it fits so loosely, that hasn't been an issue for me.","27-Mar-2020"
"https://www.nuuly.com/products/bardot-sweater?color=018","LissBliss","Loved it so much, I purchased it!","Looks so cute with black high waisted jeans and the material was cozy and would be great for a cool summer night as well as winter layering. Slouchy yet really flattering.","26-Mar-2020"
"https://www.nuuly.com/products/bardot-sweater?color=018","Annuhhbee","Itchy","The fabric is like a crunchy old washcloth","26-Mar-2020"
"https://www.nuuly.com/products/bardot-sweater?color=018","mkb92","A little too sloppy","I know it's meant to be slouchy and casual, but on me it just looked a little sloppy. The sleeves and the length were the right size for me, so it wasn't like it was too big. The neck seemed way too wide for how boxy it was, so I gave up. Interesting terrycloth like fabric that felt nice though. Wish it would have worked!","26-Mar-2020"
"https://www.nuuly.com/products/bardot-sweater?color=018","jhamburger","Bardot Sweater","If you threw me this at the beach, I would just think it’s a towel and say thank you.","25-Mar-2020"
"https://www.nuuly.com/products/bardot-sweater?color=018","HGOODY","Comfy casual","Comfy and easy sweater!","25-Mar-2020"
"https://www.nuuly.com/products/bardot-sweater?color=018","MDB","Fit is good, large boatneck though","Oversized but not too much. Large boat neck. Material was not as soft as it appears but not scratchy. Good weight to this piece.","25-Mar-2020"
"https://www.nuuly.com/products/bardot-sweater?color=018","andrea1127","Fun dressed up or down","Loved this super versatile piece! It is a crop though just so everyone's clear on that. Cute with high waisted anything - skirt, jeans, pants. Got a lot of mileage out of this and can't wait to try the other colors!","25-Mar-2020"
"https://www.nuuly.com/products/bardot-sweater?color=018","TAP","LOVE THIS SWEATER","oversized sweater. Can wear alone, or with a top underneath. Keep renting in different colors!","25-Mar-2020"
"https://www.nuuly.com/products/bardot-sweater?color=018","JH2424","Cute but not soft","It’s a cute sweater. Runs a little big as with most free people. I was surprised by how NOT soft this sweater was. Because the rest of the sweater is nothing special, being unsoft was really the final nail in the coffin","24-Mar-2020"
"https://www.nuuly.com/products/bardot-sweater?color=018","Mamaof3","Casual and comfy","The fit was perfect. Went great with jeans. Perfect to throw on at the beach once it gets cool in the evening.","23-Mar-2020"
"https://www.nuuly.com/products/bardot-sweater?color=018","ItsNotThatDeep","Cute and comfortable for Spring","Love this sweater and debating keeping it. The knit feels like terry cloth but softer, thought it would be too cropped for my height but fits nicely and is flattering with lots of different pants. Styled with skinny jeans some days and high waisted distressed loose fitting crop jeans and boots. LOVE!","22-Mar-2020"
"https://www.nuuly.com/products/bardot-sweater?color=018","serendipitirach","Love","Oversized and adorable. A winner!","22-Mar-2020"
"https://www.nuuly.com/products/bardot-sweater?color=018","izzys","Comfy and nice color","I should've gotten a small because it was oversized to begin with. It's really comfy & cozy- I wore to work with jeans & docs and then also wore it at home with sweat pants. If you're on the fence, throw it in your cart because you'll end up wearing it more than you think.","22-Mar-2020"
"https://www.nuuly.com/products/bardot-sweater?color=018","PhojoAmy","Different color","the one I received was large olive stripes with skinny blue stripes, still cut. My sleeves were not nearly as long as the photo. Will try again next month. Soft fabric with cute oversized fit.","21-Mar-2020"
"https://www.nuuly.com/products/bardot-sweater?color=018","jesseabee","Easy to wear","Easy to wear. Wore this a few times to work.","20-Mar-2020"
"https://www.nuuly.com/products/bardot-sweater?color=018","frenchfrys","An Oversized Crop","I went with a medium (usually a small or medium in sweaters) and I am glad I did. Gave a great oversized look. Beware though, this is a crop sweater but worked just fine for me with high-waisted jeans or leggings. The material is kind of like a terry cloth...thinner and on the itchier side. BUT, definitely worth renting, was comfortable none the less.","17-Mar-2020"
"https://www.nuuly.com/products/bardot-sweater?color=018","eknorman","Such a great sweater","This sweater is very comfortable and can be dressed up or down. It shows a lot of shoulders so it's really cute to wear out with jeans and boots.","17-Mar-2020"
"https://www.nuuly.com/products/bardot-sweater?color=018","sweaterlover23","cute lounge wear that you can wear out","this sweater! Got a ton of compliments on the bright color and it was so so comfortable. Loved it so much, I bought it!","16-Mar-2020"
"https://www.nuuly.com/products/bardot-sweater?color=018","Erock","Purchased","Beautifully made and very flattering. Didn’t think twice about purchasing and so happy I did.","15-Mar-2020"
"https://www.nuuly.com/products/bardot-sweater?color=018","lfdoherty","cute and casual","Ended up wearing this a lot for work, it's easy to throw on. the neck is a little wide but overall really cute!","12-Mar-2020"
"https://www.nuuly.com/products/bardot-sweater?color=018","JordanG","Never want to take it off","This is my new favorite sweater. Typical free people fit. Oversized and such a flattering fit.","12-Mar-2020"
"https://www.nuuly.com/products/bardot-sweater?color=018","cynthjmason","Obsessed!","This is so comfy and the color is gorgeous! I wore it with leggings, jeans, and cords. It can be dressed up or down and screams fun! I liked it so much that I am getting it in the black and white striped version to try for a month. :)","11-Mar-2020"
"https://www.nuuly.com/products/bardot-sweater?color=018","MarieCampbell","Cute and versatile","I wore this sweater a ton while I had it. It was fun to wear with jean shorts at the beach or pair with tennies and leggings. It's true to its boxy style.","11-Mar-2020"
"https://www.nuuly.com/products/bardot-sweater?color=018","Jac","I could have lived in this","This is a casual light weight sweater that I threw on over a turtleneck or tank. It's cropped so I wanted something covering my middle in the cold. It was warn enough for indoors. The cut is very relaxed, I loved it and had to make an effort to reach for something else for variety.","11-Mar-2020"
"https://www.nuuly.com/products/bardot-sweater?color=018","stacysumo","Cute fit, but color was too bright for my taste","I loved the casual fit. The baggy style makes this a comfy look for any outing. The color was a bit brighter/more orange than in the picture, which I didn't like.","11-Mar-2020"
"https://www.nuuly.com/products/bardot-sweater?color=018","bribri","Perfect spring sweater","Loved this! The texture feels kind of like a towel, but is still pretty comfortable! Great for spring temperatures.","10-Mar-2020"
"https://www.nuuly.com/products/bardot-sweater?color=018","christine101","Loved it","Loved it so much, plan to try in a different color for variety","10-Mar-2020"
"https://www.nuuly.com/products/bardot-sweater?color=018","K-Po","Perfect crop","Seriously, pretty prefect all around.","10-Mar-2020"
"https://www.nuuly.com/products/bardot-sweater?color=018","Rosie","Comfortable and Cute","I loved this striped sweater. The only annoying part was getting the sleeves into a winter coat. Would definitely rent again.","9-Mar-2020"
"https://www.nuuly.com/products/bardot-sweater?color=018","BeachMama","Comfy sweater","Not the most special, but a nice, lightweight sweater with comfy, slouchy fit. Very oversized. I’d normally wear a medium, but the small was plenty oversized on me.","7-Mar-2020"
"https://www.nuuly.com/products/bardot-sweater?color=018","Foxheart","Stripes in a trendy cut","Nice sweater for transition out of winter. Classic with stripes but updated to work with high-waisted jeans. Was fun and easy to wear.","7-Mar-2020"
"https://www.nuuly.com/products/bardot-sweater?color=018","Gingerkat","Amazing color!","Beautiful yellow and comfy fit.","7-Mar-2020"
"https://www.nuuly.com/products/bardot-sweater?color=018","hca2020","I wound up buying this!","super fun and cute. Not too cropped like many other items these days.","6-Mar-2020"
"https://www.nuuly.com/products/bardot-sweater?color=018","biiiiiigstripedsweatergirl","loved the sweater","wore it downtown hanging out with friends-- super cute crop, perfect sleeve length","6-Mar-2020"
