"links_link","links_reviews_name","links_reviews_title","links_reviews_text","links_reviews_date"
"https://www.nuuly.com/products/snowbunny-long-sleeve?color=080","Calliemk","Boring and odd fit","I think this would be better on someone with a smaller chest. I also expected it to be tighter on the torso but it was just a frumpy fit.","19-Dec-2019"
"https://www.nuuly.com/products/snowbunny-long-sleeve?color=080","lgurley","Cute Sweater","The orange is much brighter in person. Felt like more of a Halloween orange than a fall orange.","18-Dec-2019"
"https://www.nuuly.com/products/snowbunny-long-sleeve?color=080","Marihf1107","Good concept","It’s a very cute shirt on the model, but on my 5’2” self it was just a bunch of drapping fabric. Massively unflattering and just overall unwearable. Love the material and color though, major bummer.","18-Dec-2019"
"https://www.nuuly.com/products/snowbunny-long-sleeve?color=080","jobelled","Bright and thin","If you want to stand out then this is the top for you. The material is pretty thin and it clings to your the mid section.","15-Dec-2019"
"https://www.nuuly.com/products/snowbunny-long-sleeve?color=080","madisons","Weird Color","Color is so much brighter than in the picture. It looks like a highlighter. I wasn't a huge fan.","10-Dec-2019"
"https://www.nuuly.com/products/snowbunny-long-sleeve?color=080","Elishevad2489","super cute and soft","Very cute shirt and super soft. Slightly transparent (don't wear with a black bra).","8-Dec-2019"
"https://www.nuuly.com/products/snowbunny-long-sleeve?color=080","Pariel1021","Cozy and Sexy","I loved this sweater. I got so many compliments. It's really soft and comfortable. Also, a cute way to wear a comfy sweater on a date!","2-Dec-2019"
"https://www.nuuly.com/products/snowbunny-long-sleeve?color=080","Lily610","Meh","Way too much fabric on top where it folds over! I couldn’t get it to lay properly because of that, and due to the fact that it stretched so easily. There was potential but possibly would’ve fit better if I sized down","23-Nov-2019"
"https://www.nuuly.com/products/twyla-print-top?color=055","AmandaPattison","Romantic, Unique Top","I originally ordered this top in my very first Nuuly, in my normal size Small. It was uncomfortably tight under the arms and a bit short due to it being cropped--even with high waisted jeans I felt like I was pulling it down constantly. I decided to give it another shot in the next size up and I am so glad I did! It fits perfectly, and offers a touch more movement. Due to the fact that it's somewhat see-through, I don't mind it being a tad less form-fitting. This is not SO sheer that you need to wear anything underneath--I opted for a nude tone bra. I love the cut/fabric and print/color. As a pale redhead with green eyes, this is extremely flattering. I have a small bust (32B) but the cut of this helped to balance my fuller hips. Sexy but classy, and can be dressed more formal. I'm obsessed. I feel like a Pre-Raphaelite painting whenever I wear it!","6-May-2020"
"https://www.nuuly.com/products/twyla-print-top?color=055","ehf109","Nice color and material","Liked this shirt, but couldn't wear it out because of social distancing. I tried it on and it fit, would ride up though, based on me just trying it on. Very see through but really cute.","1-Apr-2020"
"https://www.nuuly.com/products/twyla-print-top?color=055","1979queenbee","Looks best backwards!!!","This top is amazing! I’m thinking I NEED IT! I have it for another week and I don’t think I can part with it, it’s one of my favorite pieces!","29-Mar-2020"
"https://www.nuuly.com/products/twyla-print-top?color=055","Julespalms23","Pretty...but","This was a crop top on me, so I didn’t end up wearing it. It is a beautiful top though.","25-Mar-2020"
"https://www.nuuly.com/products/twyla-print-top?color=055","Winnie2296","Beautiful colors, somehow not see through","Didn’t get to wear but beautiful spring print, bottom of shirt hits right at high waisted jeans on me","12-Mar-2020"
"https://www.nuuly.com/products/twyla-print-top?color=055","baileyyoung516","Fun!","Obviously, it's sheer so you need to wear something under it. It was a bit shorter than I expected, but I wore with high-waisted jeans for a night out and it looked really cute. Could have possibly sized up, but it still fit and looked great.","6-Mar-2020"
"https://www.nuuly.com/products/twyla-print-top?color=055","sammipaul","SO CUTE!!!","I looooooved the Twyla Print Top! It's super romantic, flattering, and unique. I styled it with denim shorts and a bralette, but this could be dressed up for a dinner date. Super dreamy, I would def. borrow again!","4-Mar-2020"
"https://www.nuuly.com/products/twyla-print-top?color=055","Cariss","Great top","I really liked this top. It was great for going out in cold weather. I wore it with high waisted black jeans and got lots of compliments.","3-Mar-2020"
"https://www.nuuly.com/products/twyla-print-top?color=055","K_Spiegs","Unique fit","The fit of this shirt is strange. Its cropped but extra billowy on top making it awkward to style.","28-Feb-2020"
"https://www.nuuly.com/products/twyla-print-top?color=055","Ebrooklynn","Super cute top!","This top was a very cute sheer piece that transitioned well from work to nightlife. Definitely fits more cropped than on the model, but very cute.","28-Feb-2020"
"https://www.nuuly.com/products/twyla-print-top?color=055","sheartay","LOVE THIS TOP","I am obsessed with this top, I almost bought it in the lavender color! I have ordered both colors because it fits so well, is extremely flattering and I received so many compliments each time I wore it in each color.","25-Feb-2020"
"https://www.nuuly.com/products/twyla-print-top?color=055","jammy33","Shorter than expected","I wore this top for a day date to the museum- super cute with great colors. The fabric is light but not too sheer. Way shorter than expected, even with my highest waisted jeans. I had to keep adjusting it and pulling it down to tuck into my pants- not the most comfy shirt to run around in all day.","25-Feb-2020"
"https://www.nuuly.com/products/twyla-print-top?color=055","GraceM","LOVE!! Can't wait to wear in the summer","Bought this one :) It is really beautiful and even though it is sheer, I think you can get away with wearing a nude bra and nothing else under it. I am looking forward to wearing it in the summer with some high waisted jeans. It is definitely cropped","22-Feb-2020"
"https://www.nuuly.com/products/twyla-print-top?color=055","MariaM","Super cute","Runs a little small in the arms and length but great with high waisted jeans. Definitely not as see through as it looks. I wore a nude colored bralette and it worked perfect under it.","19-Feb-2020"
"https://www.nuuly.com/products/twyla-print-top?color=055","bunbun","The cut was a little odd but cute print!","Great top for work. It's sheer so wear a cami underneath. The cut was a little odd but I liked how bouncy it looked.","13-Feb-2020"
"https://www.nuuly.com/products/twyla-print-top?color=055","gracej","Pretty blouse","Super pretty top! Not as see through as I expected. I planned on wearing this more but didn't feel comfortable wearing to work since it was a little low cut, but the sheerness was not a problem.","5-Feb-2020"
"https://www.nuuly.com/products/twyla-print-top?color=055","Gingerstellar","Beautiful feminine top","I got so many compliments. I loved this fit. It’s feminine and can be dressed up but also can be worn with jeans!","4-Feb-2020"
"https://www.nuuly.com/products/twyla-print-top?color=055","Ernprise","Short","Love the look but too short!","3-Feb-2020"
"https://www.nuuly.com/products/twyla-print-top?color=055","bayrobs","So many compliments!","I loved this top! It's easy to dress up or down depending on the occasion, it's comfortable, and very flattering. Despite how sheer it appears, I was able to wear it to work without issue. I don't usually wear a lot of color and this inspired me to try branching out more often in the future. The cherry on top was that I received compliments from just about every demographic - 10/10","31-Jan-2020"
"https://www.nuuly.com/products/twyla-print-top?color=055","Alundy","Loved it","Super flattering and comfortable.","30-Jan-2020"
"https://www.nuuly.com/products/twyla-print-top?color=055","hbarnes24","Fun, flattering top","I loved this top but it felt very narrow on the shoulders. I usually wear a size small or medium and I ordered this top in medium. I would size up.","24-Jan-2020"
"https://www.nuuly.com/products/twyla-print-top?color=055","Allisonm71","Translucent and itchy","The design was cute and but the material is cheap and itchy. Also, just A very busy Look. You have to wear a brakette with it because its translucent so you could easily see a regular bra which isnt flattering. I just didnt like it.","23-Jan-2020"
"https://www.nuuly.com/products/twyla-print-top?color=055","jules5","PERFECT TOP","This top was PERFECT! So cute and comfortable. If you're between sizes, size up!","22-Jan-2020"
"https://www.nuuly.com/products/twyla-print-top?color=055","kasputia","cute!","size up as it is short! very soft material + beautiful color","13-Jan-2020"
"https://www.nuuly.com/products/twyla-print-top?color=055","Mandarvelous","Cute but snug","The shirt is beautiful - soft, well made. But it’s a little snug around the shoulders and arms. I was worried I’d rip it. I recommend sizing up!","13-Jan-2020"
"https://www.nuuly.com/products/twyla-print-top?color=055","aluxehouse","Romantic","I love this top! I paired it with high waisted vintage levis and some gold Gucci platforms for a perfect date-night outfit!","8-Jan-2020"
"https://www.nuuly.com/products/twyla-print-top?color=055","KaseyJ","Its better backwards","Ok, so hear me out. The top is better backwards. I didn't like the open front look on my body so I flipped it around and created a high neck look. Its not see through as long as you wear a nude bra. I wore it to all my Christmas parties and got tons of compliments.","8-Jan-2020"
"https://www.nuuly.com/products/twyla-print-top?color=055","clairison","More Green than Teal","Loved the fancy look of the material while not feeling too overdressed. I wore this over the holidays. It was not the best winter top (not warm) but I make it work.","6-Jan-2020"
"https://www.nuuly.com/products/twyla-print-top?color=055","sgilly","OBSESSED with this top!","This top is so flirty and cute! I loved wearing it out! I thought it would be more sheer, but you don't need a cami underneath.","3-Jan-2020"
"https://www.nuuly.com/products/twyla-print-top?color=055","AllisonG","Fun for many occasions","Loved it!! Wore it Christmas Day with some high waisted black Levi’s! It can be dressed up or down.","1-Jan-2020"
"https://www.nuuly.com/products/twyla-print-top?color=055","SRain23","Cute but need to size up","Never ended up wearing this. I got it to wear as a worm blouse but it is much too cropped for that. I couldn’t find anything to pair it with that didn’t show my stomach. Cute top but def need to size up.","18-Dec-2019"
"https://www.nuuly.com/products/twyla-print-top?color=055","gillybee","sleeves bothered me","I loved everything about this too except the shoulder dressing at the top. Too frilly and didn't lay flat","10-Dec-2019"
"https://www.nuuly.com/products/twyla-print-top?color=055","Liv","Great Going Out Top","Love this cute top - very flattering and not too sheer, so I didn't need to wear a bra with it. Great for going out to a bar/club or nice restaurant. Will be wearing it a lot in the future!","9-Dec-2019"
"https://www.nuuly.com/products/twyla-print-top?color=055","Abracadabra","Lovely flowy fabric but little too small","This shirt has potential! It's so cute... wish I could have worn it with my high-waisted jeans :(. Ordered a small (5'5"" 125 lbs). I'm not a long-torsoed tall gal but this crop top was shorter than I'd like / pulled up easily and shoulders were tight.","6-Dec-2019"
"https://www.nuuly.com/products/twyla-print-top?color=055","Katy","Cute","Cute, good going out top. It is sheer but not as sheer on as I had first thought. Good with a bralette","6-Dec-2019"
"https://www.nuuly.com/products/twyla-print-top?color=055","Jenatracey","Didn’t fit right","This did not work for me, to short, rode up when you put it on.","EMPLOYEE REVIEW"
"https://www.nuuly.com/products/twyla-print-top?color=055","GGHIRT","Love this top!","Love this top.. fits well. It’s a little see through in the light so be prepared to wear a bralette/cammy under.","1-Dec-2019"
"https://www.nuuly.com/products/twyla-print-top?color=055","LaurenD","Definitely size up, this runs sooo small!","I shop this brand often, so I expected the sizing to be true to size. This did not fit how it appears in the photos - it didn't even cover my belly button, and the neckline was extremely deep at that! It was all around just teeny tiny - shoulders were tight, sleeves didn't come to my wrists.. I was pretty bummed. Even sizing up to a large I would still worry this was an extreme crop top! I do have a more athletic, straight build, so maybe that's why... The material is super soft though, so if the fit was better, it would be extremely comfortable and stretchy!","26-Nov-2019"
"https://www.nuuly.com/products/twyla-print-top?color=055","Millie","Runs Small","This top was very cropped on me and incredibly tight in the bust and armpits. Usually, I wear an S in Free People, but for this top, I think sizing up would have been best for a cuter fit.","23-Nov-2019"
"https://www.nuuly.com/products/twyla-print-top?color=055","Brooksie","Love","Love this top! Well made and fit perfectly. Lots of compliments, can be worn casual or dressed up.","18-Nov-2019"
"https://www.nuuly.com/products/twyla-print-top?color=055","carolinagirl","Gorgeous","I absolutely love this top. It looks so cute with high waisted jeans. It’s not as see-through as I expected. I‘d feel comfortable just wearing a bra for a date, but will probably slip a camisole underneath for work. Nice details and comfortable fit. A winner! I wear S and M and a M was a nice fit and certainly not too big.","9-Nov-2019"
"https://www.nuuly.com/products/twyla-print-top?color=030","AmandaPattison","Romantic, Unique Top","I originally ordered this top in my very first Nuuly, in my normal size Small. It was uncomfortably tight under the arms and a bit short due to it being cropped--even with high waisted jeans I felt like I was pulling it down constantly. I decided to give it another shot in the next size up and I am so glad I did! It fits perfectly, and offers a touch more movement. Due to the fact that it's somewhat see-through, I don't mind it being a tad less form-fitting. This is not SO sheer that you need to wear anything underneath--I opted for a nude tone bra. I love the cut/fabric and print/color. As a pale redhead with green eyes, this is extremely flattering. I have a small bust (32B) but the cut of this helped to balance my fuller hips. Sexy but classy, and can be dressed more formal. I'm obsessed. I feel like a Pre-Raphaelite painting whenever I wear it!","6-May-2020"
"https://www.nuuly.com/products/twyla-print-top?color=030","ehf109","Nice color and material","Liked this shirt, but couldn't wear it out because of social distancing. I tried it on and it fit, would ride up though, based on me just trying it on. Very see through but really cute.","1-Apr-2020"
"https://www.nuuly.com/products/twyla-print-top?color=030","1979queenbee","Looks best backwards!!!","This top is amazing! I’m thinking I NEED IT! I have it for another week and I don’t think I can part with it, it’s one of my favorite pieces!","29-Mar-2020"
"https://www.nuuly.com/products/twyla-print-top?color=030","Julespalms23","Pretty...but","This was a crop top on me, so I didn’t end up wearing it. It is a beautiful top though.","25-Mar-2020"
"https://www.nuuly.com/products/twyla-print-top?color=030","Winnie2296","Beautiful colors, somehow not see through","Didn’t get to wear but beautiful spring print, bottom of shirt hits right at high waisted jeans on me","12-Mar-2020"
"https://www.nuuly.com/products/twyla-print-top?color=030","baileyyoung516","Fun!","Obviously, it's sheer so you need to wear something under it. It was a bit shorter than I expected, but I wore with high-waisted jeans for a night out and it looked really cute. Could have possibly sized up, but it still fit and looked great.","6-Mar-2020"
"https://www.nuuly.com/products/twyla-print-top?color=030","sammipaul","SO CUTE!!!","I looooooved the Twyla Print Top! It's super romantic, flattering, and unique. I styled it with denim shorts and a bralette, but this could be dressed up for a dinner date. Super dreamy, I would def. borrow again!","4-Mar-2020"
"https://www.nuuly.com/products/twyla-print-top?color=030","Cariss","Great top","I really liked this top. It was great for going out in cold weather. I wore it with high waisted black jeans and got lots of compliments.","3-Mar-2020"
"https://www.nuuly.com/products/twyla-print-top?color=030","K_Spiegs","Unique fit","The fit of this shirt is strange. Its cropped but extra billowy on top making it awkward to style.","28-Feb-2020"
"https://www.nuuly.com/products/twyla-print-top?color=030","Ebrooklynn","Super cute top!","This top was a very cute sheer piece that transitioned well from work to nightlife. Definitely fits more cropped than on the model, but very cute.","28-Feb-2020"
"https://www.nuuly.com/products/twyla-print-top?color=030","sheartay","LOVE THIS TOP","I am obsessed with this top, I almost bought it in the lavender color! I have ordered both colors because it fits so well, is extremely flattering and I received so many compliments each time I wore it in each color.","25-Feb-2020"
"https://www.nuuly.com/products/twyla-print-top?color=030","jammy33","Shorter than expected","I wore this top for a day date to the museum- super cute with great colors. The fabric is light but not too sheer. Way shorter than expected, even with my highest waisted jeans. I had to keep adjusting it and pulling it down to tuck into my pants- not the most comfy shirt to run around in all day.","25-Feb-2020"
"https://www.nuuly.com/products/twyla-print-top?color=030","GraceM","LOVE!! Can't wait to wear in the summer","Bought this one :) It is really beautiful and even though it is sheer, I think you can get away with wearing a nude bra and nothing else under it. I am looking forward to wearing it in the summer with some high waisted jeans. It is definitely cropped","22-Feb-2020"
"https://www.nuuly.com/products/twyla-print-top?color=030","MariaM","Super cute","Runs a little small in the arms and length but great with high waisted jeans. Definitely not as see through as it looks. I wore a nude colored bralette and it worked perfect under it.","19-Feb-2020"
"https://www.nuuly.com/products/twyla-print-top?color=030","bunbun","The cut was a little odd but cute print!","Great top for work. It's sheer so wear a cami underneath. The cut was a little odd but I liked how bouncy it looked.","13-Feb-2020"
"https://www.nuuly.com/products/twyla-print-top?color=030","gracej","Pretty blouse","Super pretty top! Not as see through as I expected. I planned on wearing this more but didn't feel comfortable wearing to work since it was a little low cut, but the sheerness was not a problem.","5-Feb-2020"
"https://www.nuuly.com/products/twyla-print-top?color=030","Gingerstellar","Beautiful feminine top","I got so many compliments. I loved this fit. It’s feminine and can be dressed up but also can be worn with jeans!","4-Feb-2020"
"https://www.nuuly.com/products/twyla-print-top?color=030","Ernprise","Short","Love the look but too short!","3-Feb-2020"
"https://www.nuuly.com/products/twyla-print-top?color=030","bayrobs","So many compliments!","I loved this top! It's easy to dress up or down depending on the occasion, it's comfortable, and very flattering. Despite how sheer it appears, I was able to wear it to work without issue. I don't usually wear a lot of color and this inspired me to try branching out more often in the future. The cherry on top was that I received compliments from just about every demographic - 10/10","31-Jan-2020"
"https://www.nuuly.com/products/twyla-print-top?color=030","Alundy","Loved it","Super flattering and comfortable.","30-Jan-2020"
"https://www.nuuly.com/products/twyla-print-top?color=030","hbarnes24","Fun, flattering top","I loved this top but it felt very narrow on the shoulders. I usually wear a size small or medium and I ordered this top in medium. I would size up.","24-Jan-2020"
"https://www.nuuly.com/products/twyla-print-top?color=030","Allisonm71","Translucent and itchy","The design was cute and but the material is cheap and itchy. Also, just A very busy Look. You have to wear a brakette with it because its translucent so you could easily see a regular bra which isnt flattering. I just didnt like it.","23-Jan-2020"
"https://www.nuuly.com/products/twyla-print-top?color=030","jules5","PERFECT TOP","This top was PERFECT! So cute and comfortable. If you're between sizes, size up!","22-Jan-2020"
"https://www.nuuly.com/products/twyla-print-top?color=030","kasputia","cute!","size up as it is short! very soft material + beautiful color","13-Jan-2020"
"https://www.nuuly.com/products/twyla-print-top?color=030","Mandarvelous","Cute but snug","The shirt is beautiful - soft, well made. But it’s a little snug around the shoulders and arms. I was worried I’d rip it. I recommend sizing up!","13-Jan-2020"
"https://www.nuuly.com/products/twyla-print-top?color=030","aluxehouse","Romantic","I love this top! I paired it with high waisted vintage levis and some gold Gucci platforms for a perfect date-night outfit!","8-Jan-2020"
"https://www.nuuly.com/products/twyla-print-top?color=030","KaseyJ","Its better backwards","Ok, so hear me out. The top is better backwards. I didn't like the open front look on my body so I flipped it around and created a high neck look. Its not see through as long as you wear a nude bra. I wore it to all my Christmas parties and got tons of compliments.","8-Jan-2020"
"https://www.nuuly.com/products/twyla-print-top?color=030","clairison","More Green than Teal","Loved the fancy look of the material while not feeling too overdressed. I wore this over the holidays. It was not the best winter top (not warm) but I make it work.","6-Jan-2020"
"https://www.nuuly.com/products/twyla-print-top?color=030","sgilly","OBSESSED with this top!","This top is so flirty and cute! I loved wearing it out! I thought it would be more sheer, but you don't need a cami underneath.","3-Jan-2020"
"https://www.nuuly.com/products/twyla-print-top?color=030","AllisonG","Fun for many occasions","Loved it!! Wore it Christmas Day with some high waisted black Levi’s! It can be dressed up or down.","1-Jan-2020"
"https://www.nuuly.com/products/twyla-print-top?color=030","SRain23","Cute but need to size up","Never ended up wearing this. I got it to wear as a worm blouse but it is much too cropped for that. I couldn’t find anything to pair it with that didn’t show my stomach. Cute top but def need to size up.","18-Dec-2019"
"https://www.nuuly.com/products/twyla-print-top?color=030","gillybee","sleeves bothered me","I loved everything about this too except the shoulder dressing at the top. Too frilly and didn't lay flat","10-Dec-2019"
"https://www.nuuly.com/products/twyla-print-top?color=030","Liv","Great Going Out Top","Love this cute top - very flattering and not too sheer, so I didn't need to wear a bra with it. Great for going out to a bar/club or nice restaurant. Will be wearing it a lot in the future!","9-Dec-2019"
"https://www.nuuly.com/products/twyla-print-top?color=030","Abracadabra","Lovely flowy fabric but little too small","This shirt has potential! It's so cute... wish I could have worn it with my high-waisted jeans :(. Ordered a small (5'5"" 125 lbs). I'm not a long-torsoed tall gal but this crop top was shorter than I'd like / pulled up easily and shoulders were tight.","6-Dec-2019"
"https://www.nuuly.com/products/twyla-print-top?color=030","Katy","Cute","Cute, good going out top. It is sheer but not as sheer on as I had first thought. Good with a bralette","6-Dec-2019"
"https://www.nuuly.com/products/twyla-print-top?color=030","Jenatracey","Didn’t fit right","This did not work for me, to short, rode up when you put it on.","EMPLOYEE REVIEW"
"https://www.nuuly.com/products/twyla-print-top?color=030","GGHIRT","Love this top!","Love this top.. fits well. It’s a little see through in the light so be prepared to wear a bralette/cammy under.","1-Dec-2019"
"https://www.nuuly.com/products/twyla-print-top?color=030","LaurenD","Definitely size up, this runs sooo small!","I shop this brand often, so I expected the sizing to be true to size. This did not fit how it appears in the photos - it didn't even cover my belly button, and the neckline was extremely deep at that! It was all around just teeny tiny - shoulders were tight, sleeves didn't come to my wrists.. I was pretty bummed. Even sizing up to a large I would still worry this was an extreme crop top! I do have a more athletic, straight build, so maybe that's why... The material is super soft though, so if the fit was better, it would be extremely comfortable and stretchy!","26-Nov-2019"
"https://www.nuuly.com/products/twyla-print-top?color=030","Millie","Runs Small","This top was very cropped on me and incredibly tight in the bust and armpits. Usually, I wear an S in Free People, but for this top, I think sizing up would have been best for a cuter fit.","23-Nov-2019"
"https://www.nuuly.com/products/twyla-print-top?color=030","Brooksie","Love","Love this top! Well made and fit perfectly. Lots of compliments, can be worn casual or dressed up.","18-Nov-2019"
