"links_link","links_reviews_name","links_reviews_title","links_reviews_text","links_reviews_date"
"https://www.nuuly.com/products/still-on-vacay-midi-dress?color=069","DelBud","Great pattern, fits well","The fabric and cut are great for dressing up or down, and the coverage on top makes it great for video calls or the weekend. I’m thinking about keeping it!","16-May-2020"
"https://www.nuuly.com/products/still-on-vacay-midi-dress?color=069","Lifeisbeautiful","Beautiful colors and great fit","Love the smocking up top, and free flowing bottom. Even more beautiful in person, and most of all so comfortable! Decided to keep!","14-May-2020"
"https://www.nuuly.com/products/still-on-vacay-midi-dress?color=069","Eliza","Great","Super lightweight, fun and cute! Bonus, it covers your bra :)","10-Jan-2020"
"https://www.nuuly.com/products/one-of-a-kind-city-sweatshirt?color=060","bigblueknome","I love LA","I liked wearing this slightly off the shoulder, with leggings. Comfy, casual and a tiny bit sexy.","19-May-2020"
"https://www.nuuly.com/products/one-of-a-kind-city-sweatshirt?color=060","juice_armstrong","SO CUTE","wore this around the house and out to get coffee nearly every other day. nice with high waisted bottoms.","14-May-2020"
"https://www.nuuly.com/products/one-of-a-kind-city-sweatshirt?color=060","kait36","Such a fun, funky sweatshirt!","Lovedddd this. I am not super into the crop but I couldn't resist forcing myself to be into the crop just for this sweatshirt. It is sooo funky and fun. Wore it with leggings and sweatpants because #quarantine, but it would also be super cute with ripped jeans, fun joggers, etc. Recommend especially if you are into the crop!","14-May-2020"
"https://www.nuuly.com/products/one-of-a-kind-city-sweatshirt?color=060","abbysullvn","SO CUTE!","this is the ultimate cropped sweatshirt. it’s interesting, cute, and is made of a super comfy material! i really enjoyed this with high waisted jeans and leggings! only reason i didn’t keep it was that i liked the nyc one slightly better.","13-May-2020"
"https://www.nuuly.com/products/one-of-a-kind-city-sweatshirt?color=060","Aransom","Super funky and fun","I received so many compliments on this sweater so I had to keep it! I threw it on with a baseball cap, jeans, and sneakers but also with leggings too.","7-May-2020"
"https://www.nuuly.com/products/one-of-a-kind-city-sweatshirt?color=060","Mack1011","Lived in this!","Great sweatshirt! Loved the patches and it was a bit cropped, which I loved.","6-May-2020"
"https://www.nuuly.com/products/one-of-a-kind-city-sweatshirt?color=060","Brooke1028","Unique and fun!","Both comfy and cute for working from home. Runs slightly cropped but not too short that it made me insecure. All the patches made it easy to match with everything. Cute paired with high waisted sweats or jeans!","4-May-2020"
"https://www.nuuly.com/products/one-of-a-kind-city-sweatshirt?color=060","EAZ","Bought It","This sweatshirt is cropped enough to make it trendy but long enough to actually wear without feeling insecure. I like that it is a unique sweatshirt, but it is a sweatshirt none the less.","2-May-2020"
"https://www.nuuly.com/products/one-of-a-kind-city-sweatshirt?color=060","emzy","This is a crop top","Nothing wrong with the sweater itself - the style is cute but renters should know it's a crop top and I think the title and description should be rewritten to reflect that. This sweater will cover the top half of your body. If you are petite or xs/s - you can size up and it will be a wide/baggy sweater. All other sizes - expect a crop top. I don't have large boobs or anything - this is not a problem I've ever had before, FYI.","28-Apr-2020"
"https://www.nuuly.com/products/one-of-a-kind-city-sweatshirt?color=060","Rave","Size Up","Loved it. Thought it was really cute but wished I would have sized up. The crop was too short for the joggers I wore it with.","15-Apr-2020"
"https://www.nuuly.com/products/one-of-a-kind-city-sweatshirt?color=060","BKalg83","Super cute!","Super cute. Cropped. I usually wear a size small, but sized up to a medium and glad I did. Wore this all the time around the house.","6-Apr-2020"
"https://www.nuuly.com/products/one-of-a-kind-city-sweatshirt?color=004","bigblueknome","I love LA","I liked wearing this slightly off the shoulder, with leggings. Comfy, casual and a tiny bit sexy.","19-May-2020"
"https://www.nuuly.com/products/one-of-a-kind-city-sweatshirt?color=004","juice_armstrong","SO CUTE","wore this around the house and out to get coffee nearly every other day. nice with high waisted bottoms.","14-May-2020"
"https://www.nuuly.com/products/one-of-a-kind-city-sweatshirt?color=004","kait36","Such a fun, funky sweatshirt!","Lovedddd this. I am not super into the crop but I couldn't resist forcing myself to be into the crop just for this sweatshirt. It is sooo funky and fun. Wore it with leggings and sweatpants because #quarantine, but it would also be super cute with ripped jeans, fun joggers, etc. Recommend especially if you are into the crop!","14-May-2020"
"https://www.nuuly.com/products/one-of-a-kind-city-sweatshirt?color=004","abbysullvn","SO CUTE!","this is the ultimate cropped sweatshirt. it’s interesting, cute, and is made of a super comfy material! i really enjoyed this with high waisted jeans and leggings! only reason i didn’t keep it was that i liked the nyc one slightly better.","13-May-2020"
"https://www.nuuly.com/products/one-of-a-kind-city-sweatshirt?color=004","Aransom","Super funky and fun","I received so many compliments on this sweater so I had to keep it! I threw it on with a baseball cap, jeans, and sneakers but also with leggings too.","7-May-2020"
"https://www.nuuly.com/products/one-of-a-kind-city-sweatshirt?color=004","Mack1011","Lived in this!","Great sweatshirt! Loved the patches and it was a bit cropped, which I loved.","6-May-2020"
"https://www.nuuly.com/products/one-of-a-kind-city-sweatshirt?color=004","Brooke1028","Unique and fun!","Both comfy and cute for working from home. Runs slightly cropped but not too short that it made me insecure. All the patches made it easy to match with everything. Cute paired with high waisted sweats or jeans!","4-May-2020"
"https://www.nuuly.com/products/one-of-a-kind-city-sweatshirt?color=004","EAZ","Bought It","This sweatshirt is cropped enough to make it trendy but long enough to actually wear without feeling insecure. I like that it is a unique sweatshirt, but it is a sweatshirt none the less.","2-May-2020"
"https://www.nuuly.com/products/one-of-a-kind-city-sweatshirt?color=004","emzy","This is a crop top","Nothing wrong with the sweater itself - the style is cute but renters should know it's a crop top and I think the title and description should be rewritten to reflect that. This sweater will cover the top half of your body. If you are petite or xs/s - you can size up and it will be a wide/baggy sweater. All other sizes - expect a crop top. I don't have large boobs or anything - this is not a problem I've ever had before, FYI.","28-Apr-2020"
"https://www.nuuly.com/products/one-of-a-kind-city-sweatshirt?color=004","Rave","Size Up","Loved it. Thought it was really cute but wished I would have sized up. The crop was too short for the joggers I wore it with.","15-Apr-2020"
"https://www.nuuly.com/products/one-of-a-kind-city-sweatshirt?color=004","BKalg83","Super cute!","Super cute. Cropped. I usually wear a size small, but sized up to a medium and glad I did. Wore this all the time around the house.","6-Apr-2020"
"https://www.nuuly.com/products/better-than-ribbed-tee?color=031","voldy","Great color and fit","Love this T! Awesome color and the fit and fabric are flattering","9-Apr-2020"
"https://www.nuuly.com/products/galaxies-mini-dress?color=041","Stanleystu","Tight","It was too tight in the chest, probably not wearable if you're more than a B cup. The print is nice, but the fabric wasn't great and there's no stretch.","13-May-2020"
"https://www.nuuly.com/products/galaxies-mini-dress?color=041","DanielaS","Not for tall women","I am a solid medium but could not button this dress up- not by a long shot! However, even if the dress fit, it was WAY too short! It’s cute though!","3-May-2020"
"https://www.nuuly.com/products/galaxies-mini-dress?color=041","Drea6839","Tiny child’s size dress","Size large Dress could work on on a very slender slender size 2 female.","25-Apr-2020"
"https://www.nuuly.com/products/galaxies-mini-dress?color=041","AtlChristy","Love it!","Love it but it was too small","17-Apr-2020"
"https://www.nuuly.com/products/tintype-striped-cami?color=009","","","",""
"https://www.nuuly.com/products/remi-oversized-button-down-shirt?color=008","Foxheart","Easy and fun","Drape for days but with a collar, so it’s professional attire for video calls.","18-May-2020"
"https://www.nuuly.com/products/remi-oversized-button-down-shirt?color=008","Andrea_S","Light and flowy","Love this top. Great for warmer weather, can be worn with jeans or shorts or dressed up for work. Probably gonna buy this one!","14-May-2020"
"https://www.nuuly.com/products/remi-oversized-button-down-shirt?color=008","MMC","Scratchy.","Cute but kind of scratchy and too wide in the armpits. Lol","9-May-2020"
"https://www.nuuly.com/products/remi-oversized-button-down-shirt?color=008","chaus","Versataile, Comfortable and Cute","Wore it all the time! Was great over a tank or dress, or with pants. French tucked, untucked, all tucked, buttoned, unbuttoned. Just a great versatile shirt, and super comfortable linen-like lightness.","7-May-2020"
"https://www.nuuly.com/products/remi-oversized-button-down-shirt?color=008","Swimwife2","Love this shirt!!","The fit of this shirt is the perfect oversized button down I was looking for. It is oversized with out being super bulky. I wore it out with tight jeans and also wore it tied in the front with shorts. It is lightweight but not see through so you don’t have to layer! Loved it so much I bought it:)","4-May-2020"
"https://www.nuuly.com/products/remi-oversized-button-down-shirt?color=008","Khilgers19","Versatile shirt","Comfortable and very nice material! Could wear it out with jeans or at home with leggings. Purchased this item to wear again.","2-May-2020"
"https://www.nuuly.com/products/remi-oversized-button-down-shirt?color=008","Ginger05","Love this shirt!","Although it is an oversized shirt to begin with I would definitely order a size down. I usually wear a small in shirts and the xs fit perfectly!","30-Apr-2020"
"https://www.nuuly.com/products/remi-oversized-button-down-shirt?color=008","denogal","Cute, comfy -- best for early spring or summer","Cute shirt. Probably best suited to be worn as the model is wearing it...in the summer with white jeans when you have a little tan. It washed me out mid-winter. Very comfy though!","26-Apr-2020"
"https://www.nuuly.com/products/remi-oversized-button-down-shirt?color=008","Mackshad","Super cute oversized button up","This was so cute! Wish I wouldn’t have ordered it when we were all in quarantine. Still, I wore it a lot. It’s super comfy and looks REALLY cute if you tie it up with high waisted jeans. Definitely oversized. Keep that in mind.","2-Apr-2020"
"https://www.nuuly.com/products/sacha-swing-blouse?color=049","","","",""
"https://www.nuuly.com/products/corinthia-ruffled-eyelet-blouse?color=049","Anita","Stunning!","This shirt is gorgeous! The details are beautiful, and it fit great. It came brand new with tags, and I loved it so much I bought it.","7-May-2020"
"https://www.nuuly.com/products/corinthia-ruffled-eyelet-blouse?color=049","sarah945","Perfect blouse for all those Zoom Calls","Love the high neck, the gorgeous color and detailing, and the way it was sheer but still professional for work. Fit well but a smidge boxy -- clearly intentional, and super comfy.","14-Apr-2020"
"https://www.nuuly.com/products/corinthia-ruffled-eyelet-blouse?color=049","BrittS","Absolutely Stunning","Great top to dress up a casual day without looking like you tried. :)","14-Apr-2020"
"https://www.nuuly.com/products/corinthia-ruffled-eyelet-blouse?color=049","Germangirlvt","Adorable and unique","I really loved this top. The blue is a gorgeous color and the stitching and detail is amazing. Sadly it arrived just in time for our Stay at Home order and I never got a chance to wear it anywhere. I will definitely rent this again. It is slightly see through due to the eyelet detail but I would still be comfortable wearing it with just a white bra. It is also quite boxy but a casual front tuck will take care of that.","13-Apr-2020"
"https://www.nuuly.com/products/corinthia-ruffled-eyelet-blouse?color=049","lfg2018","Frilly and fun","This was a fun piece that I never got around to wearing, sadly. Super cute and wish I could've found an excuse to wear it! Love the details and the cutouts make it super playful.","9-Apr-2020"
"https://www.nuuly.com/products/corinthia-ruffled-eyelet-blouse?color=049","Dodo","Fun statement shirt","I wore this multiple times. I wore it backwards a few times with the buttons in the front and I thought that looked cute too! The colors are so vivid in person. You may want to wear a camisole underneath as it is definitely translucent in some lighting with the patterned holes. It's really cute!","7-Apr-2020"
"https://www.nuuly.com/products/corinthia-ruffled-eyelet-blouse?color=049","DLille","Feminine cute spring/summer top","This top can be boxy, but I actually turned it backwards and wore it with the buttons in front. It really cut the boxiness. You may want to wear a camisole underneath, but I didn't. Liked it enough for 5 stars.","5-Apr-2020"
"https://www.nuuly.com/products/the-cate-classic-tie-dyed-buttondown?color=702","Tdavis","Cute & lightweight","Really liked the fit of this, and was a cute light weight shirt. Is definitely thin material, so layered a white tank under and it looked great!","18-May-2020"
"https://www.nuuly.com/products/the-cate-classic-tie-dyed-buttondown?color=702","h3l1ok","This was ok","It was a little too fitted for me!","11-May-2020"
"https://www.nuuly.com/products/the-cate-classic-tie-dyed-buttondown?color=702","Bird","Cute and thin","Warm weather top for sure. This is paper thin so use it to layer or wear on warm days.","9-May-2020"
"https://www.nuuly.com/products/the-cate-classic-tie-dyed-buttondown?color=702","walkablelifestyle","great pattern, comfortable and lightweight","Perfect colors and weight for the warm southern spring weather. I wore it multiple times and purchased it!","27-Apr-2020"
"https://www.nuuly.com/products/the-cate-classic-tie-dyed-buttondown?color=702","Noravelle","Perfect for summer","A bit see through but I loved it. Bought it! Great for summer.","25-Apr-2020"
"https://www.nuuly.com/products/the-cate-classic-tie-dyed-buttondown?color=702","Cate_B","Nice cut, but very sheer fabric","I've rented this shirt in different patterns before and it's a great cut. I found the fabric on this one to be too sheer. It would have worked well as a swim suit cover up. I hate layering tanks under shirts and this fabric required something underneath, so I didn't wear it.","13-Apr-2020"
"https://www.nuuly.com/products/the-cate-classic-tie-dyed-buttondown?color=702","CindyK","pretty but not my color","This is nice, sheer, would be good for someone not as tall as me- the arms were too short on me","13-Apr-2020"
"https://www.nuuly.com/products/the-cate-classic-tie-dyed-buttondown?color=702","stacysumo","Super cute, would rent again!e","I loved the bright, light color. Perfect for spring or summer time. It's lightweight, and especially cute with rolled up sleeves and tucked into jeans.","13-Apr-2020"
"https://www.nuuly.com/products/the-cate-classic-tie-dyed-buttondown?color=702","Jessboggs1","Tie dye!!!","Wore to work w/ navy dress pants- super fun!","11-Apr-2020"
"https://www.nuuly.com/products/the-cate-classic-tie-dyed-buttondown?color=702","itsmekenz","Super comfy and bright!","Loved this comfy oversized sweater. Material is really quality. Perfect piece for jeans and lounging around or casual meetups with friends.","8-Apr-2020"
"https://www.nuuly.com/products/the-cate-classic-tie-dyed-buttondown?color=702","Lwyett1985","Sheer","This too is super cute, but it is NOT cut for a busty gal. This is an issue for me because the top is SHEER. It’s a beautiful gauzy fabric, but there is no give. The buttons were pulling and I’m not even that busty (DD). This would work great as a topper for a tank and tied in the front, but it is really casual so it’s not as versatile as I’d hoped.","28-Mar-2020"
"https://www.nuuly.com/products/the-cate-classic-tie-dyed-buttondown?color=702","leahandavery","Very sheer, but beautiful","Wonderful material, fit, and color. This is very sheer, so be warned. You couldn't wear it in an office environment because of how sheer it is (without a shirt underneath). But perfect for the beach and summer. If between sizes, I'd order down. The back is very long but I didn't mind. I want to keep it because it is so soft but feminine and put together.","22-Mar-2020"
"https://www.nuuly.com/products/miranda-peasant-blouse?color=067","brox","Cute pattern","Love all things leopard! Just beware if you have a larger bust the seams lay a little bit awkward. Perfect for spring weather.","15-May-2020"
"https://www.nuuly.com/products/miranda-peasant-blouse?color=067","AthenSpec","I must stop renting peasant tops","Peasant tops do not flatter my figure. They look so good on the model that I add them into my trunk. I did looooove the colors of this top. Give me the same prints with a fitted v-neck blouse and I'm in!","12-May-2020"
"https://www.nuuly.com/products/miranda-peasant-blouse?color=067","Reneebrunner1","Great in theory","Love the idea of it but in actuality was a little tacky And no where to wear a blouse like that during vivid","12-May-2020"
"https://www.nuuly.com/products/miranda-peasant-blouse?color=067","maggierose","Flowy, bright, colorful, FUN!","So colorful and flowy and fun! I wore this to take some photos for work and everyone complimented it when it was posted. I wouldn't like it if it wasn't tucked in, but soooo cute with a belt. Love the bright pinks and reds too.","9-May-2020"
"https://www.nuuly.com/products/miranda-peasant-blouse?color=067","Sarahleighrabbit","fun and funky","I love this pattern. Overall the top runs large, but part of that is the style, it's billowy, but can easily be cinched with a cute belt. It's the item i decided to keep from my Nuuly this month, so that tells you how much I loved it!","5-May-2020"
"https://www.nuuly.com/products/miranda-peasant-blouse?color=067","BossLadyMig","Channeling Carol Baskin","Fun and vibrant print. Fits TTS with some wiggle room. Seams on the front make the boobs look awesome! A little “tenty” shaped but long enough time tuck in the front. Only downside is that the fabric is very fragile and pulls easily.","9-Apr-2020"
"https://www.nuuly.com/products/miranda-peasant-blouse?color=067","Aewilde","Unflattering","Very poofy, unflattering, the cut and seems on the top sit on top of your chest and make you look very top heavy. Very boho looking","6-Apr-2020"
"https://www.nuuly.com/products/miranda-peasant-blouse?color=067","Russo","Very busy and big","Pattern is busy and runs big and not flattering","28-Mar-2020"
"https://www.nuuly.com/products/miranda-peasant-blouse?color=067","MariaM","Tons of Compliments!","This is a great top for transitioning into spring! Wore it to work a lot and to dinner a few times. Super comfortable and will probably purchase it. I chose the petite size since it was unavailable in the regular small but i didn't see much of a difference (I'm 5'2). Would highly recommend!!!","22-Mar-2020"
"https://www.nuuly.com/products/miranda-peasant-blouse?color=067","Ach2133","Fun Top!","I liked this too. Fit loose, good colors!","14-Mar-2020"
"https://www.nuuly.com/products/miranda-peasant-blouse?color=067","CookieJam","Scratchy","It fits fine, but super wrinkly and scratchy. Too bad, cause the print is super cute, if your skin is not sensitive. Then it might be ok.","11-Mar-2020"
"https://www.nuuly.com/products/miranda-peasant-blouse?color=067","HRae","Colorful and breezy","This shirt was so nice to wear. The fit was perfect although the elastic wrists were bothersome a few times. I live in LA where the weather is always warm and it was just a nice lightweight shirt that I never got overheated. I have a lot of tattoos and the print was so colorful that it nicely covered them up even though the material is sheer on the arms. I would definitely recommend.","11-Mar-2020"
"https://www.nuuly.com/products/miranda-peasant-blouse?color=067","Shelbyyyyyyyy","Unique and Lightweight","I received a ton of compliments when I wore this piece! She's super pretty, very light weight. Get's super wrinkly but is VERY easy to steam (not challenging to get the wrinkles out). Very true to size, but also has a lot of gathering in the back for ease and comfort. Loved the pop of color it brought into my wardrobe this month!","10-Mar-2020"
"https://www.nuuly.com/products/miranda-peasant-blouse?color=067","Bossyboots","So pretty and easy to wear","I wore this a few times on conference calls. I'm a remote worker. Got lots of compliments and felt great in this fun piece.","8-Mar-2020"
"https://www.nuuly.com/products/miranda-peasant-blouse?color=067","SofiaM","Loud and unique","Received many compliments every time I wore this - the pattern is so vibrant and unique, you'll definitely stand out in a room. The material does wrinkle very easily, so keep a steamer handy with this one.","6-Mar-2020"
"https://www.nuuly.com/products/miranda-peasant-blouse?color=067","chloe","perfect statement piece","this was such a fun top to wear! it's flowy, colorful, and i got a ton of complements. i disagree with others on the ""clown sleeve"" feel. i didn't mind them at all. wore to work, out, to a galentines party—it's so versitile!","2-Mar-2020"
"https://www.nuuly.com/products/miranda-peasant-blouse?color=067","jeansjeansjeans","Fun patterned shirt","Loved this shirt, what a fun pattern! I was a bit worried to rent a petite but the MP fit me great. I wore it a lot with wide legged black jeans in and out of work. It looked great with booties and could be dressed up or down.","27-Feb-2020"
"https://www.nuuly.com/products/miranda-peasant-blouse?color=067","CFith","Bright Patterned Blouse","I liked this top, but I didn’t love it. The pattern is so fun and bright! However, I felt like it ran a bit small. I would have wanted the sleeves to be a bit longer. Still, a cute piece!","25-Feb-2020"
"https://www.nuuly.com/products/miranda-peasant-blouse?color=067","aneverydaystorey","Weird Pirate Sleeves","Sleeves were too crazy that they ruined the look even though I loved print and everything else about shirt.","24-Feb-2020"
"https://www.nuuly.com/products/miranda-peasant-blouse?color=067","BellaBueno","Great colors but blah silhouette","Loved this top with a jacket over it to give me more of a waistline. Wish it was slightly more tailored instead of so billowy, but I had fun wearing it nonetheless.","24-Feb-2020"
"https://www.nuuly.com/products/miranda-peasant-blouse?color=067","Olivia17","Fun and flirty","This top was great! I fit very well with my body type and it. I was able to dress it up for work and dress it down for a causal evening out. I would highly recommend this top. So cute!","18-Feb-2020"
"https://www.nuuly.com/products/miranda-peasant-blouse?color=067","lfg2018","Love this blouse","Love love love this top - the pattern is so fun and playful, and the material has such a nice, lightweight feel to it. I got a lot of mileage out of this blouse. It's super cute tucked into jeans, and long enough to wear over leggings. Very comfortable!","17-Feb-2020"
"https://www.nuuly.com/products/miranda-peasant-blouse?color=067","RileyRose","Fun top with a great fit.","I loved this shirt! I received many compliments when I wore. I usually have a hard time with getting lost in flowy shirts because I have larger boobs but this was flowy and still flattering.","16-Feb-2020"
"https://www.nuuly.com/products/miranda-peasant-blouse?color=067","Mamacita_wm","Loved","I loved this top & I got a lot of compliments when I wore it to work! I felt super fabulous and trendy!","14-Feb-2020"
"https://www.nuuly.com/products/miranda-peasant-blouse?color=067","RachDip","Super cute, lots of compliments","This shirt is so comfortable and can be dressed up or worn with jean cutoffs. Plus my boyfriend loved, so I bought it!","7-Feb-2020"
"https://www.nuuly.com/products/miranda-peasant-blouse?color=067","Fashionberry","Fun top!","I wore this a bunch and got a lot of compliments on it. The colors are vibrant and beautiful. Only thing I would say is that is wrinkles easily so you have to steam it everytime you wear it, but it’s worth it.","4-Feb-2020"
"https://www.nuuly.com/products/miranda-peasant-blouse?color=067","Jet1602","So fun","Such a fun top, great colors/pattern and fit true to size.","23-Jan-2020"
"https://www.nuuly.com/products/miranda-peasant-blouse?color=067","ButtonDownButtonUp","Lots of compliments!","This shirt was SO much fun to wear to both a dinner with friends and a normal work day. I got so many compliments every time I wore it. It was such a statement piece! It was a little big, but that was part of the look. I pulled the sleeves up so that the elastic was hidden, which made the shirt feel less like a moo moo. This looked great with black jeans and black booties! It worked well with a brown leather jacket I also rented. It was super comfortable, but also super fun!","22-Jan-2020"
"https://www.nuuly.com/products/miranda-peasant-blouse?color=067","SCND","Fun top, but not if you have a chest","Wanted to love it - bright and colorful - but if you have any kind of a chest it will not fit right. Makes it way too blousy.","8-Jan-2020"
