"links_link","links_reviews_name","links_reviews_title","links_reviews_text","links_reviews_date"
"https://www.nuuly.com/products/puff-sleeve-turtleneck2?color=061","jgaderlund","Great Basic!","Cute with a skirt, dressy pants, or jeans! Very versatile top.","2-Mar-2020"
"https://www.nuuly.com/products/puff-sleeve-turtleneck2?color=061","Jamsam","So much potential!!","If only the neck wasn’t so tight! It was super restricting. Super bummed because it could have been so cute if it wasn’t so tight","1-Mar-2020"
"https://www.nuuly.com/products/puff-sleeve-turtleneck2?color=061","GG12","Classic piece","Considered buying because it was so versatile, comfortable, and fit perfect!","27-Feb-2020"
"https://www.nuuly.com/products/puff-sleeve-turtleneck2?color=061","Amaya","Lovely turtleneck shirt","I really like this shirt. It runs a tad small (I have a long torso) but works well tucked into high waisted work pants. Professional but fun, I received a lot of compliments on it and could definitely wear outside of work!","26-Feb-2020"
"https://www.nuuly.com/products/puff-sleeve-turtleneck2?color=061","Heather7","Nice staple with flare","This seems like a more boring piece but it’s a great staple to wear with more eccentric pieces. I wore it mostly with a patterned Nuuly skirt I got in the same shipment or with jeans and big fun earrings. The shoulder puffs give it some flare so it doesn’t feel that ordinary and a size small was perfect for tucking into jeans. Highly recommend!","26-Feb-2020"
"https://www.nuuly.com/products/puff-sleeve-turtleneck2?color=061","Samg","Loved this!","I love this sweater! It looked really cute with jeans or under a jumper I got in my nuuly box with it! Was able to wear it a few times. Love the sleeves","24-Feb-2020"
"https://www.nuuly.com/products/puff-sleeve-turtleneck2?color=061","LiBrie","Tight neck","I don’t like super tight things around my neck so this was a little uncomfortable. Otherwise cute.","23-Feb-2020"
"https://www.nuuly.com/products/puff-sleeve-turtleneck2?color=061","ketaki6","Adorable puff sleeves","Its a rich color, adorable puff sleeves, very fitting but flattering at the same time.","21-Feb-2020"
"https://www.nuuly.com/products/puff-sleeve-turtleneck2?color=061","Sgove","Didn’t love","The sleeves were a little puffier than expected, and it was a bit too short for me","20-Feb-2020"
"https://www.nuuly.com/products/puff-sleeve-turtleneck2?color=061","nicbut","Weird fit","I think sizing on this top is off. The neck was way too tight, it felt suffocating. Too bad because it’s a lovely shade of red.","18-Feb-2020"
"https://www.nuuly.com/products/puff-sleeve-turtleneck2?color=061","Kcogsy","Very snug","Runs small and also a weird material","17-Feb-2020"
"https://www.nuuly.com/products/puff-sleeve-turtleneck2?color=061","lasala","versatile and fun","This top is so much fun by itself, layered, etc. Very easy to wear!","14-Feb-2020"
"https://www.nuuly.com/products/puff-sleeve-turtleneck2?color=061","evilonion","Soft and versatile","If you want a comfy fall/winter staple this is it. The color, material and fit are spot on. The puff sleeve is a nice touch without being over the top. I would have preferred it to be a tad longer on my long @ss torso but it wasn't really too short either, this is just a personal preference.","8-Feb-2020"
"https://www.nuuly.com/products/puff-sleeve-turtleneck2?color=061","Lee","Really great color and knit","The turtle neck is a little high and tight but otherwise loved wearing it. Into the shoulders","4-Feb-2020"
"https://www.nuuly.com/products/cozy-turtleneck-pullover?color=001","aforan","Wore this so so much","This was a perfect quarantine cozy sweater. I wore w/ leggings or shorts generally! I have a long torso so it wasn’t too long on me, would probably order a medium if I ordered again to have a larger look but the small fit well still!","19-May-2020"
"https://www.nuuly.com/products/cozy-turtleneck-pullover?color=001","Musicfan3121","Perfect for warmth and leggings","I wore this a lot with leggings, which it is great for. It is pretty warm. Nothing crazy special about it but is as pictured and made for a good cozy outfit.","17-May-2020"
"https://www.nuuly.com/products/cozy-turtleneck-pullover?color=001","jshboho","perfect cozy sweater","Perfect for winter. a nice big neck and baggy to wear with leggings. Wore this a ton when I rented it and knew I just had to buy it!","14-May-2020"
"https://www.nuuly.com/products/cozy-turtleneck-pullover?color=001","msanders","Cute, but itchy!","This sweater is the perfect oversized turtle neck! I wore it a ton during the winter because it was so easy to throw on. My only complaint is it's not as comfy as it looks! The fabric is very itchy. Not unbearable, but definitely was a bummer!","EMPLOYEE REVIEW"
"https://www.nuuly.com/products/cozy-turtleneck-pullover?color=001","mkb92","Good sweater but nothing special","I wore this quite a few times! The collar is massive of course, but it looks nice bunched up, and has a slouchy, casual vibe. While soft, it definitely feels like that ""fake"" knit feel, and it captured every single hair and fiber in the world. I could see this pilling like crazy after more wears, so I didn't purchase. Just didn't seem like something that would last years, and that's what I want out of a sweater I'm going to buy. However, for a Nuuly? Absolutely add it to your next one!!","26-Mar-2020"
"https://www.nuuly.com/products/cozy-turtleneck-pullover?color=001","BK_allicat","Closet staple","Nice oversized sweater that I wore a lot. Matches with everything and love the oversized feel of it. Didn't end up buying because the material started to fray a bit.","18-Mar-2020"
"https://www.nuuly.com/products/cozy-turtleneck-pullover?color=001","Nja","Perfect Sweater","Loved it- perfect sweater to throw on with jeans or satin skirt. Always looks effortlessly chic","17-Mar-2020"
"https://www.nuuly.com/products/cozy-turtleneck-pullover?color=001","LaurenMorris","Exactly what you want from a black turtleneck sweater!","I loved this and bought it! Based on the reviews I sized down to XS, and it fit perfectly as a slightly oversized comfy sweater. Super soft and the turtleneck isn't suffocating. Highly recommend for a staple black sweater.","13-Mar-2020"
"https://www.nuuly.com/products/cozy-turtleneck-pullover?color=001","Nettispaghetti","Perfect Turtleneck Sweater","Whats not to love! Cozy & a little oversized! Perfect for a winter-y weather with a jacket or spring weather without one. Loved wearing this item","13-Mar-2020"
"https://www.nuuly.com/products/cozy-turtleneck-pullover?color=001","HiMyNameIsAce","Classic, cozy sweater","It's definitely oversized, but that's what I was hoping for. The neck is big but very cozy. Overall I was pretty pleased with this sweater and may end up keeping it.","12-Mar-2020"
"https://www.nuuly.com/products/cozy-turtleneck-pullover?color=001","Robinz","Over oversized and warm","Was fun for the snow. A lot of material on my neck. Size down","3-Mar-2020"
"https://www.nuuly.com/products/cozy-turtleneck-pullover?color=001","Megggggg","couldn't wear it enough","It was the perfect oversized look. I wore this more times than I can count, and when I wasn't wearing it my roommate was!","27-Feb-2020"
"https://www.nuuly.com/products/cozy-turtleneck-pullover?color=001","Cely718","Cozy","Oversized but still looks fashionable of pairing with skinny/slim bottoms. So cozy!","27-Feb-2020"
"https://www.nuuly.com/products/cozy-turtleneck-pullover?color=001","BlakeL","Versitile sweater","I absolutely loved this sweater. It was incredibly versatile. I loved that I could throw it in w leggings and booties and it felt a little dressier. It was so cozy too!","24-Feb-2020"
"https://www.nuuly.com/products/cozy-turtleneck-pullover?color=001","RecoveringKimyeStan","Perfect sweater","Honestly I wore this too much. So cozy but also very cute!","23-Feb-2020"
"https://www.nuuly.com/products/cozy-turtleneck-pullover?color=001","erinchiff","Amazing","This sweater was amazing. So soft and comfy. I could have gotten a smaller size, it runs a bit large. Didn't matter thought since it is an oversize sweater","21-Feb-2020"
"https://www.nuuly.com/products/cozy-turtleneck-pullover?color=001","TatiM","Love this sweater!","So big, so comfy, just the best. I ended up keeping it.","21-Feb-2020"
"https://www.nuuly.com/products/cozy-turtleneck-pullover?color=001","KC","Neck is BULKY","Loved the style and fit of this sweater but my lord, the neck was so huge and bulky! There was so much material and it didn’t quite hang low enough. Felt like I was trying to keep my head above water the whole time. Wore it more like a sweatshirt on the way to swim practice than a sweater to go out. Just too bulky","20-Feb-2020"
"https://www.nuuly.com/products/cozy-turtleneck-pullover?color=001","MilaWynn","It’s a Keeper","I love this oversized sweater paired with leggings so much for the winter I bought it! A cozy, closet staple","19-Feb-2020"
"https://www.nuuly.com/products/cozy-turtleneck-pullover?color=001","JP","Cute and cozy!","Such a cute sweater with a large neck and perfectly oversized fit.","18-Feb-2020"
"https://www.nuuly.com/products/cozy-turtleneck-pullover?color=001","Alyce","So soft!","Comfortable and amazing. Large fit, but I tucked it into some leggings and it was really cute. I want this sweater for keeps!","14-Feb-2020"
"https://www.nuuly.com/products/cozy-turtleneck-pullover?color=001","AliP","cozy","Runs large, I'm 24 weeks pregnant and almost always wear a M when not pregnant, I ordered this in a Small and was glad I did, still plenty of room and super cozy.","14-Feb-2020"
"https://www.nuuly.com/products/cozy-turtleneck-pullover?color=001","mariahcbaker","In love","I didn’t want to ever take it off! So cosy and went with so much more than I was expecting","13-Feb-2020"
"https://www.nuuly.com/products/cozy-turtleneck-pullover?color=001","LexiLee","Perfect oversized sweater","Super oversized, but I like it that way. Perfect black and perfect softness. I got so many compliments. It’s the end of winter but I’m thinking of buying it!","12-Feb-2020"
"https://www.nuuly.com/products/cozy-turtleneck-pullover?color=001","Dianna","Cozy and oversized","I actually wore this as a dress to work with tights because even the small was very long for me.","11-Feb-2020"
"https://www.nuuly.com/products/cozy-turtleneck-pullover?color=001","madelinew","Love It","This is the sweater I've been looking for all winter! If it had been available on Nuuly in the fall I would have purchased it. Perfect oversized comfy sweater","6-Feb-2020"
"https://www.nuuly.com/products/cozy-turtleneck-pullover?color=001","MMC","Love this sweater","Cool fit, great look.","6-Feb-2020"
"https://www.nuuly.com/products/cozy-turtleneck-pullover?color=001","Alicia","Warm & Cozy!","I sized down on this from previous reviews which I'm glad I did! It was cozy and warm, I paired it with leggings and flats for work. Of course like any other thing black it attracts ever fuzz ball. It was in good shape.","5-Feb-2020"
"https://www.nuuly.com/products/cozy-turtleneck-pullover?color=001","sav94","So comfy","The turtleneck was much large than I anticipated but very cute! I got a lot of compliments in this sweater and its quite warm.","3-Feb-2020"
"https://www.nuuly.com/products/cozy-turtleneck-pullover?color=001","monishashah","Super cozy, almost like a dress","This sweater is so, so cozy. It's quite long, perfect over leggings for a casual day or over tights for a semi-nice outfit.","3-Feb-2020"
"https://www.nuuly.com/products/cozy-turtleneck-pullover?color=001","Bonacker","Too Gigantic","Oversized is one thing, but I looked like I was wearing a circus tent. Not just giant, but a giant box shape. Unworn. Side note: the knit also has stretch to it. You could put four girls in this and have them all wear black leggings and it would make a nice spider costume.","30-Jan-2020"
"https://www.nuuly.com/products/cozy-turtleneck-pullover?color=001","ASale","So comfy","Loved how big the neck cowl was, it was super comfy like a big cloud. I got an XS and it was still very roomy.","EMPLOYEE REVIEW"
"https://www.nuuly.com/products/cozy-turtleneck-pullover?color=001","mmoo","So cute! But size down","Love this sweater and I get so many compliments. I love big clothes but I'd actually size down.","24-Jan-2020"
"https://www.nuuly.com/products/gigi-knit-sweater?color=080","Sydney12x","This coloorrrr","I love this and I'm wearing it as we speak","25-Feb-2020"
"https://www.nuuly.com/products/gigi-knit-sweater?color=080","moelee10","Awkward fit","Gorgeous color, super soft and cozy. However, it fits like a bag. and the S/M is super oversized. I tried to make it work (french tuck, belt, whatever...) but it was just too unflattering for my shape to walk out the door in. Bummer!","21-Feb-2020"
"https://www.nuuly.com/products/gigi-knit-sweater?color=080","Hitopsneaks","Halloween Orange","The orange color was more like a halloween orange compared to the orange in the photo. The material stretches easily and just looks loose and worn. Wore it only once and don't plan on wearing it again.","21-Feb-2020"
"https://www.nuuly.com/products/gigi-knit-sweater?color=080","NBgirl","Orange sweater","Pretty color. Nice and warm","19-Feb-2020"
"https://www.nuuly.com/products/gigi-knit-sweater?color=080","Erinmarie","True to size","Fits as expected","20-Dec-2019"
"https://www.nuuly.com/products/fantasy-print-mesh-blouse?color=009","EmilyS","Looked kinda trashy IRL","I wanted to like it, but the print underneath made it look kinda like a trashy beach shirt.","9-Mar-2020"
"https://www.nuuly.com/products/fantasy-print-mesh-blouse?color=009","mashaz","Sexy and fun!","This is a perfect shirt to wear on a night out. It is made out of a really nice fabric and just feels glamorous overall.","5-Mar-2020"
"https://www.nuuly.com/products/fantasy-print-mesh-blouse?color=009","Lainey","Super Cute Top","I really liked this shirt. I live in LA so the palm tree design was really fun. I loved the sheer back. Fit pretty true to size, if not a little big?","29-Feb-2020"
"https://www.nuuly.com/products/fantasy-print-mesh-blouse?color=009","Lynnsie","Such a fun design","Got tons of compliments on this shirt at work! The back is all just mesh see-through, and the front in the palm tree print under the mesh. So cool","28-Feb-2020"
"https://www.nuuly.com/products/fantasy-print-mesh-blouse?color=009","sarahek","Comfortable and fits well","Cool button-up and fits great!","10-Jan-2020"
"https://www.nuuly.com/products/tie-dye-mid-rise-straight-jeans?color=012","VSC","Cute but too tight at waist","Adorable jeans, but high and no stretch so I couldn’t zip them. I wore them anyway with a loose top.","20-Apr-2020"
"https://www.nuuly.com/products/tie-dye-mid-rise-straight-jeans?color=012","leahraenelle","Small with no stretch","So very cute, I wish they had fit. They are 100% cotton, absolutely no stretch to them and on top of that they were comparable to pants a size smaller.","21-Mar-2020"
"https://www.nuuly.com/products/tie-dye-mid-rise-straight-jeans?color=012","cpsaybrook","Statement denim","I received a ton of compliments in these jeans. Good for a casual Friday. They were fairly long on me, so I had to roll them a few times. Hi rise with a roomy leg.","20-Feb-2020"
"https://www.nuuly.com/products/tie-dye-mid-rise-straight-jeans?color=012","Erinmarie","Run super small","I would potentially size up 2 in these, they run super small. Couldn't get the size 27 to zip!","20-Dec-2019"
"https://www.nuuly.com/products/the-dad-shirt?color=045","Jessboggs1","Got lots of compliments !!","Runs large- wore to work a lot, paired w/ navy and trench coat. Got lots of compliments!","16-Mar-2020"
"https://www.nuuly.com/products/the-dad-shirt?color=045","dmolloy","Cute but big!","Wanted to wear this shirt more but was very baggy! Size down or two","6-Mar-2020"
"https://www.nuuly.com/products/helena-sweater?color=009","Leane","This is a cropped sweater","This cropped sweater is too heavy and bulky.","19-Mar-2020"
"https://www.nuuly.com/products/helena-sweater?color=009","KristieD143","Super fun sweater","The reviews are true, this is a boxy fit. But I just french tuck mine into high waisted jeans and voila! Perfection. I love the design and how thick it is. Definitely keeping this one!","10-Mar-2020"
"https://www.nuuly.com/products/helena-sweater?color=009","Bynthere","Weird fit, cool design","Was super boxy and not soft. Had to wear another shirt under it","9-Mar-2020"
"https://www.nuuly.com/products/helena-sweater?color=009","SansaSnark","Too boxy :(","I loved this in the photos and was so excited to wear it, but as soon as I pulled it out of my bag, I realized it wasn't gonna happen lol. The knit is double layered so the sweater is really stiff and has no drape, and the shoulders made me look like a linebacker. I tried it on, had a laugh, and put it back in my bag for the rest of the month. The pattern and colors were super pretty though, I just wish it had been less bulky so it were more flattering!","9-Mar-2020"
"https://www.nuuly.com/products/helena-sweater?color=009","elliekenny","Cute fun addition to work week!","A little bit cropped and wide but still a cute flattering fit. Super warm.","6-Mar-2020"
"https://www.nuuly.com/products/helena-sweater?color=009","Katef0313","Felt like a linebacker","I should have trusted the reviews, but I really loved the pattern on this! It is really really thick, in a weird way. It felt like wearing a very stiff comforter. I live in Chicago and run really cold, and I think I would be warm in this. Because it was so stiff and I have broader shoulders, I felt like a linebacker in this. It was not a flattering look.","5-Mar-2020"
"https://www.nuuly.com/products/helena-sweater?color=009","EMellie","Very bulky and stiff","I love the look of this sweater, but it is VERY thick and was too stiff for my liking. It made me feel really wide and bulky on top. Might be good for very cold climate?","28-Feb-2020"
"https://www.nuuly.com/products/helena-sweater?color=009","tpvida","Thicker than expected","Very warm and stylish sweater. I wore with black jeans and converse.","26-Feb-2020"
"https://www.nuuly.com/products/helena-sweater?color=009","dmerk","So lovely","I wore this sweater a ton! It's interesting, comfy and looks/feels like a luxury item. I sized up for an oversized feel but it ended up fitting me normally. Always received a compliment when worn---it went great with skinny jeans and loved how it paired with leather pants.","13-Feb-2020"
"https://www.nuuly.com/products/watercolor-floral-blouse?color=000","rentlife","Cute but itchy","It was really cute and great for spring but the seams are totally itchy","24-Apr-2020"
"https://www.nuuly.com/products/watercolor-floral-blouse?color=000","Nidhi","Cute top","Not the colors I usually wear but was cute","2-Apr-2020"
"https://www.nuuly.com/products/watercolor-floral-blouse?color=000","Sarawheeler","Dressy floral shirt","Super cute on","2-Apr-2020"
"https://www.nuuly.com/products/watercolor-floral-blouse?color=000","NuuuuulyStan","Pretty, but strange material","As other reviewers said, the material is stiff and strange. It just didn’t look quite right on me. The shoulders were too large and not flattering.","19-Mar-2020"
"https://www.nuuly.com/products/watercolor-floral-blouse?color=000","Lauryn","Not flattering or comfy","The pattern was so pretty but the fabric was stiff, not what I was expecting. The bow was huge and didn't look right. Wish it could have worked!","18-Mar-2020"
"https://www.nuuly.com/products/watercolor-floral-blouse?color=000","brunnerali","Fun and flirty","Received all sorts of compliments on this when I wore it to work. It looked great with a skirt and I even wore it with a black romper and it was perfect.","17-Mar-2020"
"https://www.nuuly.com/products/watercolor-floral-blouse?color=000","Musicfan3121","Interesting","Definitely an interesting shirt. Between the flowers and the bow tie it was a little on the futsy side, but not in a bad way? Just in a way that you have to own it when wearing.","16-Mar-2020"
"https://www.nuuly.com/products/watercolor-floral-blouse?color=000","StephNuuly","Be ready for compliments!","This was my favorite top I’ve ordered! Got so many compliments. Fabric is stiffer than shown in photos.","16-Mar-2020"
"https://www.nuuly.com/products/watercolor-floral-blouse?color=000","nrv51","Fun, cute, itchy","Not one to wear for a full-day at the office, but definitely cute for a night out. It's sadly just too itchy of a fabric, and the fabric is also why it's such a great piece - it's sturdy enough that it makes the pussy bow very easy to tie and keep propped up.","14-Mar-2020"
"https://www.nuuly.com/products/watercolor-floral-blouse?color=000","Tamara","Terrible material","The colors and pattern were great. However, the material was thin and rough. No stretch to it and the overall fit of the shirt was short. I tried it on but couldn't bring myself to wearing the stiff shirt. Would not recommend.","13-Mar-2020"
"https://www.nuuly.com/products/watercolor-floral-blouse?color=000","Kadyhexum","Loved it","So cute!! One note: it has buttons where you don’t need them and no buttons where they should be: aka the boob part","13-Mar-2020"
"https://www.nuuly.com/products/watercolor-floral-blouse?color=000","Melann","That spring work look","This top for really well, and was very comfortable. I got so many compliments on this top.","11-Mar-2020"
"https://www.nuuly.com/products/watercolor-floral-blouse?color=000","Rochelle","I’ve never been so complimented","People LOVED this top! So did I. The fabric is a bit scratchy, but it didn’t bother me. I could see if your skin was sensitive, it’d be an issue","10-Mar-2020"
"https://www.nuuly.com/products/watercolor-floral-blouse?color=000","stellabluedress","Exactly as pictured.","This is a pretty top. The bow and print are exactly as pictured. Keep in mind, fabric is a bit on the stiffer side.","10-Mar-2020"
"https://www.nuuly.com/products/watercolor-floral-blouse?color=000","sarahbshotland","Cute & dramatic","Really loved the pattern & bow tie. It runs a little short—would probably be good with a high-waisted pant. Very sheer, so need a cute camisole. The material felt crunchy.","10-Mar-2020"
"https://www.nuuly.com/products/watercolor-floral-blouse?color=000","JLaw","pretty print, poor execution","I loved how this looked in photos but in person it was way too big, and the material felt like scratchy plastic. It was a swing and a miss for me!","3-Mar-2020"
"https://www.nuuly.com/products/watercolor-floral-blouse?color=000","Kellynne","So fun, but also profesh","Great fit and fun colors. Got a ton of compliments from my boss and senior management at work!","3-Mar-2020"
"https://www.nuuly.com/products/watercolor-floral-blouse?color=000","MarthaK","ITCHY!!","Love the print, but it was the most uncomfortable, itchy, sweaty synthetic material.","24-Feb-2020"
"https://www.nuuly.com/products/watercolor-floral-blouse?color=000","AmandaS91","Beautiful Color","This shirt was perfect for work. It‘a made of taffeta so it was a little stiff, but it helped the sleeves hold a nice shape. The colors are beautiful!","22-Feb-2020"
"https://www.nuuly.com/products/watercolor-floral-blouse?color=000","GetEdgy","It was good but....","I wore this with another Nuuly piece. It was cute and fun but it was super itchy at every seam. This was such a fun piece to dress down.","EMPLOYEE REVIEW"
"https://www.nuuly.com/products/watercolor-floral-blouse?color=000","CaitND","Not as vibrant in person","Coloring in person was more muted than the photo. Not meant for anyone with a bust making it too small","19-Feb-2020"
"https://www.nuuly.com/products/watercolor-floral-blouse?color=000","Chocolotti","Pretty blouse just not soft to skin","The blouse visually looks beautiful with cool green, black and muted red tones. There are so many ways to make an outfit with it. I tried it on with a black cami underneath, dark denim and a cardi. I was going to wear it to work but the blouse material was stiff, not quite soft to the skin. I didn’t think I could handle wearing it all day. I would probably consider renting it again when the weather is warmer and have an occasion to be a little more dressed up than usual.","17-Feb-2020"
"https://www.nuuly.com/products/watercolor-floral-blouse?color=000","Motown","Great for work","A little stiff Loved it for work!","14-Feb-2020"
"https://www.nuuly.com/products/jungle-high-rise-skinny-jeans?color=029","COally","Fun print, great fit","Loved these! so fun, had to buy.","2-Mar-2020"
"https://www.nuuly.com/products/jungle-high-rise-skinny-jeans?color=029","Pazzie","Fine. A basic with flair.","These pants were fine. They fit well, but had a kind of looser fit in the legs that made me feel frumpy, even in a leopard print. Still- wore them with a black sweatshirt and it was a perfectly ok outfit.","29-Feb-2020"
"https://www.nuuly.com/products/jungle-high-rise-skinny-jeans?color=029","BrooklynQueen","Stretchy","Love these and wore them alot. Could've sized down because they did stretch with one wear.","26-Feb-2020"
"https://www.nuuly.com/products/tomas-wide-leg-jeans?color=092","Sabine99","Comfortable but wish my legs were longer","The high waist and relaxed fit were super comfy. The wide cropped leg was not the most flattering for someone with shorter legs like myself. I paired them with a tank and my ankle hiking boots.","19-May-2020"
"https://www.nuuly.com/products/tomas-wide-leg-jeans?color=092","Wenchblaster","the most amazing pants!!","I sized up from my usualy 26 and the 27 was perfect. I would definitely these if they were a little less expensice. but im happy renting them :) get these!!","14-Apr-2020"
"https://www.nuuly.com/products/tomas-wide-leg-jeans?color=092","Embjjb2277","So cute!!!","I love these!! Gonna rent one side up next month and prolly buy!!!","9-Mar-2020"
