"links_link","links_reviews_name","links_reviews_title","links_reviews_text","links_reviews_date"
"https://www.nuuly.com/products/fringe-studded-moto?color=001","LizNic","Perfect Statement Jacket For Quick Outtings!","I wish all my reviews weren’t “how I wore this during the covid pandemic.” I wish I was socializing because I think I would’ve bought this and worn it to everything. Instead it worked for what I describe to my friends as “paparazzi catches celebrity grocery shopping” look. Sweatpants or joggers, tee, slides, and an awesome statement jacket. A purse half the size of your body usually works for the look too. I felt really cool just going out to pick up prescriptions and walking my dog. I didn’t buy it, but if I had more social opportunities to wear it right now I probably would’ve. I’m usually a large, and this worked to wear open. If I wear going to zipper it in colder weather I’d probably have to size up.","15-Apr-2020"
"https://www.nuuly.com/products/fringe-studded-moto?color=001","kkshops","Fun Statement","Suck a fun leather jacket! I styled it over sweats for a little edge but would be great for dressing up and going out as well!","13-Apr-2020"
"https://www.nuuly.com/products/fringe-studded-moto?color=001","MANMAN","looks cheap on the hanger","looks cheap on the hanger but once u get it on, it’s killer. try it out if ur on the fence!","12-Apr-2020"
"https://www.nuuly.com/products/fringe-studded-moto?color=001","yomajessty","100% THAT jacket","This jacket made me feel like a boss biker chick. I got compliments from women and men - everyone loved it. Probably got more compliments on this jacket than almost anything else I’ve ever worn before. It fit perfectly. I paired it with ripped light wash blue jeans and a black body suit. Paired it with an all black outfit first and it looked a little too biker-y so I switched to the blue jeans and it was perfect.","3-Apr-2020"
"https://www.nuuly.com/products/fringe-studded-moto?color=001","dtarpss","INCREDIBLE","Call me Miley Cyrus, Dolly Parton, and the Instagram Influencer you hate to love. That's how I feel in this jacket. *Chef's Kiss*","24-Mar-2020"
"https://www.nuuly.com/products/fringe-studded-moto?color=001","Phoebemstephens","OBSESSED","I ordered this for a night out in Nashville and got SO many compliments!! It is such a fun piece and SO comfortable and warm. 10/10","15-Mar-2020"
"https://www.nuuly.com/products/fringe-studded-moto?color=001","AshleyC123","Liked","I ordered a medium because it looked cropped but I should have gone with the small!","15-Mar-2020"
"https://www.nuuly.com/products/fringe-studded-moto?color=001","Ladywatts","Badass","Wore this jacket to a fringe and fur themed bachelorette party! Loved every second. Ran true to size and crop. Wore with high waisted jeans.","13-Mar-2020"
"https://www.nuuly.com/products/fringe-studded-moto?color=001","kchristine90","chic!","I wore this to a festival and have never gotten so many compliments in my life! This jacket is so cute and great quality!","11-Mar-2020"
"https://www.nuuly.com/products/fringe-studded-moto?color=001","RentitLikeitsHot","Love Love Love","I absolutely love this item and have gone back and forth on purchasing it. I’m not completely sold on the price vs it not being real leather. But the details are so nice. It really is a special piece on its own.","6-Mar-2020"
"https://www.nuuly.com/products/fringe-studded-moto?color=001","lkystrz","Fringy Cool","With all of the glitz and glam the jacket has, I really only saw opportunities to wear it out at night. However, I'd recommend opting for coat check because it gets HOT. Also, keep an eye on the belt--it has a tendency to fall off!","5-Mar-2020"
"https://www.nuuly.com/products/fringe-studded-moto?color=001","bridgequaa","Incredible. Showstopping. Diva.","I love this jacket, I really considered buying it. I am all about fringe and glitz and this jacket gives you just enough. It is definitely shorter and the arms were just slightly tight, but I was not uncomfortable.","4-Mar-2020"
"https://www.nuuly.com/products/fringe-studded-moto?color=001","alexac28","Fabulous showstopper!","I looooooved this jacket! It was everything the picture shows and more. I wore this out with a pair of black jeans and a tank underneath and I received so many compliments! I ordered a large because the medium was out of stock. It actually ended up being a good fit and not too big for me. The medium would’ve been perfect though!","29-Feb-2020"
"https://www.nuuly.com/products/fringe-studded-moto?color=001","Daford1990","Statement piece","Really fun statement jacket! Only wore once bc it is a little flashy and not for casual wear","24-Feb-2020"
"https://www.nuuly.com/products/fringe-studded-moto?color=001","Olya","Some say too much, I say bring it.","I wore this almost everyday on my trip back home. It’s great paired with a zip up hoodie for some added warm as well! I said it’s smaller only because I should’ve sized up, but it was still comfortable!","22-Feb-2020"
"https://www.nuuly.com/products/fringe-studded-moto?color=001","amalyb","never received more compliments in my life","i was channeling selena in all the best ways. a must keep and would never have purchased on my own but after all the compliments i had to keep it ❤️","20-Feb-2020"
"https://www.nuuly.com/products/fringe-studded-moto?color=001","elvismilk","High quality and cool looking","I sized down because I was impatient and it turns out the XS was too small. Never wore it.","19-Feb-2020"
"https://www.nuuly.com/products/fringe-studded-moto?color=001","anichols","So many compliments!","I was very tempted to buy this, but didn't think I'd wear it enough to justify it. Got tons of compliments when I wore it and fit very true to size.","19-Feb-2020"
"https://www.nuuly.com/products/fringe-studded-moto?color=001","vtgonesf","Where did you get your jacket??","I love this jacket. I have been debating buying something like this for a while. Not your average black jacket with fringe-- the studs are amazing! Not tacky at all. Nice material. Fringe hasn't worn either. Do it up.","18-Feb-2020"
"https://www.nuuly.com/products/fringe-studded-moto?color=001","TylerK","Perfection","Absolutely love this jacket! It fits true to size & makes any boring outfit pop. Just a really fun faux leather jacket.","8-Feb-2020"
"https://www.nuuly.com/products/fringe-studded-moto?color=001","Awm","flashy","I liked this but it was a little too cropped. It made it look a little cheap.","31-Jan-2020"
"https://www.nuuly.com/products/fringe-studded-moto?color=001","ElizaJ","Snug studded rocker","I loved this jacket more than I expected to! It was a little snug but I wouldn't have worn it zipped so it didn't matter much. I wore this with jeans and a t shirt. Such a great piece that people absolutely loved.","31-Jan-2020"
"https://www.nuuly.com/products/fringe-studded-moto?color=001","pleasantthompson","show stopper","loved this jacket so much i bought it! its so fun and got SO many compliments every time i wore it. the style is a little out of my comfort zone but it forced me to own it and have fun with it! amazing statement piece","29-Jan-2020"
"https://www.nuuly.com/products/fringe-studded-moto?color=001","charg0mez","Cutest statement piece","Loved this jacket! I paired it with classic band tees or a plain top so the jacket could shine as its own. If you're bustier I would definitely recommend sizing up as it was a little tighter in the chest area","29-Jan-2020"
"https://www.nuuly.com/products/fringe-studded-moto?color=001","sophisticat","Really cute, got lots of compliments","I liked this jacket a lot—it's great. I wish it felt higher-quality, but otherwise super happy with it.","29-Jan-2020"
"https://www.nuuly.com/products/fringe-studded-moto?color=001","seashelbs","ALL TIME FAVORITE JACKET","STATEMENT PIECE - I am buying. Rented for a fun birthday jacket and ended up wearing 5+ times. SO AWESOME.","27-Jan-2020"
"https://www.nuuly.com/products/fringe-studded-moto?color=001","Sydney12x","Wowza","Suuuper statement piece. Kind of loved it. Never got to wore it how I wanted to. Maybe will revisit.","24-Jan-2020"
"https://www.nuuly.com/products/fringe-studded-moto?color=001","KayKay","Awesome","This jacket is killer. The attention to detail and for the selling price was worth purchasing it for me. Now I just need high waisted jeans to go with it!","19-Jan-2020"
"https://www.nuuly.com/products/fringe-studded-moto?color=001","Megabyte","Fabulous","I loved this! A true statement piece - got tons of compliments when I wore it! Worth renting for sure! AMAZING quality!","17-Jan-2020"
"https://www.nuuly.com/products/fringe-studded-moto?color=001","insainslie","badass jacket","such a cool piece! definitely a statement. love the fringe and the studs. got tons of compliments but wasn't an everyday piece for me. good quality as well.","8-Jan-2020"
"https://www.nuuly.com/products/fringe-studded-moto?color=001","Dorian","Statement","Fun statement jacket. Fit true to size. I would rent again in the summer","3-Jan-2020"
"https://www.nuuly.com/products/fringe-studded-moto?color=001","casual_traveller","LOVED THIS JACKET!","Seriously, such a comfy and fun jacket. True to size; fit my shoulders perfectly.","3-Jan-2020"
"https://www.nuuly.com/products/fringe-studded-moto?color=001","Nbird","Statement piece! Loved!","Had so much fun wearing this jacket! Perfect weight for 40-50s weather - tons of compliments when wearing this jacket.","24-Dec-2019"
"https://www.nuuly.com/products/fringe-studded-moto?color=001","ColleenO","The jacket is amazing! It was a show stopper and I received so many compliments on it. My only callout is that the black color transferred onto some of my clothes that I was wearing. Do not wear with light colored pants!","I wore this jacket with a long sleeve, white Levi's and high tops. It was a killer outfit! I received so many compliments!","24-Dec-2019"
"https://www.nuuly.com/products/fringe-studded-moto?color=001","rose96","Cool statement jacket","Was a little short on me, only because i have a long torso. Very cool leather jacket though, got so many compliments","23-Dec-2019"
"https://www.nuuly.com/products/fringe-studded-moto?color=001","NeeshyPeeshy","Statement jacket of my dreams!","I wish I could have bought this piece! I loved it to so much with jeans or dressed up with a cute skirt. I felt like a total rocker chick and got SO many compliments.","18-Dec-2019"
"https://www.nuuly.com/products/fringe-studded-moto?color=001","Teresann","Show Stopper","Great stylish jacket! Fringe wasn’t too overbearing and the detailing was well done. Wore it out and even to work. Only downside is it isn’t real leather, but the jacket still kept me warm while out in the cold.","16-Dec-2019"
"https://www.nuuly.com/products/fringe-studded-moto?color=001","Safgirl","Such a fun jacket!!","So cute and such a fun jacket!","15-Dec-2019"
"https://www.nuuly.com/products/fringe-studded-moto?color=001","SP","I felt like a BAMF wearing this jacket","Not a great pic of me wearing it I know but it’s the only picture I have. I loved wearing this jacket. I wore it over my bridesmaid dress at n outdoor wedding when it got a little chilly. I got so many compliments on it and all my gal pals wanted to try it on. I highly recommended it. You can us it to dress down or dress up any outfit. It for me perfectly. If you need to wear multiple layers under it you may want to size up.","13-Dec-2019"
"https://www.nuuly.com/products/fringe-studded-moto?color=001","seattletoaustin","Gorgeous statement piece! Loved it","I absolutely love this jacket - it looks expensive while you're wearing it. My friends were like WHERE DID YOU GET THAT the second they saw me in it. Strongly considering keeping it!","25-Nov-2019"
"https://www.nuuly.com/products/stormi-dress?color=091","Chechoc","Never got to wear","I never got to wear this dress because of quarantine. I would have worn it out for a girls night. It fit, but I wish the detail on the waist hit mine perfectly. It was a little too high up. This is a fun dress with stretchy material If you plan to be standing.","20-Apr-2020"
"https://www.nuuly.com/products/we-the-free-aubrey-tee?color=010","Kat31","Perfect, fun white tee","I love this shirt!! I actually purchased it after my order. It's a fun twist on a white tee that is perfect with any denim or even a fun, fabric skirt. It is a looser fit that is easy to tuck in or wear out. It's perfect!","19-May-2020"
"https://www.nuuly.com/products/we-the-free-aubrey-tee?color=010","Demanders","Cool cut","Only issue with this top is that the bottom is more loose/baggy than expected. I would have tucked it in but the top was too short to tuck. I sized down, glad I did.","22-Apr-2020"
"https://www.nuuly.com/products/we-the-free-aubrey-tee?color=010","sav94","Loved it","Loved it so much I bought it! It was a little wide so don’t size up. But overall so comfy and cute to dress up or down","20-Apr-2020"
"https://www.nuuly.com/products/we-the-free-aubrey-tee?color=010","bnstorey","Wanted to love it, but i was swimming in it","Sadly way too big. :(","31-Mar-2020"
"https://www.nuuly.com/products/we-the-free-aubrey-tee?color=010","ericab","Lots of attention","It's a simple piece but my friends lost their minds over it. I'm seriously considering buying it.","31-Mar-2020"
"https://www.nuuly.com/products/we-the-free-aubrey-tee?color=010","mf12","Really cute easy to wear spring top","loved this! really comfortable and found lots of ways to wear it","22-Mar-2020"
"https://www.nuuly.com/products/we-the-free-aubrey-tee?color=010","TaraBean","Comfortable and cute","This shirt first and foremost is sooo comfortable. It was ever so slightly big but I believe it might have been due to use? Either way I still loved it and actually bought it - my fiancée loved it as well and the asymmetrical part let’s you show off some skin without it being overkill.","13-Mar-2020"
"https://www.nuuly.com/products/we-the-free-aubrey-tee?color=010","megErnst","Loved it","Loved it and got tons of compliments on it!","11-Mar-2020"
"https://www.nuuly.com/products/we-the-free-aubrey-tee?color=010","Bloomfield","had to buy","This top is super cute, Not sure if one shoulder is still in style, but got lot's of compliments on it. I ended up buying it because it's a casual, but unique twist on regular, baggy t-shirt and haven't seen it in stores.","23-Feb-2020"
"https://www.nuuly.com/products/we-the-free-aubrey-tee?color=010","hcmaine","Simple with a Twist","Love this top! It is simple and casual, but switches things up. I got a medium, which I normally wear and it was a little big and would fall down showing my bra. I'd size down.","18-Feb-2020"
"https://www.nuuly.com/products/we-the-free-aubrey-tee?color=010","Nicoletta","Obsessed","Love this basic white tee with a twist! It has a wider fitting mid section to hem but I loved that look tucked in the front of denim or untucked and flowy. The side seam has a GIANT tag that was honestly very annoying but other than that I loved loved loved this.","13-Feb-2020"
"https://www.nuuly.com/products/we-the-free-aubrey-tee?color=010","cocodisco","easy breezy","Love this top! I’ve rented in a few colors now and every time I wear It I get compliments. Such an easy way to spice up an outfit. I never figured out how to wear a bra with this top but I also never really tried!","6-Feb-2020"
"https://www.nuuly.com/products/we-the-free-aubrey-tee?color=010","Charlotte","Nice casual going out","I really liked this shirt, it was comfy and reached for it a couple times when I was going out. It was more cropped than I would have liked and would come out of a tuck so it’s not something I would purchase personally.","20-Jan-2020"
"https://www.nuuly.com/products/we-the-free-aubrey-tee?color=010","cocodisco","Easy Breezy","I loved this t-shirt, easy, stylish and head turning. I received lots of compliments and felt cozy doin it!","16-Dec-2019"
"https://www.nuuly.com/products/we-the-free-aubrey-tee?color=010","nataliejoyce","Obsessed","Wore this everyone, immediately knew I needed it forever. So chilllllll","12-Dec-2019"
"https://www.nuuly.com/products/we-the-free-aubrey-tee?color=010","Anima09","Great warm weather piece.","I didn't end up having an opportunity to wear this because the weather in my area took a sudden change- but great if you have any tats that you want to show off, especially. Super loose and comfy through the sleeve and torso. A nice mid-weight that isn't see-through but is floaty and comfortable for warm weather.","6-Dec-2019"
"https://www.nuuly.com/products/we-the-free-aubrey-tee?color=001","Kat31","Perfect, fun white tee","I love this shirt!! I actually purchased it after my order. It's a fun twist on a white tee that is perfect with any denim or even a fun, fabric skirt. It is a looser fit that is easy to tuck in or wear out. It's perfect!","19-May-2020"
"https://www.nuuly.com/products/we-the-free-aubrey-tee?color=001","Demanders","Cool cut","Only issue with this top is that the bottom is more loose/baggy than expected. I would have tucked it in but the top was too short to tuck. I sized down, glad I did.","22-Apr-2020"
"https://www.nuuly.com/products/we-the-free-aubrey-tee?color=001","sav94","Loved it","Loved it so much I bought it! It was a little wide so don’t size up. But overall so comfy and cute to dress up or down","20-Apr-2020"
"https://www.nuuly.com/products/we-the-free-aubrey-tee?color=001","bnstorey","Wanted to love it, but i was swimming in it","Sadly way too big. :(","31-Mar-2020"
"https://www.nuuly.com/products/we-the-free-aubrey-tee?color=001","ericab","Lots of attention","It's a simple piece but my friends lost their minds over it. I'm seriously considering buying it.","31-Mar-2020"
"https://www.nuuly.com/products/we-the-free-aubrey-tee?color=001","mf12","Really cute easy to wear spring top","loved this! really comfortable and found lots of ways to wear it","22-Mar-2020"
"https://www.nuuly.com/products/we-the-free-aubrey-tee?color=001","TaraBean","Comfortable and cute","This shirt first and foremost is sooo comfortable. It was ever so slightly big but I believe it might have been due to use? Either way I still loved it and actually bought it - my fiancée loved it as well and the asymmetrical part let’s you show off some skin without it being overkill.","13-Mar-2020"
"https://www.nuuly.com/products/we-the-free-aubrey-tee?color=001","megErnst","Loved it","Loved it and got tons of compliments on it!","11-Mar-2020"
"https://www.nuuly.com/products/we-the-free-aubrey-tee?color=001","Bloomfield","had to buy","This top is super cute, Not sure if one shoulder is still in style, but got lot's of compliments on it. I ended up buying it because it's a casual, but unique twist on regular, baggy t-shirt and haven't seen it in stores.","23-Feb-2020"
"https://www.nuuly.com/products/we-the-free-aubrey-tee?color=001","hcmaine","Simple with a Twist","Love this top! It is simple and casual, but switches things up. I got a medium, which I normally wear and it was a little big and would fall down showing my bra. I'd size down.","18-Feb-2020"
"https://www.nuuly.com/products/we-the-free-aubrey-tee?color=001","Nicoletta","Obsessed","Love this basic white tee with a twist! It has a wider fitting mid section to hem but I loved that look tucked in the front of denim or untucked and flowy. The side seam has a GIANT tag that was honestly very annoying but other than that I loved loved loved this.","13-Feb-2020"
"https://www.nuuly.com/products/we-the-free-aubrey-tee?color=001","cocodisco","easy breezy","Love this top! I’ve rented in a few colors now and every time I wear It I get compliments. Such an easy way to spice up an outfit. I never figured out how to wear a bra with this top but I also never really tried!","6-Feb-2020"
"https://www.nuuly.com/products/we-the-free-aubrey-tee?color=001","Charlotte","Nice casual going out","I really liked this shirt, it was comfy and reached for it a couple times when I was going out. It was more cropped than I would have liked and would come out of a tuck so it’s not something I would purchase personally.","20-Jan-2020"
"https://www.nuuly.com/products/we-the-free-aubrey-tee?color=001","cocodisco","Easy Breezy","I loved this t-shirt, easy, stylish and head turning. I received lots of compliments and felt cozy doin it!","16-Dec-2019"
"https://www.nuuly.com/products/we-the-free-aubrey-tee?color=001","nataliejoyce","Obsessed","Wore this everyone, immediately knew I needed it forever. So chilllllll","12-Dec-2019"
"https://www.nuuly.com/products/we-the-free-aubrey-tee?color=001","Anima09","Great warm weather piece.","I didn't end up having an opportunity to wear this because the weather in my area took a sudden change- but great if you have any tats that you want to show off, especially. Super loose and comfy through the sleeve and torso. A nice mid-weight that isn't see-through but is floaty and comfortable for warm weather.","6-Dec-2019"
"https://www.nuuly.com/products/eva-faux-fur-jacket?color=012","StephMcNeal83","Sweet comfy jacket","I wore this quite a few times when it was chilly weather… It made anything I wore look cuter and sweeter so if you’re into that sort of thing go for it!","29-Apr-2020"
"https://www.nuuly.com/products/eva-faux-fur-jacket?color=012","Review_Reader","so soft and easy","The material on this was the softest thing I've had on in a while. I actually had strangers ask to touch/pet it. Loved the bomber style of this and it was super versatile- wore with a plain T, jeans and heels for cocktails on the weekend, but also with Chucks and ripped jeans and a graphic tee for a more casual look. Got compliments all around.","EMPLOYEE REVIEW"
"https://www.nuuly.com/products/eva-faux-fur-jacket?color=012","SDdressy","Compliments!","Got so many compliments on this jacket and it is SO soft! Perfect heaviness for spring, just warm enough. Almost bought this.","28-Feb-2020"
"https://www.nuuly.com/products/eva-faux-fur-jacket?color=012","SJSMITH","Loved this jacket!!","Super cozy and perfect for a weekend out with friends. You can dress up or down!","27-Feb-2020"
"https://www.nuuly.com/products/eva-faux-fur-jacket?color=012","GFUNK","Loved it so much I bought it!","Super soft and cuddly and goes with everything.","21-Feb-2020"
"https://www.nuuly.com/products/eva-faux-fur-jacket?color=012","sbecks","So cozy!","I loved wearing this cozy jacket. The wave pattern really stood out in person, which I really liked. The color is a little more pink than the image suggests.","18-Feb-2020"
"https://www.nuuly.com/products/eva-faux-fur-jacket?color=012","kati","Comfy AF","So comfy and so cute! It is so flattering on and looks great over a casual t-shirt!","5-Feb-2020"
"https://www.nuuly.com/products/eva-faux-fur-jacket?color=012","pdxgirl","Soft + fuzzy jacket","Fun + soft. Didn't end up keeping because it lined in just a satin material, vs something cozier.","5-Feb-2020"
"https://www.nuuly.com/products/eva-faux-fur-jacket?color=012","Hales","Holy Cozy","So cozy, so soft, so luxe, so cute. Not too casual, not too dressy. Just get it!","5-Feb-2020"
"https://www.nuuly.com/products/eva-faux-fur-jacket?color=012","allisenj3","Soft, Statement Jacket!","Loved this jacket, definitely ideal for fall or spring and makes a statement. So SOFT!","29-Jan-2020"
"https://www.nuuly.com/products/eva-faux-fur-jacket?color=012","Almkurtz3","Super cute!","I loved this jacket, it’s so cute and incredibly soft. True to size","28-Jan-2020"
"https://www.nuuly.com/products/eva-faux-fur-jacket?color=012","jasmito","Soft and pretty","Highly recommend. Was so fun to have an extra fuzzy jacket during the holidays. It is warmer than it seems.","26-Jan-2020"
"https://www.nuuly.com/products/eva-faux-fur-jacket?color=012","Flowers","Warm, cozy, and goes with everything","I LOVED this jacket so much that I bought it. It's super warm and fuzzy with satin like material lined pockets. I wore it over dresses and even just every day, it works for both.","20-Jan-2020"
"https://www.nuuly.com/products/eva-faux-fur-jacket?color=012","rachelrachel","super fluffy and soo soft","I loved this jacket! I mostly wore with casual outfits, out and about on my days off. Super soft and the color is great!","16-Jan-2020"
"https://www.nuuly.com/products/eva-faux-fur-jacket?color=012","Clubcoco","I liked this but didn't love it","This was okay.. It was soft but not as cozy as I was hoping for.","16-Jan-2020"
"https://www.nuuly.com/products/eva-faux-fur-jacket?color=012","Kbhannahs","So cute!!","The cutest jacket. Love love love. Great fit. Always worried about jackets being short on us tall people (5’10”) but it was great. Purchased item!","13-Jan-2020"
"https://www.nuuly.com/products/eva-faux-fur-jacket?color=012","Loveleigh","Cute!","This is cute and right on trend.","11-Jan-2020"
"https://www.nuuly.com/products/eva-faux-fur-jacket?color=012","Mul205","So soft & fun","Wear it at home to be comfy, to work as a trendy look, or wear at night to look luxe","10-Jan-2020"
"https://www.nuuly.com/products/eva-faux-fur-jacket?color=012","Episkey","Warm and cozy","Really loved the color of this jacket. It’s also warm enough for a cold night out. However, beware of the fuzzies! This jacket loses too much fuzz and it clings to your jeans, sweaters, etc. Lint roller required!!","30-Dec-2019"
"https://www.nuuly.com/products/eva-faux-fur-jacket?color=012","madison","So cozy!","Loved this item! It was so cozy with cute pink silk lining. Had so many compliments and I was so close to purchasing.","16-Dec-2019"
"https://www.nuuly.com/products/eva-faux-fur-jacket?color=012","ObeyDLaw","Fun and flirty","Loved this jacket! Fun way to dress up a pair of jeans but can wear with a dress too! Versatile and comfy. Not too hot as the liner is silky.","10-Dec-2019"
