"links_link","links_reviews_name","links_reviews_title","links_reviews_text","links_reviews_date"
"https://www.nuuly.com/products/zola-pencil-skirt2?color=009","Genericwhitechick","Great Midi Skirt","I was a little unsure on whether or not I'd like this skirt on me but I took a chance and ordered it. Super glad I did! It was form-fitting without being too tight and the fabric was super comfy while still looking chic. I wore this with a turtleneck and tall leather boots and received lots of compliments!","20-Feb-2020"
"https://www.nuuly.com/products/zola-pencil-skirt2?color=009","Doodle","Fun print!","I really like this skirt. It’s a little tight for me, so that’s why I won’t be purchasing. But I love the print and length. I kept it super simple with a black top and combat boots. Would love to rent this again in warmer weather to mix with some other tops.","19-Feb-2020"
"https://www.nuuly.com/products/zola-pencil-skirt2?color=009","TripleA325","Surprisingly versatile","Love this skirt and will probably buy it. The print is fun but can be toned down with neutrals to be work appropriate. Great for the winter season with tights but I could see this working in the fall as well.","19-Feb-2020"
"https://www.nuuly.com/products/zola-pencil-skirt2?color=009","caitomalley","Gorgeous, fun, comfy","Loved this skirt. It's super-soft, comfortable, and flattering. The only downside is that it doesn't have pockets.","18-Feb-2020"
"https://www.nuuly.com/products/zola-pencil-skirt2?color=009","Jjwick","Cute skirt that’s trendy and classic","It fit well with a the right amount of stretch and didn’t get out of shape at all. It’s pretty forgiving and Comfortable!","17-Feb-2020"
"https://www.nuuly.com/products/zola-pencil-skirt2?color=009","phatkat","jags on a pencil skirt","super comfy. you feel super cool in it... can wear this pretty much ANYWHERE!","17-Feb-2020"
"https://www.nuuly.com/products/zola-pencil-skirt2?color=009","JoieW","Cute but wide","I’m tiny but this seemed to be boxy in the first place. Cute print though.","11-Feb-2020"
"https://www.nuuly.com/products/zola-pencil-skirt2?color=009","EsosBesos","Very flattering, fabric was great quality","This is a knit skirt with a bit of stretch and a very flattering silhouette. Tried it on once and knew I was going to buy it. Print is very elevated in person, the jaguars have a lot of detail if you look close. Love it.","27-Jan-2020"
"https://www.nuuly.com/products/zola-pencil-skirt2?color=009","Sdixon94","Slightly Snug","This fabric does not leave much for the imagination. Not recommended for us “lumpy” hip/stomach gals. Even with shape-wear it did not flatter the stomach or hip regions. Only pro was that the length was perfect for a midi look on my 5’2” stature. I wish this would have worked for me, the design is fierce!!","EMPLOYEE REVIEW"
"https://www.nuuly.com/products/zola-pencil-skirt2?color=009","Eliza","Great fit, weird length","Wish it was a little bit longer or shorter, the length hits me in a weird spot.","10-Jan-2020"
"https://www.nuuly.com/products/kathryn-textured-floral-blouse?color=010","Rochelle","Details make this great!","The top is summery, great to wear with shorts or for work if needed. I would roll the sleeves which made it feel more relaxed. I contemplated keeping it.","14-May-2020"
"https://www.nuuly.com/products/kathryn-textured-floral-blouse?color=010","Jroserolf","Meh","The fabric is pretty heavy so it makes the fit/cut very boxy. Not flattering on a petite frame.","28-Apr-2020"
"https://www.nuuly.com/products/kathryn-textured-floral-blouse?color=010","Kmiller","Cute!","This fits well but ultimately not my style","20-Apr-2020"
"https://www.nuuly.com/products/kathryn-textured-floral-blouse?color=010","Nalobelovely","High quality","Loved this! Beautiful top, lotts of detail and perfect fit. It's very blousy but the neckline keeps it from being overwhelming.","17-Apr-2020"
"https://www.nuuly.com/products/kathryn-textured-floral-blouse?color=010","Luluahrose","Oversized, but not the good kind.","I should have sized down, but I don't think I would like the cut even if I had. Fits more like a kimono shirt. Wouldn't rent again.","16-Apr-2020"
"https://www.nuuly.com/products/kathryn-textured-floral-blouse?color=010","carolinestfrancis","Transitional Spring to Summer Top","The material on this top feels really expensive and it's the perfect top to wear with jeans to transition to warmer days. Would love to wear with cutoff shorts in the summer. The fit is loose but the sleeves are a bit tight at the wrists, so I usually wore with the wrists unbuttoned. The top isn't cropped, but wouldn't tuck in to a low cut bottom. With mid/high waisted jeans it tucked in perfectly.","15-Apr-2020"
"https://www.nuuly.com/products/kathryn-textured-floral-blouse?color=010","gretaggirl","Great top!","Although it was big and boxy, I really liked this top! Next time I am going to go down a size. It is not see through at all! You can dress it up or wear with jeans!","10-Apr-2020"
"https://www.nuuly.com/products/kathryn-textured-floral-blouse?color=010","Soapdiva","Super cute and versatile shirt","So many options. Comfy, cute and versatile","7-Apr-2020"
"https://www.nuuly.com/products/kathryn-textured-floral-blouse?color=010","DLille","Basic black with a twist","Liked this basic black blouse. It can feel boxy, but if you tuck it helps. I loved the material and it added an edge to an otherwise boring black.","5-Apr-2020"
"https://www.nuuly.com/products/kathryn-textured-floral-blouse?color=010","carly1969","Very nice blouse","I really liked this blouse! It was nice to wear when you wanna dress up jeans or a skirt but casual enough to not look overdressed. It's a nice thick cotton but feels lightweight because of the eyelets. I'd definitely recommend!","28-Mar-2020"
"https://www.nuuly.com/products/kathryn-textured-floral-blouse?color=010","RIRI28","Pretty","Beautiful blouse","26-Mar-2020"
"https://www.nuuly.com/products/kathryn-textured-floral-blouse?color=010","funk","Good quality, weird fit","The eyelet was nice, but the shoulders were weirdly puffy. I didn’t end up wearing it.","24-Mar-2020"
"https://www.nuuly.com/products/kathryn-textured-floral-blouse?color=010","CookieJam","My fav this month","I wore this the most this month, easy to style and comfy to wear. A great easy piece","11-Mar-2020"
"https://www.nuuly.com/products/kathryn-textured-floral-blouse?color=010","Rebecca73","Wish this would have worked..","I love the look of this top, but should have sizes down. The material is beautiful and love everything about it, except it was too big. Size down!!","10-Mar-2020"
"https://www.nuuly.com/products/kathryn-textured-floral-blouse?color=010","cececat","Cute but short","This top was nice, cute detailing in the blouse. However found it to be too short and then the wrists were so tight I could read my watch when buttoned.","10-Mar-2020"
"https://www.nuuly.com/products/kathryn-textured-floral-blouse?color=010","Rochelle","Cute","I liked it. Very comfortable and versatile with lots of details","10-Mar-2020"
"https://www.nuuly.com/products/kathryn-textured-floral-blouse?color=010","AussieNeen","It's really large so you might need to go down a size","It's pretty but also quite large so you might want to go down a size?","8-Mar-2020"
"https://www.nuuly.com/products/kathryn-textured-floral-blouse?color=010","MLee","Textured Floral Blouse","I liked it. It is swingy and wider than it looks. Hits at the hip. I couldn't tuck it in or 1/2 tuck it.","4-Mar-2020"
"https://www.nuuly.com/products/kathryn-textured-floral-blouse?color=010","Elizabeth","Great Top","loved this! easy blouse to throw on over jeans and still look put together.","2-Mar-2020"
"https://www.nuuly.com/products/kathryn-textured-floral-blouse?color=010","burtrae","Closet staple","I love this top! It's definitely boxy, but if you tuck in the front a little it looks great. I really liked the textured/lacy overlay - it makes for a unique black top, and something you can wear to work, going out, or casually. I truly think this top is a closet staple.","29-Feb-2020"
"https://www.nuuly.com/products/kathryn-textured-floral-blouse?color=010","CathleenSimmons","Flowy and comfortable","Loved this top! Super easy to wear with everything. I am a nursing mom so it even was wonderful for that. Looks great untucked or with french tuck and high waisted bottoms. Win on all!","28-Feb-2020"
"https://www.nuuly.com/products/kathryn-textured-floral-blouse?color=010","cofrags","Keeping this!! Fun & Versatile","I love this blouse! I think it's versatile--i.e. I've worn it with a wool poncho over it, with jeans, leggings, etc. and I plan to wear it through the spring and even into summer with shorts. I got a lot of compliments. In terms of fit, it's definitely generous and flowy but I don't think it looks too baggy or anything. I'm 5'9"" and 150lbs and I got the 6 which to me seems true to size.","28-Feb-2020"
"https://www.nuuly.com/products/kathryn-textured-floral-blouse?color=010","New2nuuly","Short n boxy but cute","It is kind of boxy and short in the front and back (even on a petite with a short torso), but you can make it work! It’s a heavier cotton fabric, which felt nice. There are some eyelets, but it’s not see through by any means.","28-Feb-2020"
"https://www.nuuly.com/products/kathryn-textured-floral-blouse?color=010","mliang791","LOVE","Loved this piece! I wore it so much and got so many compliments. A really versatile piece! One thing is that the arm holes when buttoned were a little bit too small, so I had to wear the sleeves unbuttoned. It wasn't a huge issue, but just something to be aware of!","26-Feb-2020"
"https://www.nuuly.com/products/kathryn-textured-floral-blouse?color=010","CACat","Not flattering on me","Frumpy. Did not look good on me.","26-Feb-2020"
"https://www.nuuly.com/products/kathryn-textured-floral-blouse?color=010","Beachykeen1010","Not flattering","Pirate vibes, unfortunately","25-Feb-2020"
"https://www.nuuly.com/products/kathryn-textured-floral-blouse?color=010","LadyWill","Beautiful blouse","Love love love this top. Great for work or going out on date night. Comfortable loose fit with a chic look.","24-Feb-2020"
"https://www.nuuly.com/products/kathryn-textured-floral-blouse?color=010","MsArtist","Cute basic","This was really cute, but I think it must run small, I’m usually a four in tops and this was a little bit on the small side, though it still worked. It’s not lined- the eyelet holes to show a tiny bit of skin through them so you need a cami if you are modest!","24-Feb-2020"
"https://www.nuuly.com/products/kathryn-textured-floral-blouse?color=010","RecoveringKimyeStan","So perf","The details in this shirt is what sold it. It’s such a cute, yet very detailed shirt. Tons of compliments wearing this!","23-Feb-2020"
"https://www.nuuly.com/products/kathryn-textured-floral-blouse?color=010","momandkid","Fun","Lovely shirt. Billowy but not overwhelming. Just a little large.","23-Feb-2020"
"https://www.nuuly.com/products/kathryn-textured-floral-blouse?color=010","VivaLaLida","weird fit","This fit me very strangely and made me look kind of frumpy! HAH!","21-Feb-2020"
"https://www.nuuly.com/products/kathryn-textured-floral-blouse?color=010","Katty","Baggy and short","It’s a thick shirt with fun designs, but it was too baggy and too short at the same time. I could have gone a size down but then it would have been way too short.","21-Feb-2020"
"https://www.nuuly.com/products/kathryn-textured-floral-blouse?color=010","mrscorytee","Pretty top","I really liked this top. It looks really cute half tucked into a pair of high-waisted jeans. I am hoping it is available in other colors for spring.","20-Feb-2020"
"https://www.nuuly.com/products/kathryn-textured-floral-blouse?color=010","enono","Never Worn","Did not work at all for me. Very boxy - felt like I pirate. I tried tucking it in for work, but then it would stick straight out since it was such a stiff material.","20-Feb-2020"
"https://www.nuuly.com/products/kathryn-textured-floral-blouse?color=010","Gigi85","Boxy and odd","I like boxy tops but this one was insanely boxy and and I found it to be really short-even with high waisted jeans","20-Feb-2020"
"https://www.nuuly.com/products/kathryn-textured-floral-blouse?color=010","Mlevien","Fit Didn’t Work","This top did not work for me. It felt boxy and looked silly little girly on me.","19-Feb-2020"
"https://www.nuuly.com/products/kathryn-textured-floral-blouse?color=010","gonzc91","a little bit too short and wide around the arms","great top, but made me look really boxy","18-Feb-2020"
"https://www.nuuly.com/products/kathryn-textured-floral-blouse?color=010","Forever21","Unusual and very pretty","It is a great addition to your closet. It does run wide I would size down if I were to rent it again","15-Feb-2020"
"https://www.nuuly.com/products/kathryn-textured-floral-blouse?color=010","alms633","Can’t unsee","My husband mentioned that the pattern of this shirt was somewhat like male anatomy, and I couldn’t unsee that. Additionally, this top ran pretty big on me, and I just didn’t find the cut/fit flattering. Definitely well made though!","14-Feb-2020"
"https://www.nuuly.com/products/kathryn-textured-floral-blouse?color=010","ChrissyH","Love this!","Love it so much I bought it! Received a tonne of compliments - a great top to wear with jeans & boots. Perfect for all seasons! True to size, the sleeves were a bit tight around the wrist initially but loosen up over time.","14-Feb-2020"
"https://www.nuuly.com/products/kathryn-textured-floral-blouse?color=010","Gretchen","Large sleeves","I prefer a more fitted sleeve.","6-Feb-2020"
"https://www.nuuly.com/products/kathryn-textured-floral-blouse?color=010","Awm","Such a beautiful top","i love the detail on this top. It fits in a really classy way. I might buy it.","31-Jan-2020"
"https://www.nuuly.com/products/kathryn-textured-floral-blouse?color=010","Sdixon94","Casually Cute","So comfy, so cute! You can wear this with skirts and jeans and leggings and yoga pants and shorts and everything in between!! Fits large, but it works for a peasant top vibe. So versatile I wore it lounging around at home, out for drinks, and to work! Ready to buy :)","EMPLOYEE REVIEW"
"https://www.nuuly.com/products/kathryn-textured-floral-blouse?color=001","Rochelle","Details make this great!","The top is summery, great to wear with shorts or for work if needed. I would roll the sleeves which made it feel more relaxed. I contemplated keeping it.","14-May-2020"
"https://www.nuuly.com/products/kathryn-textured-floral-blouse?color=001","Jroserolf","Meh","The fabric is pretty heavy so it makes the fit/cut very boxy. Not flattering on a petite frame.","28-Apr-2020"
"https://www.nuuly.com/products/kathryn-textured-floral-blouse?color=001","Kmiller","Cute!","This fits well but ultimately not my style","20-Apr-2020"
"https://www.nuuly.com/products/kathryn-textured-floral-blouse?color=001","Nalobelovely","High quality","Loved this! Beautiful top, lotts of detail and perfect fit. It's very blousy but the neckline keeps it from being overwhelming.","17-Apr-2020"
"https://www.nuuly.com/products/kathryn-textured-floral-blouse?color=001","Luluahrose","Oversized, but not the good kind.","I should have sized down, but I don't think I would like the cut even if I had. Fits more like a kimono shirt. Wouldn't rent again.","16-Apr-2020"
"https://www.nuuly.com/products/kathryn-textured-floral-blouse?color=001","carolinestfrancis","Transitional Spring to Summer Top","The material on this top feels really expensive and it's the perfect top to wear with jeans to transition to warmer days. Would love to wear with cutoff shorts in the summer. The fit is loose but the sleeves are a bit tight at the wrists, so I usually wore with the wrists unbuttoned. The top isn't cropped, but wouldn't tuck in to a low cut bottom. With mid/high waisted jeans it tucked in perfectly.","15-Apr-2020"
"https://www.nuuly.com/products/kathryn-textured-floral-blouse?color=001","gretaggirl","Great top!","Although it was big and boxy, I really liked this top! Next time I am going to go down a size. It is not see through at all! You can dress it up or wear with jeans!","10-Apr-2020"
"https://www.nuuly.com/products/kathryn-textured-floral-blouse?color=001","Soapdiva","Super cute and versatile shirt","So many options. Comfy, cute and versatile","7-Apr-2020"
"https://www.nuuly.com/products/kathryn-textured-floral-blouse?color=001","DLille","Basic black with a twist","Liked this basic black blouse. It can feel boxy, but if you tuck it helps. I loved the material and it added an edge to an otherwise boring black.","5-Apr-2020"
"https://www.nuuly.com/products/kathryn-textured-floral-blouse?color=001","carly1969","Very nice blouse","I really liked this blouse! It was nice to wear when you wanna dress up jeans or a skirt but casual enough to not look overdressed. It's a nice thick cotton but feels lightweight because of the eyelets. I'd definitely recommend!","28-Mar-2020"
"https://www.nuuly.com/products/kathryn-textured-floral-blouse?color=001","RIRI28","Pretty","Beautiful blouse","26-Mar-2020"
"https://www.nuuly.com/products/kathryn-textured-floral-blouse?color=001","funk","Good quality, weird fit","The eyelet was nice, but the shoulders were weirdly puffy. I didn’t end up wearing it.","24-Mar-2020"
"https://www.nuuly.com/products/kathryn-textured-floral-blouse?color=001","CookieJam","My fav this month","I wore this the most this month, easy to style and comfy to wear. A great easy piece","11-Mar-2020"
"https://www.nuuly.com/products/kathryn-textured-floral-blouse?color=001","Rebecca73","Wish this would have worked..","I love the look of this top, but should have sizes down. The material is beautiful and love everything about it, except it was too big. Size down!!","10-Mar-2020"
"https://www.nuuly.com/products/kathryn-textured-floral-blouse?color=001","cececat","Cute but short","This top was nice, cute detailing in the blouse. However found it to be too short and then the wrists were so tight I could read my watch when buttoned.","10-Mar-2020"
"https://www.nuuly.com/products/kathryn-textured-floral-blouse?color=001","Rochelle","Cute","I liked it. Very comfortable and versatile with lots of details","10-Mar-2020"
"https://www.nuuly.com/products/kathryn-textured-floral-blouse?color=001","AussieNeen","It's really large so you might need to go down a size","It's pretty but also quite large so you might want to go down a size?","8-Mar-2020"
"https://www.nuuly.com/products/kathryn-textured-floral-blouse?color=001","MLee","Textured Floral Blouse","I liked it. It is swingy and wider than it looks. Hits at the hip. I couldn't tuck it in or 1/2 tuck it.","4-Mar-2020"
"https://www.nuuly.com/products/kathryn-textured-floral-blouse?color=001","Elizabeth","Great Top","loved this! easy blouse to throw on over jeans and still look put together.","2-Mar-2020"
"https://www.nuuly.com/products/kathryn-textured-floral-blouse?color=001","burtrae","Closet staple","I love this top! It's definitely boxy, but if you tuck in the front a little it looks great. I really liked the textured/lacy overlay - it makes for a unique black top, and something you can wear to work, going out, or casually. I truly think this top is a closet staple.","29-Feb-2020"
"https://www.nuuly.com/products/kathryn-textured-floral-blouse?color=001","CathleenSimmons","Flowy and comfortable","Loved this top! Super easy to wear with everything. I am a nursing mom so it even was wonderful for that. Looks great untucked or with french tuck and high waisted bottoms. Win on all!","28-Feb-2020"
"https://www.nuuly.com/products/kathryn-textured-floral-blouse?color=001","cofrags","Keeping this!! Fun & Versatile","I love this blouse! I think it's versatile--i.e. I've worn it with a wool poncho over it, with jeans, leggings, etc. and I plan to wear it through the spring and even into summer with shorts. I got a lot of compliments. In terms of fit, it's definitely generous and flowy but I don't think it looks too baggy or anything. I'm 5'9"" and 150lbs and I got the 6 which to me seems true to size.","28-Feb-2020"
"https://www.nuuly.com/products/kathryn-textured-floral-blouse?color=001","New2nuuly","Short n boxy but cute","It is kind of boxy and short in the front and back (even on a petite with a short torso), but you can make it work! It’s a heavier cotton fabric, which felt nice. There are some eyelets, but it’s not see through by any means.","28-Feb-2020"
"https://www.nuuly.com/products/kathryn-textured-floral-blouse?color=001","mliang791","LOVE","Loved this piece! I wore it so much and got so many compliments. A really versatile piece! One thing is that the arm holes when buttoned were a little bit too small, so I had to wear the sleeves unbuttoned. It wasn't a huge issue, but just something to be aware of!","26-Feb-2020"
"https://www.nuuly.com/products/kathryn-textured-floral-blouse?color=001","CACat","Not flattering on me","Frumpy. Did not look good on me.","26-Feb-2020"
"https://www.nuuly.com/products/kathryn-textured-floral-blouse?color=001","Beachykeen1010","Not flattering","Pirate vibes, unfortunately","25-Feb-2020"
"https://www.nuuly.com/products/kathryn-textured-floral-blouse?color=001","LadyWill","Beautiful blouse","Love love love this top. Great for work or going out on date night. Comfortable loose fit with a chic look.","24-Feb-2020"
"https://www.nuuly.com/products/kathryn-textured-floral-blouse?color=001","MsArtist","Cute basic","This was really cute, but I think it must run small, I’m usually a four in tops and this was a little bit on the small side, though it still worked. It’s not lined- the eyelet holes to show a tiny bit of skin through them so you need a cami if you are modest!","24-Feb-2020"
"https://www.nuuly.com/products/kathryn-textured-floral-blouse?color=001","RecoveringKimyeStan","So perf","The details in this shirt is what sold it. It’s such a cute, yet very detailed shirt. Tons of compliments wearing this!","23-Feb-2020"
"https://www.nuuly.com/products/kathryn-textured-floral-blouse?color=001","momandkid","Fun","Lovely shirt. Billowy but not overwhelming. Just a little large.","23-Feb-2020"
"https://www.nuuly.com/products/kathryn-textured-floral-blouse?color=001","VivaLaLida","weird fit","This fit me very strangely and made me look kind of frumpy! HAH!","21-Feb-2020"
"https://www.nuuly.com/products/kathryn-textured-floral-blouse?color=001","Katty","Baggy and short","It’s a thick shirt with fun designs, but it was too baggy and too short at the same time. I could have gone a size down but then it would have been way too short.","21-Feb-2020"
"https://www.nuuly.com/products/kathryn-textured-floral-blouse?color=001","mrscorytee","Pretty top","I really liked this top. It looks really cute half tucked into a pair of high-waisted jeans. I am hoping it is available in other colors for spring.","20-Feb-2020"
"https://www.nuuly.com/products/kathryn-textured-floral-blouse?color=001","enono","Never Worn","Did not work at all for me. Very boxy - felt like I pirate. I tried tucking it in for work, but then it would stick straight out since it was such a stiff material.","20-Feb-2020"
"https://www.nuuly.com/products/kathryn-textured-floral-blouse?color=001","Gigi85","Boxy and odd","I like boxy tops but this one was insanely boxy and and I found it to be really short-even with high waisted jeans","20-Feb-2020"
"https://www.nuuly.com/products/kathryn-textured-floral-blouse?color=001","Mlevien","Fit Didn’t Work","This top did not work for me. It felt boxy and looked silly little girly on me.","19-Feb-2020"
"https://www.nuuly.com/products/kathryn-textured-floral-blouse?color=001","gonzc91","a little bit too short and wide around the arms","great top, but made me look really boxy","18-Feb-2020"
"https://www.nuuly.com/products/kathryn-textured-floral-blouse?color=001","Forever21","Unusual and very pretty","It is a great addition to your closet. It does run wide I would size down if I were to rent it again","15-Feb-2020"
"https://www.nuuly.com/products/kathryn-textured-floral-blouse?color=001","alms633","Can’t unsee","My husband mentioned that the pattern of this shirt was somewhat like male anatomy, and I couldn’t unsee that. Additionally, this top ran pretty big on me, and I just didn’t find the cut/fit flattering. Definitely well made though!","14-Feb-2020"
"https://www.nuuly.com/products/kathryn-textured-floral-blouse?color=001","ChrissyH","Love this!","Love it so much I bought it! Received a tonne of compliments - a great top to wear with jeans & boots. Perfect for all seasons! True to size, the sleeves were a bit tight around the wrist initially but loosen up over time.","14-Feb-2020"
"https://www.nuuly.com/products/kathryn-textured-floral-blouse?color=001","Gretchen","Large sleeves","I prefer a more fitted sleeve.","6-Feb-2020"
"https://www.nuuly.com/products/kathryn-textured-floral-blouse?color=001","Awm","Such a beautiful top","i love the detail on this top. It fits in a really classy way. I might buy it.","31-Jan-2020"
"https://www.nuuly.com/products/kathryn-textured-floral-blouse?color=001","Sdixon94","Casually Cute","So comfy, so cute! You can wear this with skirts and jeans and leggings and yoga pants and shorts and everything in between!! Fits large, but it works for a peasant top vibe. So versatile I wore it lounging around at home, out for drinks, and to work! Ready to buy :)","EMPLOYEE REVIEW"
"https://www.nuuly.com/products/we-dissolve-acid-wash-skinny-jeans?color=092","grannysmith","Add these to your box!","I absolutely loved these jeans! They design was so fun and I didn't find them to be uncomfortable to sit in. They ran a bit long on me but I just rolled them under since I'm only 5ft. I typically wear a 25/26 in jeans and sized up in these. I highly recommend!","27-Apr-2020"
